Symbol,Ask,Bid,Range,AskSize,BidSize,Volume,LastTradeSize,LastTradeWithTime,Name
"DESC",27.7200,27.7000,N/A,3000,3000,0,N/A,"8:00pm - <b>27.2999</b>","Deutsche X-trackers Russell 200"
"DEUS",26.41,26.38,"26.39 - 26.47",200,300,4159,100,"2:51pm - <b>26.41</b>","Deutsche X-trackers Russell 100"
"DEW",42.3900,42.2900,"42.3300 - 42.5000",400,300,1726,200,"2:31pm - <b>42.3447</b>","WisdomTree Global High Dividend"
"DFE",54.910,54.850,"54.851 - 55.090",400,800,238722,100,"3:08pm - <b>54.885</b>","WisdomTree Europe SmallCap Divi"
"DFJ",61.320,61.220,"61.221 - 61.420",500,1300,9815,120,"3:02pm - <b>61.254</b>","WisdomTree Japan SmallCap Fund"
"DGAZ",5.27,5.26,"5.20 - 5.45",2900,44200,4862003,100,"3:14pm - <b>5.27</b>","VelocityShares 3X Inverse Natur"
"DGL",43.37,43.34,"43.27 - 43.45",2000,2000,25462,215,"3:14pm - <b>43.31</b>","PowerShares DB Gold Fund"
"DGP",27.86,27.77,"27.63 - 28.04",100,100,44582,100,"2:59pm - <b>27.69</b>","DB Gold Double Long ETN due Feb"
"DGRO",27.34,27.32,"27.31 - 27.44",13900,6500,178007,100,"3:14pm - <b>27.34</b>","iShares Core Dividend Growth ET"
"DGS",41.33,41.27,"41.28 - 41.52",200,400,70738,100,"3:09pm - <b>41.35</b>","WisdomTree Emerging Market Smal"
"DGT",67.29,67.15,"67.16 - 67.51",200,100,13416,100,"3:09pm - <b>67.25</b>","SPDR Global Dow ETF (based on T"
"DGZ",13.270,13.210,"13.170 - 13.280",600,100,9816,3500,"2:49pm - <b>13.263</b>","DB Gold Short ETN due February "
"DHS",66.17,66.10,"66.08 - 66.37",2900,2000,66508,576,"3:05pm - <b>66.08</b>","WisdomTree High Dividend Fund"
"DHVW",24.68,24.66,"24.67 - 24.72",6100,200,6300,100,"1:43pm - <b>24.67</b>","Diamond Hill Valuation-Weighted"
"DI",50.88,50.02,"50.13 - 50.46",400,300,8671,200,"2:40pm - <b>50.20</b>","PIMCO Diversified Income Active"
"DIA",180.86,180.85,"180.69 - 181.55",300,300,1470041,100,"3:14pm - <b>180.85</b>","SPDR Dow Jones Industrial Avera"
"DIG",34.97,34.94,"34.93 - 35.69",1000,900,45293,100,"3:06pm - <b>34.93</b>","ProShares Ultra Oil & Gas"
"DIM",55.800,55.640,"55.651 - 55.880",500,400,17645,185,"3:02pm - <b>55.723</b>","WisdomTree International MidCap"
"DIRT",31.98,31.92,N/A,300,300,0,N/A,"8:00pm - <b>31.61</b>","iPath Pure Beta Agriculture ETN"
"DIV",25.3400,25.3000,"25.2000 - 25.4000",1600,2700,56871,100,"3:05pm - <b>25.2203</b>","Global X Super Dividend ETF"
"DIVA",26.0300,25.7400,N/A,2900,2900,10,N/A,"8:00pm - <b>25.7901</b>","QuantShares Hedged Dividend Inc"
"DIVC",26.340,26.220,N/A,1000,3800,0,N/A,"12:03pm - <b>26.568</b>","Citigroup Inc. C-Tracks ETN Mil"
"DIVI",16.82,16.75,N/A,100,2900,0,N/A,"8:00pm - <b>16.94</b>","AdvisorShares Athena High Divid"
"DIVY",24.2500,24.0500,"23.8495 - 24.2390",100,800,3782,692,"3:01pm - <b>23.8495</b>","Realty Shares DIVS ETF"
"DJCI",15.44,15.38,"15.39 - 15.44",300,7200,7234,235,"3:12pm - <b>15.40</b>","E-TRACS Linked to the Bloomberg"
"DJD",27.08,26.89,"27.18 - 27.41",100,1200,640,100,"9:30am - <b>27.18</b>","Guggenheim Dow Jones Industrial"
"DJP",23.32,23.31,"23.25 - 23.46",200,3400,239670,4165,"3:12pm - <b>23.33</b>","iPath Bloomberg Commodity Index"
"DLN",76.33,76.30,"76.26 - 76.60",3400,3500,19736,684,"3:10pm - <b>76.33</b>","WisdomTree LargeCap Dividend Fu"
"DLS",60.82,60.76,"60.70 - 60.92",300,100,21980,100,"3:07pm - <b>60.81</b>","WisdomTree International SmallC"
"DNL",48.920,48.800,"48.808 - 49.034",200,400,3731,327,"3:03pm - <b>48.808</b>","WisdomTree Global ex-US Quality"
"DNO",72.220,72.110,"71.490 - 72.769",100,100,20842,350,"2:11pm - <b>71.659</b>","United States Short Oil Fund"
"DOD",18.10,17.75,"17.76 - 18.19",100,500,5476,100,"2:56pm - <b>17.99</b>","Deutsche Bank AG ELEMENTS Dogs "
"DOG",20.97,20.96,"20.89 - 20.99",35800,10800,598069,100,"3:14pm - <b>20.97</b>","ProShares Short Dow30"
"DOL",42.850,42.820,"42.820 - 42.990",400,100,47791,1396,"3:13pm - <b>42.856</b>","WisdomTree International LargeC"
"DON",90.75,90.67,"90.62 - 90.95",4600,500,61555,100,"3:14pm - <b>90.73</b>","WisdomTree MidCap Dividend Fund"
"DOO",38.290,38.250,"38.220 - 38.388",200,700,41872,100,"3:07pm - <b>38.285</b>","WisdomTree International Divide"
"DPK",24.29,24.24,"24.14 - 24.33",100,100,6736,100,"3:11pm - <b>24.27</b>","Direxion Developed Markets Bear"
"DPST",32.5000,31.9200,"31.9739 - 32.4900",100,400,614,250,"2:54pm - <b>31.9739</b>","Direxion Daily Regional Banks B"
"DRIP",24.76,24.73,"23.50 - 24.90",200,300,307368,100,"3:12pm - <b>24.76</b>","Direxion Daily S&P Oil & Gas Ex"
"DRN",26.01,25.99,"25.38 - 26.13",1200,500,108616,100,"3:10pm - <b>26.03</b>","Dexion Daily Real Estate Bull 3"
"DRR",N/A,N/A,"54.98 - 55.17",N/A,N/A,2570,200,"11:15am - <b>55.14</b>","Market Vectors Double Short Eur"
"DRV",11.3900,11.3800,"11.3400 - 11.6850",700,2000,50418,400,"2:53pm - <b>11.3798</b>","Drexion Daily Real Estate Bear "
"DRW",28.780,28.680,"28.671 - 28.830",800,1000,18747,218,"2:29pm - <b>28.671</b>","WisdomTree Global ex-US Real Es"
"DSI",79.75,79.63,"79.58 - 79.94",500,500,21703,100,"3:14pm - <b>79.68</b>","iShares MSCI KLD 400 Social ETF"
"DSUM",22.8800,22.7700,"22.7500 - 22.8762",100,100,2696,1238,"10:55am - <b>22.8762</b>","PowerShares Chinese Yuan Dim Su"
"DTD",77.6100,77.4300,"77.5400 - 77.8980",900,100,4896,200,"2:54pm - <b>77.5483</b>","WisdomTree Total Dividend Fund"
"DTH",37.7400,37.6500,"37.6700 - 37.8050",400,100,17635,280,"3:11pm - <b>37.7029</b>","WisdomTree International High D"
"DTN",77.93,77.83,"77.83 - 78.24",1500,1300,33412,100,"3:06pm - <b>77.87</b>","WisdomTree Dividend Ex-Financia"
"DTO",136.46,135.52,"133.65 - 138.10",200,200,13224,100,"2:29pm - <b>135.15</b>","DB Crude Oil Double Short ETN d"
"DUG",48.6900,48.6500,"47.9200 - 49.0200",700,500,47727,250,"3:13pm - <b>48.9799</b>","ProShares UltraShort Oil & Gas"
"DULL",28.33,28.05,"27.70 - 27.96",600,600,2200,300,"12:04pm - <b>27.96</b>","Direxion Funds ETF"
"DUST",32.70,32.69,"30.34 - 32.88",100,400,7471290,100,"3:15pm - <b>32.67</b>","Direxion Daily Gold Miners Inde"
"DVHL",22.44,21.75,"22.26 - 22.50",100,100,3903,300,"1:49pm - <b>22.26</b>","ETRACS 2xLeveraged Diversified "
"DVP",24.48,24.37,"24.29 - 24.47",400,300,4619,100,"2:42pm - <b>24.29</b>","Deep Value ETF"
"DVY",85.77,85.76,"85.70 - 86.07",100,100,1025105,100,"3:14pm - <b>85.77</b>","iShares Select Dividend ETF"
"DVYA",45.8000,45.7000,"45.7339 - 46.0400",300,100,2537,200,"3:01pm - <b>45.7339</b>","iShares Asia / Pacific Dividend"
"DVYE",35.900,35.780,"35.767 - 35.980",1200,500,67200,125,"3:14pm - <b>35.835</b>","iShares Emerging Markets Divide"
"DVYL",57.08,56.95,"57.02 - 57.67",500,500,3782,100,"1:24pm - <b>57.17</b>","ETRACS Monthly Pay 2x Leveraged"
"DWAQ",77.08,76.92,N/A,1200,100,505,200,"1:25pm - <b>77.04</b>","PowerShares DWA NASDAQ Momentum"
"DWAS",38.3500,38.2800,"38.3304 - 38.4800",300,100,3388,327,"2:13pm - <b>38.3304</b>","PowerShares DWA SmallCap Moment"
"DWM",46.7000,46.6700,"46.6101 - 46.7900",400,700,69148,655,"2:58pm - <b>46.6811</b>","WisdomTree International Equity"
"DWTI",79.7800,79.7100,"77.0209 - 82.6314",1400,1000,3535581,300,"3:14pm - <b>79.7178</b>","VelocityShares 3X Inverse Crude"
"DWX",36.1100,36.0700,"36.0560 - 36.2590",200,200,81209,107,"3:10pm - <b>36.0693</b>","SPDR S&P International Dividend"
"DXD",17.23,17.22,"17.10 - 17.26",47500,25400,983310,383,"3:14pm - <b>17.22</b>","ProShares UltraShort Dow30"
"DXJ",42.16,42.15,"42.12 - 42.30",11800,1200,1689810,100,"3:14pm - <b>42.15</b>","WisdomTree Japan Hedged Equity "
"DXJC",20.59,20.55,"20.53 - 20.57",1100,1000,1600,100,"9:40am - <b>20.53</b>","WisdomTree Japan Hedged Capital"
"DXJF",19.43,19.36,"19.40 - 19.50",300,800,7085,560,"2:36pm - <b>19.41</b>","WisdomTree Japan Hedged Financi"
"DXJH",31.030,31.000,"31.029 - 31.029",1100,1000,400,400,"11:34am - <b>31.029</b>","WisdomTree Japan Hedged Health "
"DXJR",23.54,23.50,"23.54 - 23.56",1200,500,431,100,"12:51pm - <b>23.56</b>","WisdomTree Japan Hedged Real Es"
"DXJT",23.8000,23.7500,"23.7700 - 23.8234",600,1100,1900,100,"11:05am - <b>23.8234</b>","WisdomTree Japan Hedged Tech, M"
"DXUS",22.210,22.180,N/A,1000,500,0,N/A,"8:00pm - <b>21.926</b>","WisdomTree Global ex-U.S. Hedge"
"DYY",3.19,2.98,"3.20 - 3.41",100,200,2690,200,"11:54am - <b>3.20</b>","DB Commodity Double Long ETN du"
"DZK",46.86,46.70,"46.62 - 46.89",1000,900,2538,100,"3:02pm - <b>46.62</b>","Direxion Developed Markets Bull"
"DZZ",5.1500,5.1400,"5.1000 - 5.1473",24900,22200,81986,2200,"2:59pm - <b>5.1473</b>","DB Gold Double Short ETN due Fe"
"EBND",28.22,28.14,"28.15 - 28.24",1200,300,36520,100,"3:11pm - <b>28.18</b>","SPDR Barclays Emerging Markets "
"ECH",37.17,37.12,"37.10 - 37.56",200,600,79054,100,"3:15pm - <b>37.16</b>","iShares MSCI Chile Capped Inves"
"ECNS",44.79,44.41,"44.17 - 44.82",100,100,61633,100,"2:04pm - <b>44.41</b>","iShares MSCI China Small-Cap ET"
"ECON",24.6500,24.6300,"24.6400 - 24.8000",300,1600,83241,1300,"3:08pm - <b>24.6799</b>","EGShares Emerging Markets Consu"
"EDC",63.32,63.29,"63.09 - 64.41",500,200,349216,100,"3:14pm - <b>63.31</b>","Direxion Emerging Markets Bull "
"EDIV",27.68,27.64,"27.64 - 27.82",100,400,16639,100,"3:11pm - <b>27.66</b>","SPDR S&P Emerging Markets Divid"
"EDOG",22.36,22.31,"22.48 - 22.56",100,300,3172,150,"2:27pm - <b>22.48</b>","ALPS Emerging Sector Dividend D"
"EDV",136.23,135.87,"135.72 - 136.83",100,200,26272,100,"3:02pm - <b>136.21</b>","Vanguard Extended Duration Trea"
"EDZ",23.24,23.23,"22.84 - 23.30",3700,1600,838329,100,"3:14pm - <b>23.24</b>","Direxion Emerging Markets Bear "
"EEB",29.410,29.290,"29.290 - 29.550",200,500,6015,400,"2:19pm - <b>29.304</b>","Guggenheim BRIC ETF"
"EEH",17.15,15.84,N/A,100,200,0,N/A,"8:00pm - <b>16.15</b>","Aktiebolaget Svensk Exportkredi"
"EELV",22.44,22.39,"22.39 - 22.51",700,500,60391,100,"3:15pm - <b>22.42</b>","PowerShares S&P Emerging Market"
"EEM",37.17,37.16,"37.12 - 37.38",117600,24200,21160492,100,"3:14pm - <b>37.17</b>","iShares MSCI Emerging Index Fun"
"EEMO",16.050,15.780,N/A,700,100,0,N/A,"3:36pm - <b>16.123</b>","PowerShares S&P Emerging Market"
"EEMS",43.6800,43.5300,"43.6050 - 44.1360",100,200,64912,100,"3:14pm - <b>43.6705</b>","Ishares MSCI Emerging Markets S"
"EEMV",53.5900,53.5800,"53.5320 - 53.7500",1600,200,368830,507,"3:14pm - <b>53.5701</b>","iShares Edge MSCI Min Vol Emerg"
"EES",83.79,83.64,"83.75 - 84.13",1100,1100,7292,206,"3:06pm - <b>83.75</b>","WisdomTree SmallCap Earnings Fu"
"EET",57.95,57.69,"57.77 - 58.43",900,800,4356,100,"2:45pm - <b>57.78</b>","ProShares Ultra MSCI Emerging M"
"EEV",15.38,15.37,"15.22 - 15.39",15200,9000,138673,400,"3:10pm - <b>15.37</b>","ProShares UltraShort MSCI Emerg"
"EFA",58.70,58.69,"58.62 - 58.83",77200,8300,12968214,100,"3:15pm - <b>58.69</b>","iShares MSCI EAFE ETF"
"EFAD",35.1900,35.1200,"35.1000 - 35.3800",1100,100,6737,691,"3:10pm - <b>35.1407</b>","ProShares Trust ProShares MSCI "
"EFAV",67.400,67.390,"67.340 - 67.520",100,1200,493420,158,"3:15pm - <b>67.418</b>","iShares Edge MSCI Min Vol EAFE "
"EFFE",24.7000,24.5500,N/A,1400,500,0,N/A,"8:00pm - <b>24.7642</b>","Global X JPMorgan Efficiente In"
"EFG",68.0700,68.0100,"68.0000 - 68.2200",1500,200,95407,100,"3:11pm - <b>68.0499</b>","iShares MSCI EAFE Growth ETF"
"EFO",89.19,89.11,"89.04 - 89.15",100,500,946,100,"10:04am - <b>89.15</b>","ProShares Ultra MSCI EAFE"
"EFU",35.94,35.79,N/A,2600,1400,110,N/A,"8:00pm - <b>35.12</b>","ProShares UltraShort MSCI EAFE"
"EFV",45.79,45.76,"45.69 - 45.88",600,2100,133314,139,"3:14pm - <b>45.76</b>","iShares MSCI EAFE Value ETF"
"EFZ",31.83,31.82,"31.77 - 31.86",8200,19000,42409,1500,"3:10pm - <b>31.82</b>","ProShares Short MSCI EAFE"
"EGPT",37.74,37.63,"37.08 - 37.80",100,100,81729,100,"2:17pm - <b>37.51</b>","VanEck Vectors Egypt Index ETF"
"EIDO",26.0600,26.0500,"26.0400 - 26.2600",1500,400,510657,400,"3:14pm - <b>26.0512</b>","iShares MSCI Indonesia ETF"
"EIRL",37.88,37.82,"37.83 - 38.08",400,1000,5688,135,"2:53pm - <b>37.85</b>","iShares MSCI Ireland Capped ETF"
"EIS",48.78,48.59,"48.59 - 48.90",300,500,2665,100,"3:04pm - <b>48.59</b>","iShares MSCI Israel Capped Inve"
"ELD",37.86,37.85,"37.84 - 38.04",200,100,51840,100,"3:14pm - <b>37.86</b>","WisdomTree Emerging Markets Loc"
"EMAG",21.7700,21.2400,N/A,200,1000,174,N/A,"8:00pm - <b>21.7699</b>","VanEck Vectors Emerging Markets"
"EMB",116.920,116.910,"116.740 - 117.020",200,1100,1345948,100,"3:15pm - <b>116.945</b>","iShares J,P. Morgan USD Emergin"
"EMBH",25.19,25.10,N/A,4000,4000,0,N/A,"8:00pm - <b>25.37</b>","iShares Interest Rate Hedged Em"
"EMCR",18.7400,18.2100,"18.7458 - 18.7458",700,300,705,195,"9:38am - <b>18.7458</b>","EGShares Emerging Markets CORE "
"EMDD",19.29,19.13,N/A,500,200,0,N/A,"8:00pm - <b>19.34</b>","EGShares EM Strategic Opportuni"
"EMFM",20.68,20.34,"20.30 - 20.74",400,100,7560,159,"12:52pm - <b>20.56</b>","Global X Next Emerging & Fronti"
"EMLB",125.62,41.88,N/A,100,200,0,N/A,"2:11pm - <b>64.00</b>","iPath Long Enhanced MSCI Emergi"
"EMLC",18.9800,18.9700,"18.9600 - 19.0300",5300,200,481649,112,"3:14pm - <b>18.9764</b>","VanEck Vectors J.P. Morgan EM L"
"EMLP",25.3000,25.2800,"25.2700 - 25.4018",11100,9000,225790,354,"3:14pm - <b>25.2968</b>","First Trust North American Ener"
"EMQQ",27.0700,27.0400,"27.0101 - 27.2200",1000,1100,17509,700,"2:42pm - <b>27.0101</b>","Emerging Markets Internet and E"
"EMSA",112.42,37.48,N/A,200,300,0,N/A,"4:59pm - <b>110.00</b>","iPath Short Enhanced MSCI Emerg"
"ENFR",22.83,22.74,"22.69 - 22.82",1300,1100,1969,100,"2:56pm - <b>22.69</b>","Alerian Energy Infrastructure E"
"ENY",8.70,8.36,"8.47 - 8.54",500,1500,1756,100,"10:14am - <b>8.54</b>","Guggenheim Canadian Energy Inco"
"EPHE",36.75,36.70,"36.67 - 37.07",800,100,119773,200,"3:14pm - <b>36.69</b>","iShares MSCI Philippines ETF"
"EPI",21.720,21.710,"21.700 - 21.810",36100,65600,1956659,100,"3:15pm - <b>21.715</b>","WisdomTree India Earnings Fund"
"EPOL",18.21,18.20,"18.18 - 18.30",1400,600,155516,200,"3:13pm - <b>18.21</b>","iShares MSCI Poland Capped ETF"
"EPP",41.62,41.61,"41.59 - 41.77",4200,1000,277941,400,"3:14pm - <b>41.62</b>","iShares MSCI Pacific Ex-Japan I"
"EPRO",27.71,27.59,"27.60 - 27.68",1500,3200,635,405,"2:21pm - <b>27.60</b>","AdvisorShares EquityPro ETF"
"EPS",72.050,71.930,"71.935 - 72.062",1200,300,2667,569,"2:39pm - <b>71.935</b>","WisdomTree Earnings 500 Fund"
"EPU",33.3100,33.2700,"33.2600 - 33.9265",700,200,37892,123,"3:14pm - <b>33.3099</b>","iShares MSCI All Peru Capped ET"
"EPV",51.52,51.45,"51.22 - 51.66",1200,1300,43238,100,"2:52pm - <b>51.52</b>","ProShares UltraShort FTSE Europ"
"EQAL",25.97,25.93,"25.94 - 26.07",2100,7900,18045,100,"3:04pm - <b>25.95</b>","PowerShares Russell 1000 Equal "
"EQL",58.71,58.61,"58.68 - 58.87",3000,500,2024,111,"2:12pm - <b>58.68</b>","ALPS Equal Sector Weight ETF"
"EQLT",28.6000,28.5300,N/A,1700,1700,46,N/A,"8:00pm - <b>28.8999</b>","Workplace Equality Portfolio ET"
"EQWL",41.1900,41.0900,"41.2000 - 41.2313",2200,1500,728,188,"10:49am - <b>41.2313</b>","PowerShares Russell Top 200 Equ"
"EQWM",40.410,40.240,"40.442 - 40.442",3000,2500,229,189,"11:58am - <b>40.442</b>","PowerShares Russell Midcap Equa"
"EQWS",35.6600,35.5400,"35.6468 - 35.6468",1900,1500,100,100,"12:48pm - <b>35.6468</b>","PowerShares Russell 2000 Equal "
"ERO",42.47,41.92,N/A,500,500,0,N/A,"8:00pm - <b>41.63</b>","Barclays PLC iPath EUR/USD Exch"
"ERUS",14.42,14.41,"14.40 - 14.56",400,3300,120436,100,"3:14pm - <b>14.43</b>","iShares MSCI Russia Capped ETF "
"ERX",29.22,29.21,"29.10 - 30.24",1300,400,2217620,100,"3:15pm - <b>29.21</b>","Direxion Energy Bull 3X Shares"
"ERY",14.42,14.41,"13.89 - 14.44",1600,3500,1322459,200,"3:14pm - <b>14.40</b>","Direxion Daily Energy Bear 3X S"
"ERYY",21.9800,21.8600,N/A,700,700,0,N/A,"3:19pm - <b>21.2401</b>","Direxion Daily Energy Bear 1X S"
"ESBA",21.600,21.470,"21.570 - 21.582",500,1500,2000,300,"11:07am - <b>21.582</b>","Empire State Realty OP, L.P. Se"
"ESGN",25.63,25.55,N/A,500,300,0,N/A,"4:00pm - <b>25.77</b>","Columbia Sustainable Internatio"
"ESGS",25.95,25.91,N/A,2000,2000,0,N/A,"3:00pm - <b>26.08</b>","Columbia Sustainable U.S. Equit"
"ESGW",25.85,25.78,N/A,500,300,0,N/A,"3:00pm - <b>25.99</b>","Columbia Sustainable Global Equ"
"ETHO",26.84,26.83,"26.81 - 26.98",3600,100,1036,150,"3:08pm - <b>26.84</b>","Etho Climate Leadership U.S. ET"
"EUDG",22.19,22.14,"22.19 - 22.19",1000,1000,207,100,"10:59am - <b>22.19</b>","WisdomTree Europe Quality Divid"
"EUDV",37.8700,37.6800,N/A,100,1100,15,N/A,"8:00pm - <b>38.7234</b>","ProShares MSCI Europe Dividend "
"EUFL",28.0800,28.0000,N/A,500,500,0,N/A,"8:00pm - <b>29.1332</b>","Direxion Daily European Financi"
"EUFS",24.23,24.18,"24.15 - 24.17",500,500,1109,300,"11:35am - <b>24.15</b>","Direxion Funds ETF"
"EUFX",42.17,42.12,N/A,1300,300,70,N/A,"8:00pm - <b>42.27</b>","ProShares Short Euro"
"EUM",24.08,24.07,"23.94 - 24.09",104000,2200,470037,300,"3:13pm - <b>24.07</b>","ProShares Short MSCI Emerging M"
"EUMV",23.13,23.10,"23.09 - 23.17",200,1500,25577,100,"2:59pm - <b>23.11</b>","iShares Edge MSCI Min Vol Europ"
"EUO",23.660,23.650,"23.550 - 23.680",7100,15400,124650,1000,"3:14pm - <b>23.659</b>","ProShares UltraShort Euro"
"EURL",20.75,20.73,"20.62 - 20.87",1300,200,42082,200,"2:42pm - <b>20.72</b>","Direxion Daily FTSE Europe Bull"
"EUSA",45.64,45.53,"45.51 - 45.70",500,100,2747,200,"2:57pm - <b>45.51</b>","iShares MSCI USA Equal Weighted"
"EUSC",24.25,24.23,"24.21 - 24.30",100,1100,12172,173,"2:46pm - <b>24.24</b>","WisdomTree Europe Hedged SmallC"
"EVX",68.91,68.76,"68.93 - 70.38",1000,100,436,100,"9:36am - <b>68.93</b>","VanEck Vectors Environmental Se"
"EWA",20.550,20.540,"20.520 - 20.630",42900,5400,1202210,100,"3:14pm - <b>20.545</b>","iShares MSCI Australia Index Fu"
"EWC",25.22,25.21,"25.19 - 25.40",39700,30200,635131,100,"3:14pm - <b>25.22</b>","iShares MSCI Canada Index Fund"
"EWD",28.76,28.74,"28.67 - 28.85",3400,2000,80826,100,"3:14pm - <b>28.76</b>","iShares MSCI Sweden Index Fund"
"EWEM",28.78,28.51,"28.71 - 28.90",600,1700,1154,100,"2:08pm - <b>28.71</b>","Guggenheim MSCI Emerging Market"
"EWG",26.010,26.000,"25.980 - 26.111",79000,32000,1549028,100,"3:15pm - <b>26.005</b>","iShares MSCI Germany Index Fund"
"EWH",21.770,21.760,"21.744 - 21.870",37800,40900,859958,100,"3:14pm - <b>21.765</b>","iShares MSCI Hong Kong Index Fu"
"EWI",10.91,10.90,"10.85 - 10.96",89200,17700,419236,100,"3:07pm - <b>10.90</b>","iShares MSCI Italy Capped Index"
"EWJ",12.510,12.500,"12.490 - 12.530",576200,779000,6553043,100,"3:15pm - <b>12.505</b>","iShares MSCI Japan Index Fund"
"EWK",18.93,18.92,"18.84 - 18.94",2000,6000,44298,100,"3:07pm - <b>18.93</b>","iShares MSCI Belgium Capped Inv"
"EWL",30.6100,30.6000,"30.5600 - 30.7000",10200,1800,308580,400,"3:08pm - <b>30.6037</b>","iShares MSCI Switzerland Capped"
"EWM",8.130,8.120,"8.110 - 8.160",65500,39900,638015,100,"3:14pm - <b>8.125</b>","iShares MSCI Malaysia Index Fun"
"EWMC",52.6300,52.4900,"52.6361 - 52.6680",2500,2200,2519,1000,"2:21pm - <b>52.6361</b>","Guggenheim S&P MidCap 400 Equal"
"EWN",24.7000,24.6900,"24.6561 - 24.7732",3100,1800,48238,200,"3:05pm - <b>24.6767</b>","iShares MSCI Netherlands Index "
"EWO",16.230,16.220,"16.200 - 16.256",500,4600,20438,855,"3:02pm - <b>16.202</b>","iShares MSCI Austria Capped Inv"
"EWP",26.64,26.63,"26.60 - 26.73",7600,3200,586050,200,"3:13pm - <b>26.64</b>","iShares MSCI Spain Capped Index"
"EWQ",23.96,23.95,"23.93 - 24.04",6900,7600,190135,300,"3:10pm - <b>23.95</b>","iShares MSCI France Index Fund"
"EWRE",28.06,28.00,"27.87 - 28.06",5000,500,10224,100,"3:06pm - <b>28.02</b>","Guggenheim S&P 500 Equal Weight"
"EWS",10.720,10.710,"10.700 - 10.770",74400,5000,377798,100,"3:14pm - <b>10.715</b>","iShares MSCI Singapore Index Fu"
"EWSC",44.2300,43.9900,"43.9717 - 44.2300",1600,100,1682,109,"2:07pm - <b>43.9717</b>","Guggenheim S&P SmallCap 600 Equ"
"EWT",15.510,15.500,"15.450 - 15.550",29900,155700,2520945,100,"3:14pm - <b>15.505</b>","iShares MSCI Taiwan Index Fund"
"EWU",15.640,15.630,"15.565 - 15.666",95600,182000,1421164,194,"3:14pm - <b>15.635</b>","iShares MSCI United Kingdom ETF"
"EWV",40.860,40.750,"40.723 - 40.898",700,100,5305,256,"12:54pm - <b>40.729</b>","ProShares UltraShort MSCI Japan"
"EWW",47.28,47.27,"47.24 - 47.98",2400,1000,3466482,100,"3:14pm - <b>47.28</b>","iShares MSCI Mexico Capped Inve"
"EWX",42.9300,42.8300,"42.7610 - 43.0699",400,400,20702,300,"3:12pm - <b>42.7878</b>","SPDR S&P Emerging Markets Small"
"EWY",57.15,57.14,"57.10 - 57.47",1400,1300,1239990,100,"3:14pm - <b>57.15</b>","iShares MSCI South Korea Capped"
"EWZ",33.45,33.44,"33.33 - 33.74",2300,27700,5246179,100,"3:14pm - <b>33.45</b>","iShares MSCI Brazil Capped Inde"
"EXI",73.130,72.980,"72.974 - 73.230",700,700,4212,200,"3:06pm - <b>72.974</b>","iShares Global Industrials ETF"
"EXT",74.11,73.82,"73.89 - 74.10",300,300,3073,100,"3:07pm - <b>73.99</b>","WisdomTree Total Earnings Fund"
"EZA",55.70,55.61,"55.55 - 56.38",300,700,407379,100,"3:12pm - <b>55.63</b>","iShares MSCI South Africa Index"
"EZJ",91.08,90.04,"89.68 - 90.11",1500,1600,2663,100,"2:52pm - <b>89.81</b>","ProShares Ultra MSCI Japan"
"EZM",94.84,94.67,"94.70 - 95.13",1000,300,12072,100,"2:50pm - <b>94.82</b>","WisdomTree MidCap Earnings Fund"
"EZY",63.12,62.90,"62.90 - 63.23",1200,400,4440,100,"3:06pm - <b>63.02</b>","WisdomTree Low P/E Fund"
"FAN",13.4000,13.3500,"13.3090 - 13.4148",600,400,21972,164,"2:13pm - <b>13.3796</b>","First Trust ISE Global Wind Ene"
"FAS",28.83,28.82,"28.65 - 29.36",3200,900,1716551,100,"3:15pm - <b>28.81</b>","Direxion Financial Bull 3X Shar"
"FAUS",31.25,30.14,N/A,100,100,105,N/A,"8:00pm - <b>30.59</b>","First Trust Australia AlphaDex "
"FAZ",32.3600,32.3500,"31.6800 - 32.4400",1000,1700,1013101,400,"3:15pm - <b>32.2652</b>","Direxion Financial Bear 3X Shar"
"FAZZ",23.17,23.04,"23.34 - 23.34",700,700,400,200,"9:30am - <b>23.34</b>","Direxion Daily Financial Bear 1"
"FBGX",134.96,134.29,"134.42 - 135.13",500,200,7772,144,"2:52pm - <b>134.77</b>","UBS AG FI Enhanced Large Cap Gr"
"FBND",51.13,50.97,"51.04 - 51.16",1200,100,31521,200,"3:13pm - <b>51.09</b>","Fidelity Total Bond ETF"
"FBT",101.06,100.97,"100.61 - 101.63",500,400,18508,150,"3:06pm - <b>101.02</b>","First Trust Amex Biotech Index "
"FCFI",21.80,21.56,N/A,400,100,0,N/A,"4:00pm - <b>21.85</b>","TrimTabs Intl Free-Cash Flow ET"
"FCG",25.16,25.15,"25.13 - 25.60",2000,1300,275813,700,"3:15pm - <b>25.18</b>","First Trust ISE-Revere Natural "
"FCOM",30.2400,30.1900,"30.1810 - 30.3556",100,200,14207,500,"3:10pm - <b>30.2455</b>","Fidelity MSCI Telecommunication"
"FCOR",51.42,51.37,"51.20 - 51.40",200,100,3669,100,"2:53pm - <b>51.38</b>","Fidelity Corporate Bond ETF"
