Symbol,Ask,Bid,Range,AskSize,BidSize,Volume,LastTradeSize,LastTradeWithTime,Name
"GFY",15.8600,15.8200,"15.8201 - 15.9699",100,100,9787,3000,"1:43pm - <b>15.8201</b>","Western Asset Variable Rate Str"
"GG",16.44,16.43,"16.40 - 16.89",5200,2300,5010933,100,"3:26pm - <b>16.43</b>","Goldcorp Inc. Common Stock"
"GGB",2.650,2.640,"2.600 - 2.680",39700,82600,4571085,100,"3:26pm - <b>2.645</b>","Gerdau S.A. Common Stock"
"GGE",15.9800,15.9500,"15.9192 - 16.0451",100,200,5231,1036,"2:49pm - <b>15.9504</b>","Guggenheim Enhanced Equity Stra"
"GGG",73.23,73.17,"72.59 - 73.82",200,300,135872,100,"3:25pm - <b>73.24</b>","Graco Inc. Common Stock"
"GGM",22.39,22.32,"22.33 - 22.40",200,200,13781,100,"3:17pm - <b>22.39</b>","Guggenheim Credit Allocation Fu"
"GGP",28.72,28.71,"28.63 - 28.90",1300,700,1501618,100,"3:26pm - <b>28.73</b>","General Growth Properties, Inc."
"GGP-A",N/A,N/A,N/A,N/A,N/A,N/A,N/A,N/A,N/A
"GGT",7.55,7.52,"7.43 - 7.60",500,1200,149179,100,"3:23pm - <b>7.53</b>","Gabelli Multi-Media Trust, Inc."
"GGT-B",N/A,N/A,N/A,N/A,N/A,N/A,N/A,N/A,N/A
"GGZ",10.750,10.730,"10.710 - 10.740",200,100,7619,100,"3:24pm - <b>10.715</b>","Gabelli Global Small and Mid Ca"
"GGZ-A",N/A,N/A,N/A,N/A,N/A,N/A,N/A,N/A,N/A
"GHC",488.98,485.67,"484.14 - 491.98",200,100,20357,100,"3:23pm - <b>487.80</b>","Graham Holdings Company Common "
"GHL",22.68,22.66,"22.48 - 23.20",500,200,497762,100,"3:25pm - <b>22.66</b>","Greenhill & Co., Inc. Common St"
"GHM",18.41,18.31,"18.30 - 18.50",100,100,8311,100,"3:24pm - <b>18.50</b>","Graham Corporation Common Stock"
"GHY",15.01,15.00,"15.00 - 15.03",300,500,66599,200,"3:24pm - <b>15.00</b>","Prudential Global Short Duratio"
"GI",4.33,4.31,"4.09 - 4.34",300,100,48461,100,"3:21pm - <b>4.21</b>","EndoChoice Holdings, Inc. Commo"
"GIB",47.78,47.75,"47.43 - 48.00",200,300,65979,100,"3:24pm - <b>47.73</b>","CGI Group, Inc. Common Stock"
"GIL",27.950,27.940,"27.825 - 28.150",700,200,250951,100,"3:25pm - <b>27.945</b>","Gildan Activewear, Inc. Class A"
"GIM",6.1900,6.1800,"6.1800 - 6.2300",600,2500,236854,3000,"3:22pm - <b>6.1821</b>","Templeton Global Income Fund, I"
"GIMO",53.35,53.31,"53.21 - 54.25",300,200,473453,100,"3:25pm - <b>53.35</b>","Gigamon Inc. Common Stock"
"GIS",63.96,63.95,"63.80 - 64.48",1200,1200,2311359,100,"3:26pm - <b>63.97</b>","General Mills, Inc. Common Stoc"
"GJH",10.50,10.31,"10.36 - 10.59",100,200,3225,199,"2:00pm - <b>10.43</b>","Synthetic Fixed-Income Securiti"
"GJO",21.06,20.80,"20.66 - 20.92",1600,100,3027,199,"1:58pm - <b>20.80</b>","Synthetic Fixed-Income Securiti"
"GJP",22.60,22.00,N/A,100,1400,50,N/A,"3:18pm - <b>22.08</b>","Synthetic Fixed-Income Securiti"
"GJR",20.78,20.16,N/A,100,500,0,N/A,"4:00pm - <b>20.39</b>","Synthetic Fixed-Income Securiti"
"GJS",18.41,18.07,"18.03 - 18.28",200,100,1927,100,"2:42pm - <b>18.03</b>","Goldman Sachs Group Securities "
"GJT",23.0900,12.9900,N/A,200,200,0,N/A,"3:10pm - <b>18.0408</b>","Synthetic Fixed-Income Securiti"
"GJV",26.29,26.07,"25.78 - 26.15",200,100,1674,100,"3:10pm - <b>25.94</b>","Synthetic Fixed-Income Securiti"
"GKOS",38.47,38.42,"37.60 - 39.00",200,100,279495,100,"3:25pm - <b>38.37</b>","Glaukos Corporation Common Stoc"
"GLF",1.590,1.580,"1.550 - 1.733",9300,1000,950716,900,"3:26pm - <b>1.585</b>","GulfMark Offshore, Inc. New Com"
"GLOB",40.56,40.49,"40.34 - 41.69",100,200,175709,100,"3:25pm - <b>40.48</b>","Globant S.A. Common Shares"
"GLOG",13.32,13.31,"13.06 - 13.47",500,200,302621,100,"3:25pm - <b>13.31</b>","GasLog Ltd. Common Shares"
"GLOG-A",N/A,N/A,N/A,N/A,N/A,N/A,N/A,N/A,N/A
"GLOP",20.08,20.04,"19.93 - 20.37",100,200,116051,100,"3:25pm - <b>20.16</b>","GasLog Partners LP Common Units"
"GLP",16.8300,16.7700,"16.5000 - 17.0000",300,200,92400,500,"3:25pm - <b>16.8099</b>","Global Partners LP Global Partn"
"GLT",22.090,22.060,"22.050 - 22.400",200,200,61497,100,"3:21pm - <b>22.075</b>","Glatfelter Common Stock"
"GLW",22.99,22.98,"22.91 - 23.05",10100,27900,3636769,100,"3:26pm - <b>22.99</b>","Corning Incorporated Common Sto"
"GM",31.860,31.850,"31.750 - 32.120",10200,9200,9105864,100,"3:26pm - <b>31.855</b>","General Motors Company Common S"
"GM",31.860,31.850,"31.750 - 32.120",10200,9200,9105864,100,"3:26pm - <b>31.855</b>","General Motors Company Common S"
"B",39.79,39.76,"39.42 - 40.07",400,200,71990,100,"3:24pm - <b>39.68</b>","Barnes Group, Inc. Common Stock"
"GME",27.700,27.690,"27.676 - 28.200",500,1300,791593,500,"3:25pm - <b>27.695</b>","Gamestop Corporation Common Sto"
"GMED",22.30,22.29,"22.28 - 22.54",400,300,177804,100,"3:26pm - <b>22.30</b>","Globus Medical, Inc. Class A Co"
"GMRE",9.99,9.91,"9.72 - 10.19",200,200,178791,100,"3:24pm - <b>9.89</b>","Global Medical REIT Inc. Common"
"GMS",22.38,22.31,"22.22 - 22.69",200,300,65404,100,"3:25pm - <b>22.38</b>","GMS Inc. Common Stock"
"GMTA",26.18,26.05,"26.04 - 26.65",200,200,34225,210,"3:25pm - <b>26.05</b>","GATX Corporation 5.625% Senior "
"GMZ",9.38,9.37,"9.35 - 9.55",500,200,102494,100,"3:20pm - <b>9.36</b>","Goldman Sachs MLP Income Opport"
"GNC",19.970,19.960,"19.910 - 20.160",600,800,1028862,100,"3:26pm - <b>19.965</b>","GNC Holdings, Inc. Class A Comm"
"GNE",6.16,6.06,"6.07 - 6.16",200,300,8548,100,"3:22pm - <b>6.14</b>","Genie Energy Ltd. Class B Commo"
"GNE-A",N/A,N/A,N/A,N/A,N/A,N/A,N/A,N/A,N/A
"GNK",4.88,4.82,"4.82 - 5.00",200,100,16364,100,"3:21pm - <b>4.82</b>","Genco Shipping & Trading Limite"
"GNL",8.270,8.260,"8.240 - 8.340",200,1400,244495,100,"3:24pm - <b>8.255</b>","Global Net Lease, Inc. Common S"
"GNRC",34.52,34.49,"34.24 - 35.19",300,300,261444,100,"3:26pm - <b>34.46</b>","Generac Holdlings Inc. Common S"
"GNRT",4.93,4.91,"4.92 - 5.26",800,800,373422,100,"3:25pm - <b>4.92</b>","Gener8 Maritime, Inc. Common Sh"
"GNT",7.83,7.82,"7.66 - 7.94",200,100,99173,100,"3:25pm - <b>7.82</b>","GAMCO Natural Resources, Gold &"
"GNW",4.810,4.800,"4.762 - 4.920",24500,19800,5029909,200,"3:26pm - <b>4.805</b>","Genworth Financial Inc Common S"
"GOF",19.02,19.00,"18.94 - 19.02",100,300,35373,2000,"3:16pm - <b>19.02</b>","Guggenheim Strategic Opportunit"
"GOL",20.00,19.97,"19.91 - 20.96",300,600,74694,100,"3:10pm - <b>19.99</b>","Gol Linhas Aereas Inteligentes "
"GPC",98.67,98.65,"97.87 - 98.82",100,200,310078,100,"3:25pm - <b>98.65</b>","Genuine Parts Company Common St"
"GPE-A",N/A,N/A,N/A,N/A,N/A,N/A,N/A,N/A,N/A
"GPI",61.870,61.850,"61.420 - 62.240",200,100,210567,100,"3:25pm - <b>61.845</b>","Group 1 Automotive, Inc. Common"
"GPK",14.1000,14.0900,"14.0500 - 14.1900",8200,10100,1534520,200,"3:25pm - <b>14.0901</b>","Graphic Packaging Holding Compa"
"GPM",7.89,7.88,"7.87 - 7.94",300,100,34689,100,"3:21pm - <b>7.88</b>","Guggenheim Enhanced Equity Inco"
"GPN",75.79,75.77,"74.70 - 76.04",100,200,643646,100,"3:26pm - <b>75.74</b>","Global Payments Inc. Common Sto"
"GPRK",3.40,3.37,"3.37 - 3.40",300,500,18680,100,"3:23pm - <b>3.39</b>","Geopark Ltd Common Shares"
"GPS",22.2400,22.2300,"22.1900 - 22.5900",1900,1900,2712134,100,"3:25pm - <b>22.2372</b>","Gap, Inc. (The) Common Stock"
"GPT",9.74,9.73,"9.69 - 9.81",3400,5600,1261811,100,"3:25pm - <b>9.74</b>","Gramercy Property Trust"
"GPT-A",N/A,N/A,N/A,N/A,N/A,N/A,N/A,N/A,N/A
"GPX",24.82,24.70,"24.50 - 24.90",200,100,8679,100,"2:48pm - <b>24.77</b>","GP Strategies Corporation Commo"
"GRA",73.13,73.08,"72.37 - 73.20",200,100,322447,100,"3:25pm - <b>73.06</b>","W.R. Grace & Co. Common Stock"
"GRAM",8.35,8.28,"8.16 - 8.42",100,300,4695,100,"2:42pm - <b>8.36</b>","Grana y Montero S.A.A. American"
"GRO",0.85,0.83,"0.83 - 0.87",200,10000,12630,100,"3:17pm - <b>0.85</b>","Agria Corporation American Depo"
"GRP=",N/A,N/A,N/A,N/A,N/A,N/A,N/A,N/A,N/A
"GRR",10.08,10.04,"10.03 - 10.07",300,100,303,100,"3:04pm - <b>10.03</b>","Asia Tigers Fund, Inc. (The) Co"
"GRUB",42.25,42.23,"41.00 - 42.41",300,200,1061184,100,"3:26pm - <b>42.23</b>","GrubHub Inc. Common Stock"
"GRX",10.69,10.67,"10.61 - 10.80",200,400,42824,100,"3:25pm - <b>10.68</b>","The Gabelli Healthcare & Wellne"
"GRX-A",N/A,N/A,N/A,N/A,N/A,N/A,N/A,N/A,N/A
"GRX-B",N/A,N/A,N/A,N/A,N/A,N/A,N/A,N/A,N/A
"GS",161.33,161.28,"161.00 - 163.97",400,500,2043950,100,"3:26pm - <b>161.51</b>","Goldman Sachs Group, Inc. (The)"
"GS-A",N/A,N/A,N/A,N/A,N/A,N/A,N/A,N/A,N/A
"GS-B",N/A,N/A,N/A,N/A,N/A,N/A,N/A,N/A,N/A
"GS-C",N/A,N/A,N/A,N/A,N/A,N/A,N/A,N/A,N/A
"GS-D",N/A,N/A,N/A,N/A,N/A,N/A,N/A,N/A,N/A
"GS-I",N/A,N/A,N/A,N/A,N/A,N/A,N/A,N/A,N/A
"GS-J",N/A,N/A,N/A,N/A,N/A,N/A,N/A,N/A,N/A
"GS-K",N/A,N/A,N/A,N/A,N/A,N/A,N/A,N/A,N/A
"GS-N",N/A,N/A,N/A,N/A,N/A,N/A,N/A,N/A,N/A
"GSBD",22.03,22.00,"21.95 - 22.06",800,100,84192,100,"3:23pm - <b>22.05</b>","Goldman Sachs BDC, Inc. Common "
"GSH",25.94,25.92,"25.72 - 25.95",100,100,3054,100,"10:13am - <b>25.92</b>","Guangshen Railway Company Limit"
"GSJ",25.8900,25.8600,"25.8510 - 25.9300",200,700,20172,200,"3:13pm - <b>25.8899</b>","Goldman Sachs Group, Inc. (The)"
"GSK",42.9800,42.9700,"42.8700 - 43.1000",2400,1000,1772329,123,"3:26pm - <b>42.9734</b>","GlaxoSmithKline PLC Common Stoc"
"GSL",N/A,N/A,"1.65 - 1.72",N/A,N/A,29670,100,"3:24pm - <b>1.70</b>","Global Ship Lease Inc New Class"
"GSL-B",N/A,N/A,N/A,N/A,N/A,N/A,N/A,N/A,N/A
"GTN",10.170,10.160,"10.010 - 10.370",800,600,1454273,100,"3:25pm - <b>10.165</b>","Gray Communications Systems, In"
"GTN.A",N/A,N/A,N/A,N/A,N/A,N/A,N/A,N/A,N/A
"GTS",21.93,21.90,"21.49 - 22.03",100,100,82026,100,"3:24pm - <b>21.96</b>","Triple-S Management Corporation"
"GTT",23.51,23.48,"23.45 - 23.83",200,200,41510,100,"3:25pm - <b>23.45</b>","GTT Communications, Inc. Common"
"GTY",24.25,24.23,"24.00 - 24.26",200,100,39969,100,"3:26pm - <b>24.23</b>","Getty Realty Corporation Common"
"GUT",6.7700,6.7500,"6.7000 - 6.7800",100,100,41421,100,"3:25pm - <b>6.7695</b>","Gabelli Utility Trust (The) Com"
"GUT-A",N/A,N/A,N/A,N/A,N/A,N/A,N/A,N/A,N/A
"GUT-C",N/A,N/A,N/A,N/A,N/A,N/A,N/A,N/A,N/A
"GVA",48.650,48.570,"47.495 - 48.950",300,300,88857,100,"3:26pm - <b>48.505</b>","Granite Construction Incorporat"
"GWB",33.04,33.03,"32.70 - 33.39",300,200,430830,100,"3:25pm - <b>33.05</b>","Great Western Bancorp, Inc. Com"
"GWR",66.34,66.33,"65.58 - 66.67",400,100,173956,100,"3:25pm - <b>66.33</b>","Genesee & Wyoming Inc. Class A "
"GWRE",59.36,59.33,"59.13 - 59.70",100,200,394077,100,"3:25pm - <b>59.36</b>","Guidewire Software, Inc. Common"
"GWW",216.91,216.79,"214.54 - 217.43",200,300,387268,100,"3:25pm - <b>216.86</b>","W.W. Grainger, Inc. Common Stoc"
"GXP",27.90,27.89,"27.61 - 28.02",2200,600,1818070,100,"3:26pm - <b>27.90</b>","Great Plains Energy Incorporate"
"GYB",22.480,22.450,"22.450 - 22.530",500,1000,3831,500,"3:04pm - <b>22.471</b>","CABCO Series 2004-101 Trust Gol"
"GYC",24.0000,23.5500,"23.6900 - 23.9990",400,200,3110,100,"3:24pm - <b>23.8511</b>","Corporate Asset Backed Corp CAB"
"GZT",9.95,9.87,"9.81 - 10.13",100,100,32130,900,"3:12pm - <b>9.86</b>","Gazit-Globe Ltd. Ordinary Share"
"H",49.06,49.03,"47.94 - 49.49",300,100,335578,100,"3:25pm - <b>48.79</b>","Hyatt Hotels Corporation Class "
"HAE",37.21,37.19,"36.99 - 37.40",200,300,184891,100,"3:24pm - <b>37.16</b>","Haemonetics Corporation Common "
"HAL",41.59,41.58,"41.47 - 42.31",1500,1100,5189921,100,"3:25pm - <b>41.58</b>","Halliburton Company Common Stoc"
"HAR",82.46,82.44,"81.87 - 82.97",100,100,211800,100,"3:25pm - <b>82.61</b>","Harman International Industries"
"HASI",23.2400,23.2100,"23.2000 - 23.6000",100,400,82542,100,"3:26pm - <b>23.2075</b>","Hannon Armstrong Sustainable In"
"HBI",25.560,25.550,"25.360 - 25.750",1100,2100,2243624,100,"3:26pm - <b>25.555</b>","Hanesbrands Inc. Common Stock"
"HBM",3.75,3.73,"3.70 - 3.79",4100,1800,129159,100,"3:24pm - <b>3.74</b>","Hudbay Minerals Inc Ordinary Sh"
"HBM",3.75,3.73,"3.70 - 3.79",4100,1800,129159,100,"3:24pm - <b>3.74</b>","Hudbay Minerals Inc Ordinary Sh"
"HCA",74.840,74.830,"74.480 - 75.980",700,400,2341223,100,"3:26pm - <b>74.925</b>","HCA Holdings, Inc. Common Stock"
"HCI",30.39,30.37,"30.27 - 30.97",200,100,22936,100,"3:24pm - <b>30.34</b>","HCI Group, Inc. Common Stock"
"HCJ",26.34,26.03,N/A,100,300,0,N/A,"3:37pm - <b>26.13</b>","HCI Group, Inc. 8% Senior Notes"
"HCLP",14.69,14.66,"14.52 - 14.98",200,400,227085,100,"3:25pm - <b>14.68</b>","Hi-Crush Partners LP Common Uni"
"HCN",76.86,76.84,"75.92 - 77.13",400,400,1549667,100,"3:25pm - <b>76.85</b>","Welltower Inc. Common Stock"
"HCN-I",N/A,N/A,N/A,N/A,N/A,N/A,N/A,N/A,N/A
"HCN-J",N/A,N/A,N/A,N/A,N/A,N/A,N/A,N/A,N/A
"HCP",39.580,39.570,"39.050 - 39.700",900,400,2255975,100,"3:26pm - <b>39.585</b>","HCP, Inc. Common Stock"
"HD",125.790,125.770,"125.560 - 127.230",300,400,3644471,404,"3:25pm - <b>125.799</b>","Home Depot, Inc. (The) Common S"
"HDB",72.76,72.74,"72.10 - 73.21",300,400,467901,100,"3:25pm - <b>72.73</b>","HDFC Bank Limited Common Stock"
"HE",31.260,31.240,"31.010 - 31.380",1000,800,228026,100,"3:26pm - <b>31.255</b>","Hawaiian Electric Industries, I"
"HE-U",N/A,N/A,N/A,N/A,N/A,N/A,N/A,N/A,N/A
"HEI",69.15,69.07,"68.34 - 69.58",100,100,63062,100,"3:25pm - <b>69.00</b>","Heico Corporation Common Stock"
"HEI.A",N/A,N/A,N/A,N/A,N/A,N/A,N/A,N/A,N/A
"HEP",34.780,34.350,"34.030 - 34.950",200,100,64192,100,"3:21pm - <b>34.145</b>","Holly Energy Partners, L.P. Com"
"HEQ",16.0400,15.9900,"15.7800 - 16.1300",100,300,43450,399,"3:25pm - <b>16.0598</b>","John Hancock Hedged Equity & In"
"HES",47.89,47.88,"47.01 - 48.22",700,300,3165125,100,"3:26pm - <b>47.89</b>","Hess Corporation Common Stock"
"HES-A",N/A,N/A,N/A,N/A,N/A,N/A,N/A,N/A,N/A
"HF",27.86,27.83,"27.68 - 28.36",100,100,118980,100,"3:24pm - <b>27.81</b>","HFF, Inc. Common Stock, Class A"
"HFC",23.96,23.95,"23.95 - 24.97",1400,900,3004489,100,"3:26pm - <b>23.95</b>","HollyFrontier Corporation Commo"
"HGG",1.84,1.82,"1.81 - 1.92",300,200,43364,100,"2:56pm - <b>1.82</b>","HHGregg, Inc. Common Stock (IN)"
"HGH",31.9000,31.7400,"31.7000 - 32.0200",300,100,26079,650,"3:23pm - <b>31.8196</b>","Hartford Financial Services Gro"
"HGT",2.41,2.40,"2.23 - 2.48",200,1400,104035,100,"3:01pm - <b>2.37</b>","Hugoton Royalty Trust Common St"
"HHC",114.28,114.12,"114.13 - 115.67",200,100,42400,100,"3:24pm - <b>114.20</b>","Howard Hughes Corporation (The)"
"HHS",1.67,1.65,"1.55 - 1.69",500,900,270285,100,"3:18pm - <b>1.66</b>","Harte-Hanks, Inc. Common Stock"
"HHY",7.2900,7.2700,"7.2600 - 7.3100",1200,100,27784,4000,"3:25pm - <b>7.2811</b>","Brookfield High Income Fund Inc"
"HI",31.22,31.20,"31.01 - 31.45",400,100,87101,100,"3:25pm - <b>31.23</b>","Hillenbrand Inc Common Stock"
"HIE",12.46,12.42,"12.37 - 12.49",300,200,59224,100,"3:22pm - <b>12.44</b>","Miller/Howard High Income Equit"
"HIFR",18.68,18.65,"18.59 - 18.87",200,500,150191,100,"3:25pm - <b>18.66</b>","InfraREIT, Inc. Common Stock"
"HIG",42.43,42.42,"42.27 - 42.62",500,1300,1180317,100,"3:26pm - <b>42.47</b>","Hartford Financial Services Gro"
"HIG",42.43,42.42,"42.27 - 42.62",500,1300,1180317,100,"3:26pm - <b>42.47</b>","Hartford Financial Services Gro"
"HII",155.33,155.24,"152.98 - 155.54",100,200,172831,100,"3:24pm - <b>154.96</b>","Huntington Ingalls Industries, "
"HIL",4.410,4.390,"4.390 - 4.490",300,300,13805,1500,"3:23pm - <b>4.392</b>","Hill International, Inc. Common"
"HIO",4.97,4.96,"4.95 - 5.00",6900,400,445217,200,"3:25pm - <b>4.96</b>","Western Asset High Income Oppor"
"HIVE",6.040,6.020,"6.010 - 6.230",1000,300,152790,100,"3:25pm - <b>6.015</b>","Aerohive Networks, Inc. Common "
"HIW",52.61,52.59,"52.14 - 52.72",300,400,363124,100,"3:26pm - <b>52.62</b>","Highwoods Properties, Inc. Comm"
"HIX",7.12,7.11,"7.10 - 7.19",600,1100,242231,100,"3:25pm - <b>7.11</b>","Western Asset High Income Fund "
"HJV",18.35,18.13,N/A,100,100,0,N/A,"2:28pm - <b>18.11</b>","MS Structured Asset Corp MS Str"
"HK",8.60,8.59,"8.22 - 8.88",800,500,675824,100,"3:25pm - <b>8.60</b>","Halcon Resources Corporation Co"
"HK",8.60,8.59,"8.22 - 8.88",800,500,675824,100,"3:25pm - <b>8.60</b>","Halcon Resources Corporation Co"
"HL",5.85,5.84,"5.83 - 6.08",25300,13500,5423010,100,"3:26pm - <b>5.84</b>","Hecla Mining Company Common Sto"
"HL-B",N/A,N/A,N/A,N/A,N/A,N/A,N/A,N/A,N/A
"HLF",61.19,61.16,"60.81 - 61.40",100,200,424031,100,"3:25pm - <b>61.20</b>","Herbalife Ltd. Common Stock"
"HLI",24.03,23.95,"23.96 - 24.67",300,100,23544,100,"3:25pm - <b>24.12</b>","Houlihan Lokey, Inc. Class A Co"
"HLS",40.54,40.53,"40.47 - 40.79",300,300,400293,100,"3:25pm - <b>40.56</b>","HealthSouth Corporation Common "
"HLS",40.54,40.53,"40.47 - 40.79",300,300,400293,100,"3:25pm - <b>40.56</b>","HealthSouth Corporation Common "
"HLT",22.970,22.960,"22.920 - 23.470",6100,5900,5283732,100,"3:26pm - <b>22.965</b>","Hilton Worldwide Holdings Inc. "
"HLX",7.39,7.38,"7.24 - 7.53",600,800,780485,100,"3:25pm - <b>7.37</b>","Helix Energy Solutions Group, I"
"HMC",29.05,29.04,"28.98 - 29.21",1000,600,429918,100,"3:25pm - <b>29.04</b>","Honda Motor Company, Ltd. Commo"
"HMLP",17.500,17.280,"17.250 - 17.382",200,100,3371,100,"3:00pm - <b>17.284</b>","Hoegh LNG Partners LP Common Un"
"HMN",35.99,35.97,"35.93 - 36.67",200,100,93753,100,"3:24pm - <b>35.96</b>","Horace Mann Educators Corporati"
"HMY",3.450,3.440,"3.430 - 3.595",29600,22900,1724097,100,"3:25pm - <b>3.445</b>","Harmony Gold Mining Company Lim"
"HNI",39.930,39.910,"39.540 - 40.220",100,300,146550,100,"3:25pm - <b>39.885</b>","HNI Corporation Common Stock"
"HNP",24.94,24.91,"24.86 - 25.19",300,100,66214,100,"3:25pm - <b>24.88</b>","Huaneng Power Intl Common Stock"
"HNR",0.7820,0.7700,"0.7241 - 0.7856",200,300,90214,100,"3:25pm - <b>0.7806</b>","Harvest Natural Resources Inc"
"HOG",51.70,51.68,"51.65 - 52.38",200,600,776583,100,"3:26pm - <b>51.71</b>","Harley-Davidson, Inc. Common St"
"HOME",14.58,14.55,"14.49 - 14.70",100,200,105819,100,"3:22pm - <b>14.57</b>","At Home Group Inc. Common Stock"
"HON",116.31,116.29,"115.39 - 116.85",300,200,1576440,100,"3:26pm - <b>116.31</b>","Honeywell International Inc. Co"
"HOS",4.6900,4.6800,"4.5300 - 4.8200",2000,100,1155937,100,"3:25pm - <b>4.6801</b>","Hornbeck Offshore Services Comm"
"HOV",1.71,1.70,"1.69 - 1.73",7300,11600,533275,100,"3:23pm - <b>1.71</b>","Hovnanian Enterprises, Inc. Cla"
"HP",57.57,57.55,"57.35 - 58.20",200,300,1065755,100,"3:26pm - <b>57.56</b>","Helmerich & Payne, Inc. Common "
"HPE",22.800,22.790,"22.640 - 22.965",1400,3000,6047462,200,"3:26pm - <b>22.795</b>","Hewlett Packard Enterprise Comp"
"HPF",22.78,22.74,"22.70 - 22.86",200,300,43492,100,"3:18pm - <b>22.70</b>","John Hancock Pfd Income Fund II"
"HPI",22.41,22.39,"22.37 - 22.50",1000,600,55066,100,"3:25pm - <b>22.39</b>","John Hancock Preferred Income F"
"HPP",33.46,33.45,"33.34 - 33.79",300,300,301703,100,"3:26pm - <b>33.45</b>","Hudson Pacific Properties, Inc."
"HPQ",15.000,14.990,"14.930 - 15.120",32300,12300,5010012,100,"3:25pm - <b>15.005</b>","HP Inc. Common Stock"
"HPS",19.39,19.37,"19.37 - 19.56",100,300,62158,100,"3:23pm - <b>19.38</b>","John Hancock Preferred Income F"
"HQH",24.2800,24.1900,"24.1800 - 24.6500",300,200,104601,325,"3:25pm - <b>24.2237</b>","Tekla Healthcare Investors Comm"
"HQL",19.08,19.02,"19.00 - 19.25",500,700,62907,100,"3:26pm - <b>19.06</b>","TeklaLife Sciences Investors Co"
"HR",35.24,35.23,"34.97 - 35.31",400,200,350402,100,"3:26pm - <b>35.27</b>","Healthcare Realty Trust Incorpo"
"HRB",22.78,22.77,"22.70 - 23.07",2100,500,1074306,200,"3:26pm - <b>22.76</b>","H&R Block, Inc. Common Stock"
"HRC",60.57,60.53,"60.25 - 60.93",200,300,210917,100,"3:25pm - <b>60.56</b>","Hill-Rom Holdings Inc Common St"
"HRG",15.47,15.46,"15.33 - 15.52",1000,600,212108,100,"3:25pm - <b>15.46</b>","HRG Group, Inc. Common Stock"
"HRI",32.87,32.81,"32.66 - 33.17",400,100,245016,100,"3:25pm - <b>32.88</b>","Herc Holdings Inc. Common Stock"
"HRL",37.37,37.36,"37.29 - 37.78",1100,1400,1068947,100,"3:26pm - <b>37.37</b>","Hormel Foods Corporation Common"
"HRS",90.41,90.38,"90.00 - 91.00",100,100,226232,100,"3:26pm - <b>90.40</b>","Harris Corporation Common Stock"
"HRTG",14.22,14.20,"14.08 - 14.38",300,200,94704,100,"3:24pm - <b>14.20</b>","Heritage Insurance Holdings, In"
"HSBC",36.87,36.86,"36.79 - 37.06",2800,1000,2133599,100,"3:26pm - <b>36.85</b>","HSBC Holdings, plc. Common Stoc"
"HSBC-A",N/A,N/A,N/A,N/A,N/A,N/A,N/A,N/A,N/A
"HSC",9.100,9.090,"8.880 - 9.200",400,1500,548233,100,"3:25pm - <b>9.095</b>","Harsco Corporation Common Stock"
"HSEA",27.7400,27.7200,"27.7000 - 27.7400",300,100,114654,650,"3:19pm - <b>27.7061</b>","HSBC Holdings, plc. Perpetual S"
"HSEB",26.38,26.37,"26.36 - 26.47",300,400,193961,600,"3:25pm - <b>26.37</b>","HSBC Holdings plc PERP SUB CAP "
"HST",16.0500,16.0400,"16.0200 - 16.2500",5100,14200,5758443,100,"3:26pm - <b>16.0425</b>","Host Hotels & Resorts, Inc. Com"
