Symbol,Ask,Bid,Range,AskSize,BidSize,Volume,LastTradeSize,LastTradeWithTime,Name
"BLL",79.13,79.11,"79.04 - 79.52",300,200,415925,100,"3:29pm - <b>79.11</b>","Ball Corporation Common Stock"
"BLOX",26.38,26.37,"26.34 - 26.38",13100,15700,1337429,200,"3:30pm - <b>26.38</b>","Infoblox Inc. Common Stock"
"BLW",15.38,15.37,"15.37 - 15.41",2100,1600,40251,250,"3:22pm - <b>15.37</b>","Blackrock Limited Duration Inco"
"BLX",27.70,27.68,"27.66 - 28.41",100,100,66650,100,"3:29pm - <b>27.67</b>","Banco Latinoamericano de Comerc"
"BMA",76.05,75.88,"73.93 - 77.42",100,200,171561,100,"3:28pm - <b>75.50</b>","Banco Macro S.A.  ADR (represen"
"BME",35.1800,35.0400,"34.9011 - 35.3200",100,100,38320,100,"3:25pm - <b>35.0799</b>","Blackrock Health Sciences Trust"
"BMI",33.40,33.36,"33.36 - 33.89",300,200,82965,320,"3:30pm - <b>33.39</b>","Badger Meter, Inc. Common Stock"
"BML-G",N/A,N/A,N/A,N/A,N/A,N/A,N/A,N/A,N/A
"BML-H",N/A,N/A,N/A,N/A,N/A,N/A,N/A,N/A,N/A
"BML-I",N/A,N/A,N/A,N/A,N/A,N/A,N/A,N/A,N/A
"BML-J",N/A,N/A,N/A,N/A,N/A,N/A,N/A,N/A,N/A
"BML-L",N/A,N/A,N/A,N/A,N/A,N/A,N/A,N/A,N/A
"BMO",64.54,64.53,"64.49 - 65.03",300,700,291939,100,"3:30pm - <b>64.56</b>","Bank Of Montreal Common Stock"
"BMS",50.76,50.75,"50.69 - 51.42",400,200,402995,100,"3:30pm - <b>50.75</b>","Bemis Company, Inc. Common Stoc"
"BMY",55.55,55.54,"55.40 - 56.31",700,1400,6424187,100,"3:30pm - <b>55.54</b>","Bristol-Myers Squibb Company Co"
"BNED",9.57,9.56,"9.51 - 9.82",600,500,192578,100,"3:29pm - <b>9.57</b>","Barnes & Noble Education, Inc C"
"BNJ",16.00,15.97,"15.98 - 16.05",200,200,10147,100,"3:21pm - <b>15.99</b>","BlackRock New Jersey Municipal "
"BNS",53.27,53.26,"53.16 - 53.54",400,800,363362,723,"3:30pm - <b>53.27</b>","Bank Nova Scotia Halifax Pfd 3 "
"BNY",16.00,15.98,"15.98 - 16.02",200,100,4139,100,"3:23pm - <b>15.98</b>","BlackRock New York Municipal In"
"BOE",12.09,12.08,"12.07 - 12.16",800,800,192901,100,"3:26pm - <b>12.09</b>","Blackrock Global Blackrock Glob"
"BOH",71.78,71.74,"71.72 - 72.46",100,200,140468,100,"3:29pm - <b>71.78</b>","Bank of Hawaii Corporation Comm"
"BOI",15.19,15.15,"15.10 - 15.22",200,500,98795,100,"3:30pm - <b>15.19</b>","Brookfield Mortgage Opportunity"
"BOOT",11.01,10.97,"10.79 - 11.13",100,100,87501,100,"3:28pm - <b>10.84</b>","Boot Barn Holdings, Inc. Common"
"BORN",1.51,1.49,"1.49 - 1.51",300,1000,4954,100,"1:10pm - <b>1.51</b>","China New Borun Corporation Ame"
"BOX",14.60,14.59,"14.41 - 14.81",1600,200,583696,100,"3:28pm - <b>14.59</b>","Box, Inc. Class A Common Stock"
"BOXC",21.48,20.86,"21.19 - 21.41",500,300,620,100,"11:36am - <b>21.19</b>","Brookfield Canada Office Proper"
"BP",33.74,33.73,"33.62 - 33.98",1500,5300,3879067,100,"3:30pm - <b>33.74</b>","BP p.l.c. Common Stock"
"BPI",6.52,6.51,"6.51 - 6.90",500,100,85809,200,"3:26pm - <b>6.51</b>","Bridgepoint Education, Inc."
"BPK",15.2800,15.2500,"15.2400 - 15.2800",2200,1400,30351,1300,"2:58pm - <b>15.2401</b>","Blackrock Municipal 2018 Term T"
"BPL",70.97,70.91,"70.91 - 71.78",200,200,203941,100,"3:29pm - <b>71.00</b>","Buckeye Partners L.P. Common St"
"BPT",17.50,17.46,"17.25 - 17.50",500,300,54157,100,"3:20pm - <b>17.48</b>","BP Prudhoe Bay Royalty Trust Co"
"BPY",23.20,23.16,"23.11 - 23.62",300,300,62698,100,"3:27pm - <b>23.15</b>","Brookfield Property Partners L."
"BQH",15.80,15.72,"15.75 - 15.99",200,300,523,100,"1:05pm - <b>15.75</b>","Blackrock New York Municipal Bo"
"BR",70.04,70.03,"68.12 - 70.07",300,700,943267,100,"3:30pm - <b>70.06</b>","Broadridge Financial Solutions,"
"BRC",34.87,34.86,"34.77 - 35.19",200,100,212143,100,"3:30pm - <b>34.90</b>","Brady Corporation Common Stock"
"BRFS",16.730,16.720,"16.620 - 16.890",1500,700,1164007,100,"3:30pm - <b>16.725</b>","BRF S.A."
"BRK.A",N/A,N/A,N/A,N/A,N/A,N/A,N/A,N/A,N/A
"BRK.B",N/A,N/A,N/A,N/A,N/A,N/A,N/A,N/A,N/A
"BRO",37.28,37.27,"37.20 - 37.48",1400,1200,503032,100,"3:29pm - <b>37.28</b>","Brown & Brown, Inc. Common Stoc"
"BRS",12.72,12.71,"12.33 - 12.78",300,400,517791,100,"3:30pm - <b>12.72</b>","Bristow Group Inc. Common Stock"
"BRSS",28.15,28.10,"27.75 - 28.55",100,200,184099,100,"3:27pm - <b>28.15</b>","Global Brass and Copper Holding"
"BRT",8.1600,8.1000,"8.1028 - 8.1700",100,1200,2218,400,"2:59pm - <b>8.1381</b>","BRT Realty Trust Common Stock"
"BRX",29.05,29.04,"28.45 - 29.06",900,700,844517,100,"3:30pm - <b>29.06</b>","Brixmor Property Group Inc. Com"
"BSAC",20.760,20.750,"20.660 - 20.820",900,300,224864,100,"3:29pm - <b>20.755</b>","Banco Santander - Chile ADS"
"BSBR",6.600,6.590,"6.570 - 6.660",5400,4500,553655,100,"3:30pm - <b>6.595</b>","Banco Santander Brasil SA Ameri"
"BSD",14.92,14.88,"14.89 - 14.93",300,200,10976,100,"12:45pm - <b>14.92</b>","BlackRock Strategic Municipal T"
"BSE",14.68,14.64,"14.65 - 14.68",400,200,2880,100,"3:22pm - <b>14.68</b>","Blackrock New York Municipal In"
"BSL",16.58,16.55,"16.50 - 16.64",300,300,57717,100,"3:28pm - <b>16.53</b>","Blackstone GSO Senior Floating "
"BSM",17.53,17.50,"17.39 - 18.06",500,400,108319,100,"3:29pm - <b>17.50</b>","Black Stone Minerals, L.P. Comm"
"BSMX",8.44,8.43,"8.30 - 8.50",6900,1200,1973995,100,"3:30pm - <b>8.43</b>","Grupo Financiero Santander Mexi"
"BST",18.43,18.42,"18.42 - 18.74",200,300,63339,100,"3:26pm - <b>18.51</b>","BlackRock Science and Technolog"
"BSX",23.79,23.78,"23.51 - 23.81",6900,14900,5482288,100,"3:30pm - <b>23.78</b>","Boston Scientific Corporation C"
"BT",25.4400,25.4300,"25.3350 - 25.5400",1000,500,319888,500,"3:29pm - <b>25.4336</b>","BT Group plc American Depositar"
"BTA",12.7400,12.7100,"12.7000 - 12.7400",900,200,5883,780,"1:48pm - <b>12.7399</b>","BlackRock Long-Term Municipal A"
"BTE",3.82,3.81,"3.81 - 4.01",21200,2600,1826803,100,"3:29pm - <b>3.81</b>","Baytex Energy Corp"
"BTO",27.59,27.52,"27.48 - 27.93",100,200,24269,200,"3:15pm - <b>27.53</b>","John Hancock Financial Opportun"
"BTT",23.8200,23.8100,"23.7689 - 23.8500",100,100,87861,400,"3:24pm - <b>23.8143</b>","BlackRock Municipal 2030 Target"
"BTZ",13.3500,13.3300,"13.2300 - 13.3526",1000,300,161784,2000,"3:26pm - <b>13.2301</b>","BlackRock Credit Allocation Inc"
"BUD",132.28,132.26,"129.99 - 132.36",500,200,1794734,100,"3:30pm - <b>132.20</b>","Anheuser-Busch Inbev SA Sponsor"
"BUI",19.84,19.75,"19.68 - 19.82",300,100,61845,100,"3:29pm - <b>19.75</b>","BlackRock Utility and Infrastru"
"BURL",83.01,82.98,"82.69 - 84.06",200,100,566156,100,"3:30pm - <b>82.98</b>","Burlington Stores, Inc. Common "
"BVN",13.89,13.88,"13.77 - 14.43",800,200,620206,100,"3:30pm - <b>13.89</b>","Buenaventura Mining Company Inc"
"BW",16.49,16.48,"16.34 - 16.58",400,300,203536,300,"3:29pm - <b>16.48</b>","Babcock & Wilcox Enterprises, I"
"BWA",34.80,34.79,"34.54 - 34.86",500,400,2030184,100,"3:30pm - <b>34.79</b>","BorgWarner Inc. Common Stock"
"BWG",13.3100,13.2800,"13.2500 - 13.3800",1000,400,80731,860,"3:22pm - <b>13.2803</b>","Legg Mason BW Global Income Opp"
"BWP",16.81,16.80,"16.73 - 16.87",600,400,195608,100,"3:30pm - <b>16.79</b>","Boardwalk Pipeline Partners LP "
"BWXT",38.85,38.83,"38.71 - 39.10",400,400,226767,100,"3:30pm - <b>38.85</b>","BWX Technologies, Inc. Common S"
"BX",25.48,25.47,"25.26 - 25.64",1600,400,2410666,100,"3:30pm - <b>25.47</b>","The Blackstone Group L.P. Commo"
"BXC",9.00,8.91,"8.77 - 9.00",100,100,3700,200,"3:21pm - <b>8.78</b>","Bluelinx Holdings Inc. Common S"
"BXE",0.8995,0.8890,"0.8820 - 0.9635",600,2400,389852,200,"3:28pm - <b>0.8991</b>","Bellatrix Exploration Ltd Ordin"
"BXMT",30.25,30.24,"30.00 - 30.26",300,300,517563,900,"3:29pm - <b>30.23</b>","Blackstone Mortgage Trust, Inc."
"BXMX",13.0800,13.0700,"12.9800 - 13.0780",2200,100,229797,100,"3:28pm - <b>13.0721</b>","Nuveen S&P 500 Buy-Write Income"
"BXP",139.21,139.16,"138.87 - 139.90",200,100,323265,398,"3:30pm - <b>139.28</b>","Boston Properties, Inc. Common "
"BXP-B",N/A,N/A,N/A,N/A,N/A,N/A,N/A,N/A,N/A
"BXS",23.230,23.220,"23.175 - 23.560",700,700,293699,100,"3:29pm - <b>23.225</b>","BancorpSouth, Inc. Common Stock"
"BYD",19.01,19.00,"18.81 - 19.12",800,1200,620559,200,"3:30pm - <b>19.00</b>","Boyd Gaming Corporation Common "
"BYM",15.74,15.70,"15.66 - 15.74",400,100,18108,372,"3:28pm - <b>15.70</b>","Blackrock Municipal Income Qual"
"BZH",11.470,11.460,"11.301 - 11.820",600,400,1262333,100,"3:29pm - <b>11.465</b>","Beazer Homes USA, Inc. Common S"
"C",45.960,45.950,"45.830 - 46.630",6600,3200,16710286,100,"3:30pm - <b>45.955</b>","Citigroup, Inc. Common Stock"
"C-C",N/A,N/A,N/A,N/A,N/A,N/A,N/A,N/A,N/A
"C-J",N/A,N/A,N/A,N/A,N/A,N/A,N/A,N/A,N/A
"C-K",N/A,N/A,N/A,N/A,N/A,N/A,N/A,N/A,N/A
"C-L",N/A,N/A,N/A,N/A,N/A,N/A,N/A,N/A,N/A
"C-N",N/A,N/A,N/A,N/A,N/A,N/A,N/A,N/A,N/A
"C-P",N/A,N/A,N/A,N/A,N/A,N/A,N/A,N/A,N/A
"C-S",N/A,N/A,N/A,N/A,N/A,N/A,N/A,N/A,N/A
"C",45.960,45.950,"45.830 - 46.630",6600,3200,16710286,100,"3:30pm - <b>45.955</b>","Citigroup, Inc. Common Stock"
"A",46.62,46.61,"46.16 - 46.77",700,300,1472929,100,"3:29pm - <b>46.60</b>","Agilent Technologies, Inc. Comm"
"CAA",33.82,33.81,"33.57 - 34.05",700,300,1290945,100,"3:30pm - <b>33.81</b>","CalAtlantic Group, Inc. Common "
"CAB",52.2100,52.1900,"51.6400 - 52.2800",700,300,400251,100,"3:29pm - <b>52.2637</b>","Cabela's Inc Class A Common Sto"
"CABO",577.67,576.80,"574.33 - 580.70",100,100,19811,100,"3:28pm - <b>578.34</b>","Cable One, Inc. Common Stock"
"CACI",101.74,101.52,"100.94 - 102.33",100,100,84382,100,"3:29pm - <b>101.47</b>","CACI International, Inc. Class "
"CAE",14.27,14.25,"14.22 - 14.39",1000,2400,85902,100,"3:27pm - <b>14.26</b>","CAE Inc. Ordinary Shares"
"CAF",19.36,19.31,"19.30 - 19.50",200,100,92172,100,"3:10pm - <b>19.30</b>","Morgan Stanley China A Share Fu"
"CAG",43.13,43.12,"43.06 - 43.54",2300,400,2112660,100,"3:30pm - <b>43.12</b>","ConAgra Foods, Inc. Common Stoc"
"CAH",76.920,76.900,"76.670 - 77.430",200,400,1181839,100,"3:30pm - <b>76.915</b>","Cardinal Health, Inc. Common St"
"CAI",8.07,8.04,"7.81 - 8.09",200,200,26762,100,"3:27pm - <b>8.09</b>","CAI International, Inc. Common "
"CAJ",28.98,28.97,"28.84 - 29.04",100,900,114033,100,"3:30pm - <b>28.98</b>","Canon, Inc. American Depositary"
"CAL",25.27,25.26,"25.23 - 25.58",300,300,141553,100,"3:29pm - <b>25.28</b>","Caleres, Inc. Common Stock"
"CALX",7.300,7.290,"6.910 - 7.330",500,300,103557,100,"3:29pm - <b>7.309</b>","Calix, Inc Common Stock"
"CAPL",25.7400,25.6700,"25.6400 - 25.9700",100,100,67812,300,"3:18pm - <b>25.6508</b>","CrossAmerica Partners LP Common"
"CAS",0.9799,0.9701,"0.9700 - 1.0300",200,300,95753,400,"3:00pm - <b>0.9797</b>","Castle (A.M.) & Co. Common Stoc"
"CAT",82.4800,82.4700,"82.0100 - 82.6800",200,700,2529266,100,"3:30pm - <b>82.4836</b>","Caterpillar, Inc. Common Stock"
"CATO",33.07,33.01,"32.92 - 33.62",200,300,41237,100,"3:28pm - <b>33.01</b>","Cato Corporation (The) Class A "
"CB",124.73,124.72,"124.12 - 125.07",100,300,769284,100,"3:29pm - <b>124.72</b>","D/B/A Chubb Limited New Common "
"CBA",8.7600,8.7300,"8.7200 - 8.9100",800,2200,230758,120,"3:29pm - <b>8.7301</b>","ClearBridge American Energy MLP"
"CBB",4.010,4.000,"4.000 - 4.065",1700,2000,280924,100,"3:29pm - <b>4.005</b>","Cincinnati Bell Inc. Common Sto"
"CBB-B",N/A,N/A,N/A,N/A,N/A,N/A,N/A,N/A,N/A
"CBD",17.19,17.18,"17.09 - 17.36",400,1400,637611,100,"3:29pm - <b>17.19</b>","Companhia Brasileira de Distrib"
"CBG",28.36,28.35,"28.35 - 28.91",2100,200,1238049,100,"3:30pm - <b>28.36</b>","CBRE Group Inc Common Stock Cla"
"CBI",27.20,27.19,"26.61 - 27.37",1200,2200,2167092,100,"3:30pm - <b>27.19</b>","Chicago Bridge & Iron Company N"
"CBK",1.44,1.43,"1.42 - 1.57",1100,6700,167388,100,"3:29pm - <b>1.43</b>","Christopher & Banks Corporation"
"CBL",12.51,12.50,"12.49 - 12.64",2500,2900,1084781,100,"3:30pm - <b>12.51</b>","CBL & Associates Properties, In"
"CBL-D",N/A,N/A,N/A,N/A,N/A,N/A,N/A,N/A,N/A
"CBL-E",N/A,N/A,N/A,N/A,N/A,N/A,N/A,N/A,N/A
"CBM",46.65,46.60,"46.18 - 46.92",200,300,313002,300,"3:29pm - <b>46.58</b>","Cambrex Corporation Common Stoc"
"CBPX",21.52,21.50,"21.36 - 21.85",200,300,164462,100,"3:29pm - <b>21.51</b>","Continental Building Products, "
"CBR",1.190,1.180,"1.155 - 1.200",500,500,147577,1000,"3:26pm - <b>1.183</b>","Ciber, Inc. Common Stock"
"CBS",51.28,51.27,"50.76 - 51.61",500,1000,3522455,100,"3:30pm - <b>51.28</b>","CBS Corporation Class B Common "
"CBS.A",N/A,N/A,N/A,N/A,N/A,N/A,N/A,N/A,N/A
"CBT",51.790,51.740,"51.290 - 51.980",200,200,102219,100,"3:30pm - <b>51.775</b>","Cabot Corporation Common Stock"
"CBU",47.06,47.05,"46.86 - 47.64",100,100,52158,100,"3:29pm - <b>47.02</b>","Community Bank System, Inc. Com"
"CBZ",11.21,11.20,"11.19 - 11.30",600,800,31195,100,"3:26pm - <b>11.20</b>","CBIZ, Inc. Common Stock"
"CC",14.65,14.64,"14.61 - 15.04",1200,300,1489807,100,"3:30pm - <b>14.64</b>","Chemours Company (The) Common S"
"CCC",15.05,15.04,"14.92 - 15.10",300,200,137111,100,"3:29pm - <b>15.04</b>","Calgon Carbon Corporation Commo"
"CCE",39.59,39.58,"39.39 - 40.07",800,1000,1977343,100,"3:30pm - <b>39.58</b>","Coca-Cola European Partners plc"
"CCI",95.70,95.69,"94.65 - 95.78",200,300,1927273,100,"3:30pm - <b>95.71</b>","Crown Castle International Corp"
"CCI-A",N/A,N/A,N/A,N/A,N/A,N/A,N/A,N/A,N/A
"CCJ",8.73,8.72,"8.71 - 8.86",16300,10000,867223,100,"3:30pm - <b>8.72</b>","Cameco Corporation Common Stock"
"CCK",54.09,54.07,"53.99 - 54.27",300,400,408970,100,"3:30pm - <b>54.07</b>","Crown Holdings, Inc."
"CCL",46.6400,46.6300,"45.8000 - 48.2500",700,700,8601932,201,"3:30pm - <b>46.5936</b>","Carnival Corporation Common Sto"
"CCM",4.04,3.71,"3.88 - 3.96",300,1000,16745,100,"3:23pm - <b>3.88</b>","Concord Medical Services Holdin"
"CCO",6.010,5.990,"6.000 - 6.130",100,100,76057,100,"3:30pm - <b>6.015</b>","Clear Channel Outdoor Holdings,"
"CCP",29.12,29.10,"28.57 - 29.12",800,400,448982,200,"3:29pm - <b>29.11</b>","Care Capital Properties, Inc. C"
"CCS",20.82,20.76,"20.65 - 20.97",100,200,35702,100,"3:29pm - <b>20.75</b>","Century Communities, Inc. Commo"
"CCU",20.49,20.48,"20.29 - 20.60",300,300,114986,100,"3:30pm - <b>20.48</b>","Compania Cervecerias Unidas, S."
"CCV",26.92,26.87,"26.74 - 26.93",300,100,10548,126,"3:21pm - <b>26.88</b>","Comcast Corporation 5.00% Notes"
"CCZ",53.00,49.90,"50.32 - 50.51",100,100,413,100,"1:01pm - <b>50.51</b>","Comcast Holdings ZONES"
"CDE",12.33,12.32,"12.25 - 12.89",1600,2000,3008233,100,"3:30pm - <b>12.35</b>","Coeur Mining, Inc. Common Stock"
"CDI",5.3400,5.3200,"5.2000 - 5.3400",200,300,32802,103,"3:26pm - <b>5.3201</b>","CDI Corporation Common Stock"
"CDR",7.530,7.520,"7.450 - 7.560",300,1000,87157,100,"3:29pm - <b>7.535</b>","Cedar Realty Trust, Inc. Common"
"CDR-B",N/A,N/A,N/A,N/A,N/A,N/A,N/A,N/A,N/A
"CE",63.070,63.060,"62.310 - 63.150",500,400,763606,100,"3:30pm - <b>63.035</b>","Celanese Corporation Celanese C"
"CEA",23.47,23.42,"23.42 - 23.89",1300,300,37568,100,"3:30pm - <b>23.43</b>","China Eastern Airlines Corporat"
"CEB",53.72,53.70,"53.28 - 54.15",100,100,78216,100,"3:29pm - <b>53.55</b>","CEB Inc. Common Stock"
"CEE",19.01,18.97,"18.81 - 19.05",200,100,15911,100,"3:17pm - <b>19.01</b>","Central Europe, Russia and Turk"
"CEL",7.41,7.39,"7.34 - 7.46",200,300,11719,100,"3:24pm - <b>7.40</b>","Cellcom Israel, Ltd. Ordinary S"
"CELP",8.9700,8.8400,"8.8783 - 9.1092",100,400,4555,1545,"3:01pm - <b>8.8783</b>","Cypress Energy Partners, L.P. C"
"CEM",15.9100,15.8700,"15.8200 - 16.1400",100,1800,119376,155,"3:26pm - <b>15.8985</b>","ClearBridge Energy MLP Fund Inc"
"CEN",11.54,11.51,"11.51 - 11.68",300,200,59093,885,"3:23pm - <b>11.53</b>","Center Coast MLP & Infrastructu"
"CEO",118.82,118.77,"118.70 - 120.28",200,100,48509,100,"3:28pm - <b>118.86</b>","CNOOC Limited Common Stock"
"CEQP",20.83,20.77,"20.61 - 21.06",200,200,201644,200,"3:29pm - <b>20.65</b>","Crestwood Equity Partners LP"
"CF",22.66,22.65,"22.26 - 22.91",1500,1100,3816365,100,"3:30pm - <b>22.64</b>","CF Industries Holdings, Inc. Co"
"CFC-B",N/A,N/A,N/A,N/A,N/A,N/A,N/A,N/A,N/A
"CFG",23.950,23.940,"23.840 - 24.270",1800,4300,3249148,100,"3:30pm - <b>23.945</b>","Citizens Financial Group, Inc. "
"CFI",31.88,31.77,"31.34 - 32.56",200,100,35710,100,"3:28pm - <b>31.83</b>","Culp, Inc. Common Stock"
"CFR",68.56,68.54,"68.33 - 69.79",100,100,213685,100,"3:30pm - <b>68.55</b>","Cullen/Frost Bankers, Inc. Comm"
"CFR-A",N/A,N/A,N/A,N/A,N/A,N/A,N/A,N/A,N/A
"CFX",29.24,29.22,"29.05 - 29.64",300,300,408685,100,"3:30pm - <b>29.23</b>","Colfax Corporation Common Stock"
"CGA",1.4400,1.4300,"1.4300 - 1.4600",2100,1400,30667,600,"3:28pm - <b>1.4329</b>","China Green Agriculture, Inc. C"
"CGG",N/A,N/A,"24.6327 - 24.6600",N/A,N/A,616,400,"10:01am - <b>24.6327</b>","CGG"
"CGI",8.46,8.45,"8.26 - 8.74",400,500,278426,100,"3:29pm - <b>8.44</b>","Celadon Group, Inc. Common Stoc"
"CHA",50.49,50.44,"50.45 - 50.73",100,200,4426,100,"2:56pm - <b>50.45</b>","China Telecom Corp Ltd ADS"
"CHCT",22.86,22.81,"22.81 - 23.03",400,100,23429,100,"3:30pm - <b>22.83</b>","Community Healthcare Trust Inco"
"CHD",47.99,47.98,"47.65 - 48.17",300,400,712579,100,"3:29pm - <b>48.00</b>","Church & Dwight Company, Inc. C"
"CHE",142.33,142.11,"140.59 - 143.00",100,200,60514,100,"3:30pm - <b>142.31</b>","Chemed Corp"
"CHGG",7.04,7.03,"7.00 - 7.17",500,1200,240683,100,"3:29pm - <b>7.04</b>","Chegg, Inc. Common Stock"
"CHH",45.69,45.66,"45.52 - 47.27",200,100,166182,260,"3:30pm - <b>45.64</b>","Choice Hotels International, In"
"CHK",6.63,6.62,"6.60 - 6.84",15300,31200,20346457,100,"3:30pm - <b>6.62</b>","Chesapeake Energy Corporation C"
"CHK-D",N/A,N/A,N/A,N/A,N/A,N/A,N/A,N/A,N/A
"CHKR",2.08,2.07,"2.05 - 2.11",200,300,79689,100,"3:21pm - <b>2.06</b>","Chesapeake Granite Wash Trust C"
"CHL",61.25,61.24,"61.14 - 61.51",100,600,188066,100,"3:29pm - <b>61.26</b>","China Mobile Limited Common Sto"
"CHMI",17.81,17.73,"17.63 - 17.89",300,100,56476,100,"3:26pm - <b>17.73</b>","Cherry Hill Mortgage Investment"
"CHMT",32.620,32.610,"32.500 - 32.730",4600,13300,19342841,147,"3:30pm - <b>32.615</b>","Chemtura Corp. Common Stock"
"CHN",16.17,16.15,"16.14 - 16.28",100,600,18229,100,"3:27pm - <b>16.16</b>","China Fund, Inc. (The) Common S"
"CHS",12.340,12.330,"12.310 - 12.600",1400,6200,1103265,100,"3:29pm - <b>12.335</b>","Chico's FAS, Inc. Common Stock"
"CHSP",23.64,23.63,"23.57 - 23.90",400,100,216299,100,"3:27pm - <b>23.64</b>","Chesapeake Lodging Trust Common"
"CHSP-A",N/A,N/A,N/A,N/A,N/A,N/A,N/A,N/A,N/A
"CHT",35.34,35.31,"35.25 - 35.44",700,300,183794,100,"3:29pm - <b>35.34</b>","Chunghwa Telecom Co., Ltd."
"CHU",12.030,12.020,"12.020 - 12.140",1600,1500,194158,100,"3:30pm - <b>12.025</b>","China Unicom (Hong Kong) Ltd Co"
"CI",130.15,130.08,"129.97 - 130.72",200,200,423070,100,"3:29pm - <b>130.04</b>","Cigna Corporation Common Stock"
"CIA",10.15,10.11,"9.94 - 10.18",300,200,34365,100,"3:27pm - <b>10.17</b>","Citizens, Inc. Class A Common S"
"CIB",37.72,37.67,"37.60 - 38.07",300,100,201525,100,"3:27pm - <b>37.68</b>","BanColombia S.A. Common Stock"
"CIE",1.090,1.080,"1.020 - 1.090",34500,6900,2116627,100,"3:29pm - <b>1.085</b>","Cobalt International Energy, In"
"CIEN",22.08,22.07,"21.82 - 22.20",1200,700,1058307,100,"3:28pm - <b>22.07</b>","Ciena Corporation Common Stock"
"CIF",2.530,2.520,"2.515 - 2.550",600,700,63340,3530,"3:29pm - <b>2.521</b>","MFS Intermediate High Income Fu"
"CIG",2.70,2.69,"2.63 - 2.73",63400,10100,1211385,100,"3:30pm - <b>2.69</b>","Comp En De Mn Cemig ADS America"
"CIG.C",N/A,N/A,N/A,N/A,N/A,N/A,N/A,N/A,N/A
"CII",13.78,13.75,"13.74 - 13.85",600,500,68306,240,"3:26pm - <b>13.74</b>","Blackrock Capital and Income Fu"
"CIM",16.58,16.57,"16.51 - 16.74",2500,2500,1571464,100,"3:30pm - <b>16.57</b>","Chimera Investment Corporation "
"CINR",30.45,30.25,"30.14 - 30.70",100,500,16208,100,"3:28pm - <b>30.27</b>","Ciner Resources LP Common Units"
"CIO",13.160,13.140,"13.130 - 13.230",200,100,64364,100,"3:28pm - <b>13.155</b>","City Office REIT, Inc. Common S"
"CIR",57.75,57.58,"57.53 - 58.41",200,100,49523,100,"3:30pm - <b>57.79</b>","CIRCOR International, Inc. Comm"
"CIT",35.31,35.30,"35.05 - 35.84",400,700,1226725,100,"3:30pm - <b>35.30</b>","CIT Group Inc (DEL) Common Stoc"
"CIVI",18.11,18.06,"18.05 - 18.49",200,300,24895,100,"3:25pm - <b>18.12</b>","Civitas Solutions, Inc. Common "
"CKH",56.5400,56.4500,"56.0200 - 57.0900",200,100,149453,100,"3:29pm - <b>56.4404</b>","SEACOR Holdings Inc. Common Sto"
"CL",73.180,73.170,"72.810 - 73.390",1500,900,1649412,100,"3:30pm - <b>73.185</b>","Colgate-Palmolive Company Commo"
"CLA",25.74,25.61,"25.60 - 25.94",100,100,2369,182,"2:00pm - <b>25.60</b>","Capitala Finance Corp. 7.125% N"
"CLB",104.410,104.350,"103.970 - 106.205",200,200,555498,100,"3:30pm - <b>104.375</b>","Core Laboratories N.V. Common S"
"CLC",63.79,63.76,"63.30 - 64.16",200,100,92093,200,"3:29pm - <b>63.74</b>","CLARCOR Inc. Common Stock"
"CLD",4.54,4.53,"4.46 - 4.73",1200,400,1132101,100,"3:30pm - <b>4.54</b>","Cloud Peak Energy Inc Common St"
