Symbol,Ask,Bid,Range,AskSize,BidSize,Volume,LastTradeSize,LastTradeWithTime,Name
"RDY",47.40,47.36,"47.12 - 48.02",200,100,89442,100,"3:06pm - <b>47.17</b>","Dr. Reddy's Laboratories Ltd Co"
"RE",192.42,192.39,"190.79 - 192.63",100,100,183026,100,"3:06pm - <b>192.24</b>","Everest Re Group, Ltd. Common S"
"REG",79.69,79.67,"78.72 - 79.81",400,200,408772,100,"3:07pm - <b>79.57</b>","Regency Centers Corporation Com"
"REG-F",N/A,N/A,N/A,N/A,N/A,N/A,N/A,N/A,N/A
"REG-G",N/A,N/A,N/A,N/A,N/A,N/A,N/A,N/A,N/A
"RELX",19.00,18.99,"18.96 - 19.02",1400,200,32189,100,"3:06pm - <b>18.97</b>","RELX PLC PLC American Depositar"
"REN",22.50,22.49,"22.15 - 23.29",200,200,538300,100,"3:06pm - <b>22.54</b>","Resolute Energy Corporation Com"
"RENN",1.95,1.94,"1.87 - 1.96",400,5300,625549,100,"3:05pm - <b>1.95</b>","Renren Inc. American Depositary"
"RENX",17.57,17.55,"17.54 - 17.64",1200,200,65410,100,"3:06pm - <b>17.55</b>","RELX N.V. American Depositary S"
"RES",15.73,15.72,"15.61 - 16.05",1000,1500,715783,100,"3:06pm - <b>15.73</b>","RPC, Inc. Common Stock"
"RESI",10.66,10.65,"10.63 - 10.81",500,900,204671,100,"3:07pm - <b>10.65</b>","Altisource Residential Corporat"
"REV",36.87,36.82,"36.37 - 36.91",200,400,35892,100,"2:59pm - <b>36.89</b>","Revlon, Inc. New Common Stock"
"REX",83.480,83.330,"82.530 - 84.800",100,200,121807,100,"3:07pm - <b>83.405</b>","REX American Resources Corporat"
"REXR",23.20,23.18,"22.96 - 23.38",500,500,539902,100,"3:06pm - <b>23.20</b>","Rexford Industrial Realty, Inc."
"REXR-A",N/A,N/A,N/A,N/A,N/A,N/A,N/A,N/A,N/A
"RF",9.580,9.570,"9.530 - 9.710",11900,74000,12966466,524,"3:07pm - <b>9.585</b>","Regions Financial Corporation C"
"RF-A",N/A,N/A,N/A,N/A,N/A,N/A,N/A,N/A,N/A
"RF-B",N/A,N/A,N/A,N/A,N/A,N/A,N/A,N/A,N/A
"RFI",13.32,13.30,"13.27 - 13.35",1100,1800,43404,100,"3:05pm - <b>13.30</b>","Cohen & Steers Total Return Rea"
"RFP",4.790,4.780,"4.760 - 4.910",200,400,50920,100,"3:06pm - <b>4.775</b>","Resolute Forest Products Inc. C"
"RFT",22.30,22.21,"22.29 - 22.30",7200,500,2140,400,"2:22pm - <b>22.30</b>","RAIT Financial Trust 7.625% Sen"
"RFTA",24.50,24.32,"24.30 - 24.45",2000,100,6049,200,"3:07pm - <b>24.32</b>","RAIT Financial Trust 7.125% Sen"
"RGA",107.30,107.21,"106.70 - 107.90",100,100,110813,100,"3:07pm - <b>107.41</b>","Reinsurance Group of America, I"
"RGC",21.39,21.38,"21.28 - 21.54",2000,200,342132,177,"3:06pm - <b>21.38</b>","Regal Entertainment Group Class"
"RGR",56.33,56.23,"55.63 - 56.85",200,200,178906,100,"3:07pm - <b>56.28</b>","Sturm, Ruger & Company, Inc. Co"
"RGS",12.53,12.52,"12.44 - 12.61",100,300,38699,100,"3:06pm - <b>12.54</b>","Regis Corporation Common Stock"
"RGT",8.0800,8.0600,"8.0600 - 8.0900",600,2700,61080,100,"1:48pm - <b>8.0607</b>","Royce Global Value Trust, Inc. "
"RH",31.71,31.70,"31.59 - 32.75",300,300,1718751,100,"3:06pm - <b>31.68</b>","Restoration Hardware Holdings I"
"RHI",37.580,37.570,"37.290 - 37.720",400,800,310815,300,"3:07pm - <b>37.615</b>","Robert Half International Inc. "
"RHP",49.97,49.91,"49.91 - 51.09",200,100,98600,100,"3:06pm - <b>49.96</b>","Ryman Hospitality Properties, I"
"RHT",78.94,78.91,"78.73 - 80.00",500,300,1615611,200,"3:06pm - <b>78.80</b>","Red Hat, Inc. Common Stock"
"RICE",27.07,27.06,"26.83 - 27.39",700,1000,1165685,500,"3:06pm - <b>27.09</b>","Rice Energy Inc. Common Stock"
"RIG",9.5500,9.5400,"9.1000 - 9.6200",40300,7600,11501823,100,"3:07pm - <b>9.5401</b>","Transocean Ltd (Switzerland) Co"
"RIGP",11.04,11.02,"10.65 - 11.17",200,4600,41291,100,"3:04pm - <b>11.09</b>","Transocean Partners LLC Common "
"RIO",32.21,32.20,"32.15 - 32.53",600,1200,1540538,100,"3:06pm - <b>32.20</b>","Rio Tinto Plc Common Stock"
"RIV",19.95,19.93,"19.90 - 20.10",1000,200,19379,750,"3:04pm - <b>19.95</b>","RiverNorth Opportunities Fund, "
"RJD",25.90,25.89,"25.85 - 25.91",200,100,18514,100,"2:59pm - <b>25.89</b>","Raymond James Financial, Inc. 6"
"RJF",56.74,56.73,"56.59 - 57.54",100,200,265225,100,"3:06pm - <b>56.80</b>","Raymond James Financial, Inc. C"
"RL",96.99,96.93,"96.63 - 99.95",300,200,462940,100,"3:06pm - <b>96.91</b>","Ralph Lauren Corporation Common"
"RLGY",25.62,25.61,"25.55 - 25.95",500,700,790013,174,"3:07pm - <b>25.66</b>","Realogy Holdings Corp. Common S"
"RLH",8.32,8.26,"8.10 - 8.29",100,800,9283,300,"3:04pm - <b>8.26</b>","Red Lions Hotels Corporation Co"
"RLI",67.95,67.85,"67.65 - 68.42",400,100,46280,100,"3:06pm - <b>67.91</b>","RLI Corp. Common Stock"
"RLJ",21.57,21.56,"21.55 - 22.05",800,600,712422,100,"3:06pm - <b>21.57</b>","RLJ Lodging Trust Common Shares"
"RM",21.81,21.75,"21.59 - 22.13",400,100,33983,100,"3:06pm - <b>21.85</b>","Regional Management Corp. Commo"
"RMAX",43.71,43.62,"43.47 - 44.12",300,100,23582,100,"2:59pm - <b>43.70</b>","RE/MAX Holdings, Inc. Class A C"
"RMD",63.66,63.64,"63.31 - 63.90",200,200,556380,100,"3:06pm - <b>63.74</b>","ResMed Inc. Common Stock"
"RMP",21.37,21.33,"20.79 - 21.44",200,200,109499,100,"3:04pm - <b>21.36</b>","Rice Midstream Partners LP Comm"
"RMT",7.7100,7.7000,"7.6800 - 7.7500",1300,500,78705,500,"3:06pm - <b>7.7001</b>","Royce Micro-Cap Trust, Inc. Com"
"RNG",23.56,23.53,"23.28 - 23.71",400,500,116643,100,"3:07pm - <b>23.55</b>","Ringcentral, Inc. Class A Commo"
"RNP",20.330,20.310,"20.130 - 20.370",200,300,160777,100,"3:06pm - <b>20.305</b>","Cohen & Steers Reit and Preferr"
"RNR",119.88,119.81,"119.58 - 120.23",100,100,79776,100,"3:06pm - <b>119.91</b>","RenaissanceRe Holdings Ltd. Com"
"RNR-C",N/A,N/A,N/A,N/A,N/A,N/A,N/A,N/A,N/A
"RNR-E",N/A,N/A,N/A,N/A,N/A,N/A,N/A,N/A,N/A
"ROG",60.62,60.53,"60.21 - 60.97",100,100,53905,100,"2:59pm - <b>60.66</b>","Rogers Corporation Common Stock"
"ROK",114.88,114.86,"114.78 - 116.07",200,300,281039,100,"3:06pm - <b>114.94</b>","Rockwell Automation, Inc. Commo"
"ROL",28.82,28.80,"28.81 - 29.00",400,300,130541,100,"3:03pm - <b>28.81</b>","Rollins, Inc. Common Stock"
"ROP",178.43,178.34,"178.04 - 179.61",200,100,140119,100,"3:06pm - <b>178.28</b>","Roper Technologies, Inc. Common"
"ROYT",1.8400,1.8300,"1.8110 - 1.8900",100,300,99520,400,"3:05pm - <b>1.8512</b>","Pacific Coast Oil Trust Units o"
"RPAI",17.200,17.190,"17.150 - 17.310",3200,4300,1160626,400,"3:07pm - <b>17.195</b>","Retail Properties of America, I"
"RPAI-A",N/A,N/A,N/A,N/A,N/A,N/A,N/A,N/A,N/A
"RPM",52.83,52.81,"52.33 - 52.94",200,300,199111,100,"3:06pm - <b>52.85</b>","RPM International Inc. Common S"
"RPT",18.98,18.97,"18.76 - 19.01",500,500,198628,100,"3:06pm - <b>18.98</b>","Ramco-Gershenson Properties Tru"
"RPT-D",N/A,N/A,N/A,N/A,N/A,N/A,N/A,N/A,N/A
"RQI",13.3500,13.3300,"13.1400 - 13.3600",1900,800,238762,1400,"3:06pm - <b>13.3499</b>","Cohen & Steers Quality Income R"
"RRC",38.60,38.59,"38.32 - 39.32",600,200,2617356,100,"3:07pm - <b>38.64</b>","Range Resources Corporation Com"
"RRD",16.17,16.16,"16.07 - 16.29",3200,900,2271075,100,"3:06pm - <b>16.19</b>","R.R. Donnelley & Sons Company C"
"RRMS",26.29,26.23,"26.12 - 26.76",700,400,192264,200,"3:06pm - <b>26.25</b>","Rose Rock Midstream, L.P. Commo"
"RRTS",7.61,7.59,"7.58 - 7.94",500,400,92060,100,"3:06pm - <b>7.58</b>","Roadrunner Transportation Syste"
"RS",71.64,71.61,"71.08 - 71.85",300,200,247177,100,"3:06pm - <b>71.70</b>","Reliance Steel & Aluminum Co. C"
"RSG",50.81,50.80,"50.58 - 51.01",300,1300,604324,100,"3:07pm - <b>50.84</b>","Republic Services, Inc. Common "
"RSO",13.32,13.31,"13.26 - 13.44",200,100,166469,100,"3:06pm - <b>13.31</b>","Resource Capital Corp. Resource"
"RSO-A",N/A,N/A,N/A,N/A,N/A,N/A,N/A,N/A,N/A
"RSO-B",N/A,N/A,N/A,N/A,N/A,N/A,N/A,N/A,N/A
"RSO-C",N/A,N/A,N/A,N/A,N/A,N/A,N/A,N/A,N/A
"RSPP",36.06,36.05,"35.44 - 36.20",300,300,727588,100,"3:07pm - <b>36.08</b>","RSP Permian, Inc. Common Stock"
"RST",8.16,8.11,"8.03 - 8.29",200,100,10483,100,"3:04pm - <b>8.10</b>","Rosetta Stone Rosetta Stone, In"
"RT",2.740,2.730,"2.720 - 2.840",1800,1400,360681,100,"3:06pm - <b>2.735</b>","Ruby Tuesday, Inc. Common Stock"
"RTEC",17.58,17.56,"17.07 - 17.64",400,300,124934,100,"3:06pm - <b>17.56</b>","Rudolph Technologies, Inc. Comm"
"RTN",138.74,138.72,"137.79 - 139.07",200,200,634191,100,"3:06pm - <b>138.74</b>","Raytheon Company Common Stock"
"RUBI",8.210,8.200,"8.180 - 8.465",500,800,341149,100,"3:05pm - <b>8.205</b>","The Rubicon Project, Inc. Commo"
"RVT",12.480,12.470,"12.465 - 12.610",2700,9500,138721,100,"3:06pm - <b>12.475</b>","Royce Value Trust, Inc. Common "
"RWT",14.21,14.20,"14.18 - 14.39",900,1300,186616,200,"3:07pm - <b>14.21</b>","Redwood Trust, Inc. Common Stoc"
"RXN",20.85,20.84,"20.35 - 21.02",500,300,340125,100,"3:07pm - <b>20.88</b>","Rexnord Corporation Common Stoc"
"RY",61.06,61.05,"61.03 - 61.60",1100,300,380033,100,"3:07pm - <b>61.11</b>","Royal Bank Of Canada Common Sto"
"RY-S",N/A,N/A,N/A,N/A,N/A,N/A,N/A,N/A,N/A
"RY-T",N/A,N/A,N/A,N/A,N/A,N/A,N/A,N/A,N/A
"RYAM",12.2500,12.2300,"12.1500 - 12.5700",1100,300,254002,100,"3:06pm - <b>12.2101</b>","Rayonier Advanced Materials Inc"
"RYAM-A",N/A,N/A,N/A,N/A,N/A,N/A,N/A,N/A,N/A
"RYI",11.19,11.15,"11.11 - 11.41",300,100,83893,100,"3:06pm - <b>11.20</b>","Ryerson Holding Corporation Com"
"RYN",26.89,26.87,"26.75 - 27.08",500,200,153773,100,"3:07pm - <b>26.88</b>","Rayonier Inc. REIT Common Stock"
"RZA",29.4600,29.4100,"29.3700 - 29.5500",200,200,21908,395,"2:47pm - <b>29.4217</b>","Reinsurance Group of America, I"
"RZB",29.26,29.18,"29.16 - 29.50",200,200,26316,100,"3:04pm - <b>29.17</b>","Reinsurance Group of America, I"
"S",6.69,6.68,"6.63 - 6.78",18900,307300,10812773,100,"3:06pm - <b>6.69</b>","Sprint Corporation Common Stock"
"SA",10.97,10.96,"10.97 - 11.38",400,200,318376,100,"3:06pm - <b>10.97</b>","Seabridge Gold, Inc. Ordinary S"
"SAH",18.2700,18.2600,"18.1600 - 18.3300",400,400,237236,361,"3:07pm - <b>18.2634</b>","Sonic Automotive, Inc. Common S"
"SAIC",69.70,69.63,"69.39 - 70.30",300,200,104659,100,"3:06pm - <b>69.70</b>","SCIENCE APPLICATIONS INTERNATIO"
"SALT",3.78,3.76,"3.72 - 4.00",1200,800,192606,100,"3:04pm - <b>3.78</b>","Scorpio Bulkers Inc. Common Sto"
"SAM",150.81,150.57,"149.75 - 152.52",100,200,190500,100,"3:03pm - <b>150.19</b>","Boston Beer Company, Inc. (The)"
"SAN",4.35,4.34,"4.33 - 4.38",195100,19400,4131515,200,"3:07pm - <b>4.34</b>","Banco Santander, S.A. Sponsored"
"SAN-A",N/A,N/A,N/A,N/A,N/A,N/A,N/A,N/A,N/A
"SAN-B",N/A,N/A,N/A,N/A,N/A,N/A,N/A,N/A,N/A
"SAN-C",N/A,N/A,N/A,N/A,N/A,N/A,N/A,N/A,N/A
"SAN-I",N/A,N/A,N/A,N/A,N/A,N/A,N/A,N/A,N/A
"SAP",90.780,90.770,"90.500 - 91.030",200,500,527545,100,"3:06pm - <b>90.775</b>","SAP  SE ADS"
"SAQ",25.6000,25.4700,"25.4600 - 25.7100",100,200,6488,155,"2:21pm - <b>25.6733</b>","Saratoga Investment Corp 7.50% "
"SAR",18.11,17.95,"17.90 - 18.15",300,200,24136,100,"2:52pm - <b>18.09</b>","Saratoga Investment Corp New"
"SB",1.53,1.52,"1.52 - 1.59",500,3700,88055,100,"2:59pm - <b>1.53</b>","Safe Bulkers, Inc Common Stock "
"SB-B",N/A,N/A,N/A,N/A,N/A,N/A,N/A,N/A,N/A
"SB-C",N/A,N/A,N/A,N/A,N/A,N/A,N/A,N/A,N/A
"SB-D",N/A,N/A,N/A,N/A,N/A,N/A,N/A,N/A,N/A
"SBGL",14.0300,14.0100,"13.9950 - 14.4200",300,400,242303,250,"3:06pm - <b>14.0264</b>","Sibanye Gold Limited American D"
"SBH",28.080,28.070,"27.940 - 28.590",500,900,5441958,100,"3:07pm - <b>28.055</b>","Sally Beauty Holdings, Inc. (Na"
"SBNA",24.04,23.96,"23.93 - 24.25",100,100,2969,100,"2:01pm - <b>23.96</b>","Scorpio Tankers Inc. 6.75% Seni"
"SBNB",25.80,25.42,"25.56 - 25.79",100,1200,5984,100,"2:20pm - <b>25.73</b>","Scorpio Tankers Inc. 7.50% Seni"
"SBR",37.09,36.50,"36.42 - 37.15",100,100,8438,100,"2:49pm - <b>36.62</b>","Sabine Royalty Trust Common Sto"
"SBS",9.25,9.24,"9.19 - 9.33",1100,6900,863868,100,"3:06pm - <b>9.25</b>","Companhia de saneamento Basico "
"SBW",11.57,11.56,"11.38 - 11.62",100,1300,124267,1100,"3:03pm - <b>11.49</b>","Western Asset Worldwide Income "
"SBY",18.32,18.31,"18.22 - 18.56",300,100,191845,100,"3:06pm - <b>18.33</b>","Silver Bay Realty Trust Corp. C"
"SC",11.8800,11.8700,"11.5800 - 11.8900",1200,1100,1455523,1400,"3:07pm - <b>11.8767</b>","Santander Consumer USA Holdings"
"SCCO",25.8300,25.8200,"25.7900 - 26.0600",300,1000,292133,100,"3:06pm - <b>25.8242</b>","Southern Copper Corporation Com"
"SCD",13.470,13.450,"13.400 - 13.530",700,200,23526,756,"2:44pm - <b>13.421</b>","LMP Capital and Income Fund Inc"
"SCE-F",N/A,N/A,N/A,N/A,N/A,N/A,N/A,N/A,N/A
"SCE-G",N/A,N/A,N/A,N/A,N/A,N/A,N/A,N/A,N/A
"SCE-H",N/A,N/A,N/A,N/A,N/A,N/A,N/A,N/A,N/A
"SCE-J",N/A,N/A,N/A,N/A,N/A,N/A,N/A,N/A,N/A
"SCE-K",N/A,N/A,N/A,N/A,N/A,N/A,N/A,N/A,N/A
"SCG",75.47,75.45,"74.67 - 75.60",200,400,645657,100,"3:06pm - <b>75.46</b>","SCANA Corporation Common Stock"
"SCHW",30.52,30.51,"30.34 - 30.75",2400,500,4321089,100,"3:07pm - <b>30.51</b>","Charles Schwab Corporation (The"
"SCHW-B",N/A,N/A,N/A,N/A,N/A,N/A,N/A,N/A,N/A
"SCHW-C",N/A,N/A,N/A,N/A,N/A,N/A,N/A,N/A,N/A
"SCHW-D",N/A,N/A,N/A,N/A,N/A,N/A,N/A,N/A,N/A
"SCI",26.55,26.54,"26.25 - 26.57",500,2400,425804,100,"3:07pm - <b>26.55</b>","Service Corporation Internation"
"SCL",73.00,72.87,"71.13 - 73.88",100,200,163430,100,"3:07pm - <b>73.04</b>","Stepan Company Common Stock"
"SCM",11.1600,11.1500,"11.0800 - 11.3100",200,700,81222,200,"3:04pm - <b>11.2001</b>","Stellus Capital Investment Corp"
"SCNB",34.12,33.94,"33.92 - 34.37",200,2000,16697,100,"2:38pm - <b>34.01</b>","Suffolk Bancorp Common Stock"
"SCQ",25.550,25.260,N/A,100,200,0,N/A,"4:00pm - <b>25.495</b>","Stellus Capital Investment Corp"
"SCS",14.190,14.180,"13.745 - 14.320",1000,1000,1159139,100,"3:07pm - <b>14.195</b>","Steelcase Inc. Common Stock"
"SCX",10.13,10.05,"10.00 - 10.14",300,100,6272,170,"2:12pm - <b>10.01</b>","L.S. Starrett Company (The) Com"
"SDLP",3.17,3.16,"3.12 - 3.27",500,2500,308856,100,"3:05pm - <b>3.18</b>","Seadrill Partners LLC Common Un"
"SDR",1.4400,1.4100,"1.3800 - 1.4400",800,900,47506,750,"3:06pm - <b>1.4388</b>","SandRidge Mississippian Trust I"
"SDRL",2.030,2.020,"2.020 - 2.090",77100,216100,3654350,100,"3:06pm - <b>2.025</b>","Seadrill Limited Ordinary Share"
"SDT",1.420,1.400,"1.390 - 1.469",200,700,135503,200,"3:02pm - <b>1.415</b>","SandRidge Mississippian Trust I"
"SE",41.780,41.770,"41.760 - 42.170",800,2100,1595342,100,"3:07pm - <b>41.765</b>","Spectra Energy Corp Common Stoc"
"SEAS",13.47,13.46,"13.28 - 13.59",800,1500,1250521,100,"3:07pm - <b>13.47</b>","SeaWorld Entertainment, Inc. Co"
"SEE",46.72,46.71,"46.24 - 46.95",400,400,793639,100,"3:07pm - <b>46.72</b>","Sealed Air Corporation Common S"
"SEM",12.76,12.75,"12.65 - 12.99",1300,100,386372,100,"3:07pm - <b>12.75</b>","Select Medical Holdings Corpora"
"SEMG",32.45,32.42,"32.24 - 33.20",100,400,496100,100,"3:07pm - <b>32.48</b>","Semgroup Corporation Class A Co"
"SEP",44.60,44.59,"44.34 - 44.75",200,200,415965,100,"3:06pm - <b>44.60</b>","Spectra Energy Partners, LP Com"
"SERV",33.48,33.47,"33.28 - 33.58",500,200,892880,100,"3:06pm - <b>33.49</b>","ServiceMaster Global Holdings, "
"SF",37.78,37.75,"37.76 - 39.09",200,500,205724,150,"3:06pm - <b>37.82</b>","Stifel Financial Corporation Co"
"SF-A",N/A,N/A,N/A,N/A,N/A,N/A,N/A,N/A,N/A
"SFE",13.110,13.060,"13.050 - 13.570",200,300,31402,100,"2:59pm - <b>13.065</b>","Safeguard Scientifics, Inc. New"
"SFL",14.60,14.59,"14.54 - 14.84",500,1100,203241,100,"3:06pm - <b>14.61</b>","Ship Finance International Limi"
"SFR",30.64,30.63,"30.58 - 31.17",200,300,136603,100,"3:06pm - <b>30.62</b>","Colony Starwood Homes Common Sh"
"SFS",12.590,12.580,"12.510 - 12.670",600,400,111659,100,"3:07pm - <b>12.585</b>","Smart & Final Stores, Inc. Comm"
"SFUN",4.51,4.50,"4.49 - 4.59",21000,13300,1314923,100,"3:07pm - <b>4.50</b>","Fang Holdings Limited American "
"SGF",9.27,9.25,"9.25 - 9.27",700,500,7141,100,"2:59pm - <b>9.27</b>","Aberdeen Singapore Fund, Inc. C"
"SGM",4.24,4.18,"4.03 - 4.28",200,100,14511,100,"3:05pm - <b>4.10</b>","Stonegate Mortgage Corporation "
"SGU",9.69,9.67,"9.48 - 9.75",100,100,13819,100,"3:04pm - <b>9.69</b>","Star Gas Partners, L.P. Common "
"SGY",10.59,10.57,"10.53 - 11.18",200,400,341372,100,"3:06pm - <b>10.62</b>","Stone Energy Corporation Common"
"SGZA",26.7000,26.4200,"26.2800 - 26.7349",100,100,11183,191,"3:04pm - <b>26.5198</b>","Selective Insurance Group, Inc."
"SHAK",35.29,35.27,"34.93 - 35.53",200,200,273306,100,"3:06pm - <b>35.29</b>","Shake Shack, Inc. Class A Commo"
"SHG",36.03,35.99,"35.98 - 36.30",100,200,36382,100,"3:05pm - <b>36.04</b>","Shinhan Financial Group Co Ltd "
"SHI",50.9600,50.8600,"50.5600 - 51.0000",300,600,9591,100,"3:04pm - <b>50.8366</b>","SINOPEC Shangai Petrochemical C"
"SHLX",32.12,32.06,"31.01 - 32.23",200,200,388512,100,"3:06pm - <b>32.11</b>","Shell Midstream Partners, L.P. "
"SHO",12.60,12.59,"12.56 - 12.80",1800,8200,2222045,100,"3:07pm - <b>12.61</b>","Sunstone Hotel Investors, Inc. "
"SHO-E",N/A,N/A,N/A,N/A,N/A,N/A,N/A,N/A,N/A
"SHO-F",N/A,N/A,N/A,N/A,N/A,N/A,N/A,N/A,N/A
"SHOP",43.32,43.31,"42.90 - 43.47",200,200,296760,100,"3:06pm - <b>43.27</b>","Shopify Inc. Class A Subordinat"
"SHW",280.7200,280.6200,"280.5100 - 282.9400",100,300,387110,110,"3:06pm - <b>280.8183</b>","Sherwin-Williams Company (The) "
"SID",2.66,2.65,"2.63 - 2.70",25800,9400,901316,100,"3:06pm - <b>2.66</b>","Companhia Siderurgica Nacional "
"SIG",76.540,76.520,"76.500 - 78.630",600,200,731400,300,"3:07pm - <b>76.595</b>","Signet Jewelers Limited Common "
"SITE",36.45,36.41,"36.43 - 37.17",200,300,150246,100,"3:06pm - <b>36.45</b>","SiteOne Landscape Supply, Inc. "
"SIX",54.02,54.01,"53.52 - 54.11",300,200,891212,100,"3:06pm - <b>54.04</b>","Six Flags Entertainment Corpora"
"SJI",30.79,30.77,"30.46 - 30.87",200,500,124047,175,"3:06pm - <b>30.78</b>","South Jersey Industries, Inc. C"
"SJM",137.54,137.51,"136.45 - 138.23",100,300,425988,101,"3:06pm - <b>137.55</b>","J.M. Smucker Company (The) New "
"SJR",19.800,19.790,"19.670 - 19.920",4100,1000,431926,100,"3:06pm - <b>19.805</b>","Shaw Communications Inc. Common"
"SJT",5.94,5.89,"5.88 - 6.12",100,100,115196,100,"3:06pm - <b>5.90</b>","San Juan Basin Royalty Trust Co"
"SJW",45.20,45.11,"44.64 - 45.43",200,100,28170,100,"3:06pm - <b>45.21</b>","SJW Corporation Common Stock"
"SKM",21.97,21.96,"21.91 - 22.13",900,2300,247783,100,"3:07pm - <b>21.97</b>","SK Telecom Co., Ltd. Common Sto"
"SKT",39.91,39.90,"39.58 - 39.97",400,200,255683,100,"3:06pm - <b>39.91</b>","Tanger Factory Outlet Centers, "
"SKX",22.08,22.07,"21.88 - 22.21",1100,700,1608995,100,"3:06pm - <b>22.07</b>","Skechers U.S.A., Inc. Common St"
"SLB",75.79,75.78,"75.73 - 76.61",400,600,3594992,100,"3:07pm - <b>75.79</b>","Schlumberger N.V. Common Stock"
"SLCA",42.78,42.77,"42.71 - 43.84",200,300,966019,100,"3:06pm - <b>42.80</b>","U.S. Silica Holdings, Inc. Comm"
"SLF",31.69,31.68,"31.65 - 32.15",300,2600,227837,100,"3:06pm - <b>31.72</b>","Sun Life Financial Inc. Common "
"SLG",112.71,112.69,"112.10 - 113.68",200,100,432749,100,"3:06pm - <b>112.57</b>","SL Green Realty Corporation Com"
"SLG-I",N/A,N/A,N/A,N/A,N/A,N/A,N/A,N/A,N/A
"SLRA",25.72,25.56,"25.34 - 25.63",100,100,7632,100,"3:06pm - <b>25.55</b>","Solar Capital Ltd. 6.75% Senior"
"SLTB",20.9600,20.8600,"20.6400 - 20.9700",200,100,3221,600,"2:59pm - <b>20.8857</b>","Scorpio Bulkers Inc. 7.50% Seni"
"SLW",27.61,27.60,"27.53 - 28.19",100,2100,2716178,100,"3:06pm - <b>27.61</b>","Silver Wheaton Corp Common Shar"
"SM",34.15,34.13,"34.04 - 35.44",300,300,1862793,100,"3:06pm - <b>34.20</b>","SM Energy Company Common Stock"
"SMFG",7.00,6.99,"6.97 - 7.04",5600,4100,481654,100,"3:06pm - <b>7.00</b>","Sumitomo Mitsui Financial Group"
"SMG",81.87,81.83,"81.50 - 82.14",300,100,122939,100,"3:06pm - <b>81.88</b>","Scotts Miracle-Gro Company (The"
"SMI",5.50,5.49,"5.47 - 5.54",5400,100,103587,100,"3:06pm - <b>5.50</b>","Semiconductor  Manufacturing In"
"SMLP",23.1400,23.0800,"23.0200 - 23.2900",100,100,53571,100,"2:54pm - <b>23.0898</b>","Summit Midstream Partners, LP C"
"SMM",12.31,12.28,"12.18 - 12.34",200,400,70401,100,"3:06pm - <b>12.32</b>","Salient Midstream Common Shares"
"SMP",46.18,46.03,"45.87 - 46.34",100,100,20234,100,"3:06pm - <b>46.20</b>","Standard Motor Products, Inc. C"
"SN",8.28,8.27,"8.17 - 8.47",400,1500,1141029,100,"3:06pm - <b>8.29</b>","Sanchez Energy Corporation Comm"
"SNA",151.20,151.09,"150.63 - 151.75",100,100,227180,100,"3:06pm - <b>151.30</b>","Snap-On Incorporated Common Sto"
"SNE",33.500,33.490,"33.300 - 33.560",500,2000,430901,100,"3:06pm - <b>33.495</b>","Sony Corporation Common Stock"
