Symbol,Ask,Bid,Range,AskSize,BidSize,Volume,LastTradeSize,LastTradeWithTime,Name
"GFY",15.8600,15.8200,"15.8201 - 15.9699",100,100,9787,3000,"1:43pm - <b>15.8201</b>","Western Asset Variable Rate Str"
"GG",16.470,16.460,"16.430 - 16.890",3000,3800,4535628,100,"2:50pm - <b>16.465</b>","Goldcorp Inc. Common Stock"
"GGB",2.660,2.650,"2.600 - 2.680",76000,35800,4437266,100,"2:50pm - <b>2.655</b>","Gerdau S.A. Common Stock"
"GGE",15.9900,15.9500,"15.9192 - 16.0451",200,200,5231,1036,"2:49pm - <b>15.9504</b>","Guggenheim Enhanced Equity Stra"
"GGG",73.46,73.40,"72.59 - 73.82",100,200,109159,100,"2:49pm - <b>73.37</b>","Graco Inc. Common Stock"
"GGM",22.39,22.32,"22.33 - 22.40",200,200,12355,400,"2:46pm - <b>22.38</b>","Guggenheim Credit Allocation Fu"
"GGP",28.750,28.740,"28.630 - 28.900",2300,3000,1328890,100,"2:49pm - <b>28.745</b>","General Growth Properties, Inc."
"GGP-A",N/A,N/A,N/A,N/A,N/A,N/A,N/A,N/A,N/A
"GGT",7.59,7.57,"7.43 - 7.60",200,300,128914,175,"2:43pm - <b>7.54</b>","Gabelli Multi-Media Trust, Inc."
"GGT-B",N/A,N/A,N/A,N/A,N/A,N/A,N/A,N/A,N/A
"GGZ",10.75,10.73,"10.71 - 10.74",200,100,7080,100,"2:05pm - <b>10.73</b>","Gabelli Global Small and Mid Ca"
"GGZ-A",N/A,N/A,N/A,N/A,N/A,N/A,N/A,N/A,N/A
"GHC",484.9900,481.2700,"484.1400 - 491.9800",200,100,14814,100,"2:47pm - <b>484.3985</b>","Graham Holdings Company Common "
"GHL",22.64,22.62,"22.48 - 23.20",300,200,459110,100,"2:48pm - <b>22.62</b>","Greenhill & Co., Inc. Common St"
"GHM",18.41,18.31,"18.30 - 18.50",100,100,6959,100,"2:16pm - <b>18.49</b>","Graham Corporation Common Stock"
"GHY",15.01,15.00,"15.00 - 15.03",300,500,63807,170,"2:44pm - <b>15.00</b>","Prudential Global Short Duratio"
"GI",4.33,4.31,"4.09 - 4.34",300,100,36141,100,"2:49pm - <b>4.18</b>","EndoChoice Holdings, Inc. Commo"
"GIB",47.65,47.62,"47.43 - 48.00",400,100,58142,100,"2:49pm - <b>47.67</b>","CGI Group, Inc. Common Stock"
"GIL",27.96,27.95,"27.83 - 28.15",500,500,221148,100,"2:49pm - <b>27.95</b>","Gildan Activewear, Inc. Class A"
"GIM",6.20,6.19,"6.19 - 6.23",1300,17800,209425,100,"2:46pm - <b>6.19</b>","Templeton Global Income Fund, I"
"GIMO",53.590,53.540,"53.210 - 54.250",100,100,427802,100,"2:49pm - <b>53.548</b>","Gigamon Inc. Common Stock"
"GIS",63.85,63.84,"63.80 - 64.48",500,400,2042522,100,"2:49pm - <b>63.86</b>","General Mills, Inc. Common Stoc"
"GJH",10.47,10.30,"10.36 - 10.59",100,300,3225,199,"2:00pm - <b>10.43</b>","Synthetic Fixed-Income Securiti"
"GJO",21.06,20.80,"20.66 - 20.92",1600,100,3027,199,"1:58pm - <b>20.80</b>","Synthetic Fixed-Income Securiti"
"GJP",22.60,22.00,N/A,100,1400,50,N/A,"3:18pm - <b>22.08</b>","Synthetic Fixed-Income Securiti"
"GJR",20.78,20.16,N/A,100,500,0,N/A,"4:00pm - <b>20.39</b>","Synthetic Fixed-Income Securiti"
"GJS",18.41,18.07,"18.03 - 18.28",200,100,1924,100,"2:42pm - <b>18.03</b>","Goldman Sachs Group Securities "
"GJT",23.0900,12.9900,N/A,200,200,0,N/A,"3:10pm - <b>18.0408</b>","Synthetic Fixed-Income Securiti"
"GJV",26.2900,26.0700,"25.7800 - 26.1500",200,100,1574,150,"1:45pm - <b>25.9242</b>","Synthetic Fixed-Income Securiti"
"GKOS",38.46,38.41,"37.60 - 39.00",300,300,261138,100,"2:49pm - <b>38.46</b>","Glaukos Corporation Common Stoc"
"GLF",1.59,1.58,"1.55 - 1.73",7300,2300,903470,100,"2:49pm - <b>1.58</b>","GulfMark Offshore, Inc. New Com"
"GLOB",40.86,40.78,"40.56 - 41.69",100,100,127511,100,"2:48pm - <b>40.56</b>","Globant S.A. Common Shares"
"GLOG",13.35,13.33,"13.06 - 13.47",300,600,287935,100,"2:49pm - <b>13.35</b>","GasLog Ltd. Common Shares"
"GLOG-A",N/A,N/A,N/A,N/A,N/A,N/A,N/A,N/A,N/A
"GLOP",20.08,20.04,"19.93 - 20.37",100,200,112524,100,"2:40pm - <b>20.13</b>","GasLog Partners LP Common Units"
"GLP",16.90,16.85,"16.50 - 17.00",200,100,88356,100,"2:49pm - <b>16.90</b>","Global Partners LP Global Partn"
"GLT",22.16,22.13,"22.13 - 22.40",100,100,51999,100,"2:48pm - <b>22.16</b>","Glatfelter Common Stock"
"GLW",22.95,22.94,"22.91 - 23.05",6100,21600,3290535,100,"2:49pm - <b>22.95</b>","Corning Incorporated Common Sto"
"GM",31.81,31.80,"31.75 - 32.12",1600,7900,8346693,100,"2:49pm - <b>31.81</b>","General Motors Company Common S"
"GM",31.81,31.80,"31.75 - 32.12",1600,7900,8346693,100,"2:49pm - <b>31.81</b>","General Motors Company Common S"
"B",39.72,39.68,"39.42 - 40.07",200,400,61993,100,"2:49pm - <b>39.75</b>","Barnes Group, Inc. Common Stock"
"GME",27.75,27.74,"27.70 - 28.20",400,900,720297,100,"2:49pm - <b>27.74</b>","Gamestop Corporation Common Sto"
"GMED",22.37,22.36,"22.29 - 22.54",500,200,150428,100,"2:49pm - <b>22.36</b>","Globus Medical, Inc. Class A Co"
"GMRE",9.78,9.77,"9.72 - 10.19",400,100,150565,100,"2:49pm - <b>9.78</b>","Global Medical REIT Inc. Common"
"GMS",22.53,22.50,"22.22 - 22.69",100,300,59495,104,"2:49pm - <b>22.41</b>","GMS Inc. Common Stock"
"GMTA",26.14,26.05,"26.04 - 26.65",200,200,33530,200,"2:49pm - <b>26.07</b>","GATX Corporation 5.625% Senior "
"GMZ",9.380,9.370,"9.350 - 9.549",800,300,93686,2000,"2:50pm - <b>9.378</b>","Goldman Sachs MLP Income Opport"
"GNC",19.97,19.96,"19.91 - 20.16",800,400,897119,200,"2:50pm - <b>19.97</b>","GNC Holdings, Inc. Class A Comm"
"GNE",6.16,6.06,"6.07 - 6.16",200,300,7796,100,"2:15pm - <b>6.13</b>","Genie Energy Ltd. Class B Commo"
"GNE-A",N/A,N/A,N/A,N/A,N/A,N/A,N/A,N/A,N/A
"GNK",4.91,4.82,"4.82 - 5.00",300,300,16064,100,"2:49pm - <b>4.82</b>","Genco Shipping & Trading Limite"
"GNL",8.28,8.27,"8.26 - 8.34",500,3200,158372,700,"2:48pm - <b>8.27</b>","Global Net Lease, Inc. Common S"
"GNRC",34.66,34.63,"34.24 - 35.19",200,200,242265,100,"2:49pm - <b>34.56</b>","Generac Holdlings Inc. Common S"
"GNRT",4.97,4.95,"4.95 - 5.26",1600,2000,342264,100,"2:49pm - <b>4.97</b>","Gener8 Maritime, Inc. Common Sh"
"GNT",7.82,7.79,"7.66 - 7.94",200,200,93075,100,"2:49pm - <b>7.82</b>","GAMCO Natural Resources, Gold &"
"GNW",4.81,4.80,"4.76 - 4.92",20900,18500,4674860,100,"2:49pm - <b>4.80</b>","Genworth Financial Inc Common S"
"GOF",19.02,18.98,"18.94 - 19.02",100,300,29812,236,"2:49pm - <b>19.00</b>","Guggenheim Strategic Opportunit"
"GOL",19.92,19.89,"19.92 - 20.96",200,100,71719,100,"2:39pm - <b>19.92</b>","Gol Linhas Aereas Inteligentes "
"GPC",98.60,98.57,"97.87 - 98.82",100,100,267465,205,"2:49pm - <b>98.64</b>","Genuine Parts Company Common St"
"GPE-A",N/A,N/A,N/A,N/A,N/A,N/A,N/A,N/A,N/A
"GPI",61.770,61.750,"61.420 - 62.240",100,100,197174,100,"2:49pm - <b>61.905</b>","Group 1 Automotive, Inc. Common"
"GPK",14.10,14.09,"14.05 - 14.19",5400,7800,1363505,100,"2:49pm - <b>14.09</b>","Graphic Packaging Holding Compa"
"GPM",7.8900,7.8800,"7.8700 - 7.9400",300,100,32826,300,"2:48pm - <b>7.8864</b>","Guggenheim Enhanced Equity Inco"
"GPN",75.85,75.83,"74.70 - 76.04",300,100,604163,300,"2:49pm - <b>75.81</b>","Global Payments Inc. Common Sto"
"GPRK",3.40,3.37,"3.37 - 3.40",300,500,17280,100,"2:44pm - <b>3.39</b>","Geopark Ltd Common Shares"
"GPS",22.23,22.22,"22.19 - 22.59",500,2900,2452873,100,"2:49pm - <b>22.23</b>","Gap, Inc. (The) Common Stock"
"GPT",9.72,9.71,"9.69 - 9.81",5200,700,1108168,300,"2:49pm - <b>9.71</b>","Gramercy Property Trust"
"GPT-A",N/A,N/A,N/A,N/A,N/A,N/A,N/A,N/A,N/A
"GPX",24.86,24.77,"24.50 - 24.90",300,100,8644,100,"2:48pm - <b>24.77</b>","GP Strategies Corporation Commo"
"GRA",73.05,72.99,"72.37 - 73.13",100,200,249880,100,"2:49pm - <b>73.12</b>","W.R. Grace & Co. Common Stock"
"GRAM",8.35,8.28,"8.16 - 8.42",100,300,4695,100,"2:42pm - <b>8.36</b>","Grana y Montero S.A.A. American"
"GRO",0.86,0.83,"0.83 - 0.87",100,10000,12430,200,"2:18pm - <b>0.84</b>","Agria Corporation American Depo"
"GRP=",N/A,N/A,N/A,N/A,N/A,N/A,N/A,N/A,N/A
"GRR",10.08,10.04,"10.07 - 10.07",300,100,103,100,"9:30am - <b>10.07</b>","Asia Tigers Fund, Inc. (The) Co"
"GRUB",42.23,42.20,"41.00 - 42.36",600,600,949291,100,"2:50pm - <b>42.16</b>","GrubHub Inc. Common Stock"
"GRX",10.69,10.67,"10.61 - 10.80",200,400,40935,100,"2:49pm - <b>10.67</b>","The Gabelli Healthcare & Wellne"
"GRX-A",N/A,N/A,N/A,N/A,N/A,N/A,N/A,N/A,N/A
"GRX-B",N/A,N/A,N/A,N/A,N/A,N/A,N/A,N/A,N/A
"GS",161.12,161.10,"161.00 - 163.97",100,300,1813032,100,"2:49pm - <b>161.09</b>","Goldman Sachs Group, Inc. (The)"
"GS-A",N/A,N/A,N/A,N/A,N/A,N/A,N/A,N/A,N/A
"GS-B",N/A,N/A,N/A,N/A,N/A,N/A,N/A,N/A,N/A
"GS-C",N/A,N/A,N/A,N/A,N/A,N/A,N/A,N/A,N/A
"GS-D",N/A,N/A,N/A,N/A,N/A,N/A,N/A,N/A,N/A
"GS-I",N/A,N/A,N/A,N/A,N/A,N/A,N/A,N/A,N/A
"GS-J",N/A,N/A,N/A,N/A,N/A,N/A,N/A,N/A,N/A
"GS-K",N/A,N/A,N/A,N/A,N/A,N/A,N/A,N/A,N/A
"GS-N",N/A,N/A,N/A,N/A,N/A,N/A,N/A,N/A,N/A
"GSBD",22.03,21.98,"21.95 - 22.05",100,200,72957,100,"2:49pm - <b>22.02</b>","Goldman Sachs BDC, Inc. Common "
"GSH",25.94,25.92,"25.72 - 25.95",100,100,3054,100,"10:13am - <b>25.92</b>","Guangshen Railway Company Limit"
"GSJ",25.890,25.860,"25.851 - 25.930",200,700,18495,480,"2:41pm - <b>25.887</b>","Goldman Sachs Group, Inc. (The)"
"GSK",42.95,42.94,"42.87 - 43.10",2500,1200,1638159,100,"2:49pm - <b>42.94</b>","GlaxoSmithKline PLC Common Stoc"
"GSL",N/A,N/A,"1.65 - 1.72",N/A,N/A,24967,100,"2:46pm - <b>1.68</b>","Global Ship Lease Inc New Class"
"GSL-B",N/A,N/A,N/A,N/A,N/A,N/A,N/A,N/A,N/A
"GTN",10.2200,10.2100,"10.0100 - 10.3700",1500,800,1359627,200,"2:48pm - <b>10.2163</b>","Gray Communications Systems, In"
"GTN.A",N/A,N/A,N/A,N/A,N/A,N/A,N/A,N/A,N/A
"GTS",21.93,21.91,"21.49 - 22.03",100,200,72805,100,"2:49pm - <b>21.93</b>","Triple-S Management Corporation"
"GTT",23.54,23.50,"23.48 - 23.83",100,100,35931,100,"2:49pm - <b>23.50</b>","GTT Communications, Inc. Common"
"GTY",24.24,24.22,"24.00 - 24.26",200,200,32133,100,"2:47pm - <b>24.25</b>","Getty Realty Corporation Common"
"GUT",6.7400,6.7000,"6.7000 - 6.7600",300,400,24060,102,"2:45pm - <b>6.7472</b>","Gabelli Utility Trust (The) Com"
"GUT-A",N/A,N/A,N/A,N/A,N/A,N/A,N/A,N/A,N/A
"GUT-C",N/A,N/A,N/A,N/A,N/A,N/A,N/A,N/A,N/A
"GVA",48.65,48.57,"47.49 - 48.95",300,300,81439,100,"2:48pm - <b>48.58</b>","Granite Construction Incorporat"
"GWB",33.02,33.01,"32.70 - 33.39",100,200,400775,100,"2:48pm - <b>33.02</b>","Great Western Bancorp, Inc. Com"
"GWR",66.38,66.35,"65.58 - 66.67",100,200,158202,100,"2:49pm - <b>66.40</b>","Genesee & Wyoming Inc. Class A "
"GWRE",59.40,59.38,"59.13 - 59.70",200,200,373266,100,"2:49pm - <b>59.44</b>","Guidewire Software, Inc. Common"
"GWW",216.86,216.75,"214.54 - 217.43",100,100,356953,100,"2:49pm - <b>216.84</b>","W.W. Grainger, Inc. Common Stoc"
"GXP",27.92,27.91,"27.61 - 28.02",700,3000,1581113,100,"2:49pm - <b>27.92</b>","Great Plains Energy Incorporate"
"GYB",22.48,22.45,"22.45 - 22.53",500,1000,3331,1200,"2:27pm - <b>22.45</b>","CABCO Series 2004-101 Trust Gol"
"GYC",24.00,23.55,"23.69 - 23.84",400,100,1810,100,"12:15pm - <b>23.70</b>","Corporate Asset Backed Corp CAB"
"GZT",9.94,9.86,"9.81 - 10.13",100,100,26930,100,"2:46pm - <b>9.90</b>","Gazit-Globe Ltd. Ordinary Share"
"H",48.79,48.75,"47.94 - 49.49",100,100,298545,100,"2:49pm - <b>48.78</b>","Hyatt Hotels Corporation Class "
"HAE",37.21,37.17,"36.99 - 37.40",100,200,171728,100,"2:47pm - <b>37.20</b>","Haemonetics Corporation Common "
"HAL",41.55,41.54,"41.52 - 42.31",300,1400,4355035,100,"2:49pm - <b>41.55</b>","Halliburton Company Common Stoc"
"HAR",82.46,82.44,"81.87 - 82.97",100,100,182754,100,"2:49pm - <b>82.51</b>","Harman International Industries"
"HASI",23.29,23.25,"23.25 - 23.60",300,600,66374,100,"2:49pm - <b>23.25</b>","Hannon Armstrong Sustainable In"
"HBI",25.580,25.570,"25.360 - 25.750",800,2000,2041988,400,"2:49pm - <b>25.575</b>","Hanesbrands Inc. Common Stock"
"HBM",3.74,3.72,"3.70 - 3.79",3900,2000,117796,100,"2:48pm - <b>3.74</b>","Hudbay Minerals Inc Ordinary Sh"
"HBM",3.74,3.72,"3.70 - 3.79",3900,2000,117796,100,"2:48pm - <b>3.74</b>","Hudbay Minerals Inc Ordinary Sh"
"HCA",74.93,74.92,"74.48 - 75.98",200,300,2078734,100,"2:49pm - <b>74.94</b>","HCA Holdings, Inc. Common Stock"
"HCI",30.34,30.32,"30.27 - 30.97",200,100,20851,100,"2:45pm - <b>30.29</b>","HCI Group, Inc. Common Stock"
"HCJ",26.34,26.03,N/A,100,300,0,N/A,"3:37pm - <b>26.13</b>","HCI Group, Inc. 8% Senior Notes"
"HCLP",14.92,14.90,"14.52 - 14.98",200,300,217146,100,"2:49pm - <b>14.73</b>","Hi-Crush Partners LP Common Uni"
"HCN",76.96,76.95,"75.92 - 77.13",300,300,1262421,100,"2:50pm - <b>76.98</b>","Welltower Inc. Common Stock"
"HCN-I",N/A,N/A,N/A,N/A,N/A,N/A,N/A,N/A,N/A
"HCN-J",N/A,N/A,N/A,N/A,N/A,N/A,N/A,N/A,N/A
"HCP",39.540,39.530,"39.050 - 39.700",200,900,2007391,100,"2:49pm - <b>39.565</b>","HCP, Inc. Common Stock"
"HD",126.00,125.99,"125.56 - 127.23",400,200,3176853,100,"2:49pm - <b>125.93</b>","Home Depot, Inc. (The) Common S"
"HDB",72.78,72.77,"72.10 - 73.21",300,100,413689,100,"2:47pm - <b>72.77</b>","HDFC Bank Limited Common Stock"
"HE",31.27,31.26,"31.01 - 31.38",100,700,192466,100,"2:49pm - <b>31.27</b>","Hawaiian Electric Industries, I"
"HE-U",N/A,N/A,N/A,N/A,N/A,N/A,N/A,N/A,N/A
"HEI",69.18,69.10,"68.34 - 69.58",200,100,57339,200,"2:47pm - <b>69.18</b>","Heico Corporation Common Stock"
"HEI.A",N/A,N/A,N/A,N/A,N/A,N/A,N/A,N/A,N/A
"HEP",34.78,34.35,"34.20 - 34.95",200,100,54565,500,"2:50pm - <b>34.24</b>","Holly Energy Partners, L.P. Com"
"HEQ",16.04,15.99,"15.78 - 16.13",100,300,34981,289,"2:23pm - <b>16.08</b>","John Hancock Hedged Equity & In"
"HES",47.880,47.870,"47.010 - 48.220",800,100,2830547,100,"2:50pm - <b>47.875</b>","Hess Corporation Common Stock"
"HES-A",N/A,N/A,N/A,N/A,N/A,N/A,N/A,N/A,N/A
"HF",27.77,27.74,"27.68 - 28.36",100,200,99528,100,"2:47pm - <b>27.89</b>","HFF, Inc. Common Stock, Class A"
"HFC",24.150,24.140,"24.105 - 24.970",500,3400,2623409,100,"2:49pm - <b>24.135</b>","HollyFrontier Corporation Commo"
"HGG",1.84,1.81,"1.81 - 1.92",300,600,33549,100,"2:49pm - <b>1.81</b>","HHGregg, Inc. Common Stock (IN)"
"HGH",31.9000,31.7400,"31.7000 - 32.0200",300,100,22649,247,"2:40pm - <b>31.8383</b>","Hartford Financial Services Gro"
"HGT",2.41,2.40,"2.23 - 2.48",200,1400,100599,100,"2:43pm - <b>2.37</b>","Hugoton Royalty Trust Common St"
"HHC",114.69,114.46,"114.13 - 115.67",200,100,40044,100,"2:48pm - <b>114.45</b>","Howard Hughes Corporation (The)"
"HHS",1.68,1.67,"1.55 - 1.69",400,600,256930,100,"2:48pm - <b>1.65</b>","Harte-Hanks, Inc. Common Stock"
"HHY",7.290,7.270,"7.260 - 7.310",1200,100,21397,100,"2:49pm - <b>7.275</b>","Brookfield High Income Fund Inc"
"HI",31.28,31.26,"31.01 - 31.45",200,100,73755,100,"2:49pm - <b>31.27</b>","Hillenbrand Inc Common Stock"
"HIE",12.4800,12.4300,"12.3700 - 12.4900",400,100,50931,450,"2:49pm - <b>12.4543</b>","Miller/Howard High Income Equit"
"HIFR",18.69,18.66,"18.59 - 18.87",100,500,140338,100,"2:50pm - <b>18.68</b>","InfraREIT, Inc. Common Stock"
"HIG",42.40,42.39,"42.27 - 42.62",700,600,1032709,100,"2:50pm - <b>42.39</b>","Hartford Financial Services Gro"
"HIG",42.40,42.39,"42.27 - 42.62",700,600,1032709,100,"2:50pm - <b>42.39</b>","Hartford Financial Services Gro"
"HII",155.20,155.05,"152.98 - 155.54",200,200,150957,100,"2:49pm - <b>155.23</b>","Huntington Ingalls Industries, "
"HIL",4.43,4.41,"4.40 - 4.49",200,300,9904,100,"2:48pm - <b>4.41</b>","Hill International, Inc. Common"
"HIO",4.97,4.96,"4.95 - 5.00",2700,1000,388219,200,"2:49pm - <b>4.96</b>","Western Asset High Income Oppor"
"HIVE",6.06,6.05,"6.03 - 6.23",800,100,124882,100,"2:49pm - <b>6.05</b>","Aerohive Networks, Inc. Common "
"HIW",52.67,52.65,"52.14 - 52.72",400,200,321589,181,"2:50pm - <b>52.66</b>","Highwoods Properties, Inc. Comm"
"HIX",7.12,7.11,"7.10 - 7.19",600,1100,202355,100,"2:49pm - <b>7.10</b>","Western Asset High Income Fund "
"HJV",18.35,18.13,N/A,100,100,0,N/A,"2:28pm - <b>18.11</b>","MS Structured Asset Corp MS Str"
"HK",8.64,8.62,"8.22 - 8.88",200,200,581778,100,"2:50pm - <b>8.65</b>","Halcon Resources Corporation Co"
"HK",8.64,8.62,"8.22 - 8.88",200,200,581778,100,"2:50pm - <b>8.65</b>","Halcon Resources Corporation Co"
"HL",5.860,5.850,"5.830 - 6.080",21200,8800,5017163,100,"2:49pm - <b>5.855</b>","Hecla Mining Company Common Sto"
"HL-B",N/A,N/A,N/A,N/A,N/A,N/A,N/A,N/A,N/A
"HLF",61.19,61.16,"60.81 - 61.40",100,200,392992,100,"2:49pm - <b>61.16</b>","Herbalife Ltd. Common Stock"
"HLI",24.320,24.230,"24.070 - 24.670",200,200,16033,100,"2:36pm - <b>24.105</b>","Houlihan Lokey, Inc. Class A Co"
"HLS",40.57,40.55,"40.47 - 40.79",300,800,360423,100,"2:48pm - <b>40.57</b>","HealthSouth Corporation Common "
"HLS",40.57,40.55,"40.47 - 40.79",300,800,360423,100,"2:48pm - <b>40.57</b>","HealthSouth Corporation Common "
"HLT",22.930,22.920,"22.920 - 23.470",4400,6300,4923594,100,"2:50pm - <b>22.925</b>","Hilton Worldwide Holdings Inc. "
"HLX",7.37,7.36,"7.24 - 7.53",800,600,742025,100,"2:49pm - <b>7.36</b>","Helix Energy Solutions Group, I"
"HMC",29.00,28.99,"28.98 - 29.21",1100,300,371849,300,"2:49pm - <b>28.99</b>","Honda Motor Company, Ltd. Commo"
"HMLP",17.50,17.28,"17.25 - 17.38",200,100,3271,100,"10:32am - <b>17.33</b>","Hoegh LNG Partners LP Common Un"
"HMN",36.06,36.03,"36.00 - 36.67",200,300,76107,100,"2:49pm - <b>36.05</b>","Horace Mann Educators Corporati"
"HMY",3.440,3.430,"3.430 - 3.595",11400,10900,1653502,100,"2:49pm - <b>3.435</b>","Harmony Gold Mining Company Lim"
"HNI",40.04,40.00,"39.54 - 40.22",100,200,130195,100,"2:49pm - <b>39.99</b>","HNI Corporation Common Stock"
"HNP",24.940,24.910,"24.880 - 25.190",300,100,59588,100,"2:48pm - <b>24.895</b>","Huaneng Power Intl Common Stock"
"HNR",0.7840,0.7710,"0.7241 - 0.7856",100,200,77303,100,"2:48pm - <b>0.7775</b>","Harvest Natural Resources Inc"
"HOG",51.77,51.74,"51.68 - 52.38",300,300,673115,200,"2:49pm - <b>51.76</b>","Harley-Davidson, Inc. Common St"
"HOME",14.55,14.53,"14.49 - 14.70",100,300,87003,100,"2:47pm - <b>14.58</b>","At Home Group Inc. Common Stock"
"HON",116.30,116.28,"115.39 - 116.85",200,400,1456308,100,"2:49pm - <b>116.33</b>","Honeywell International Inc. Co"
"HOS",4.66,4.65,"4.53 - 4.82",1700,500,1090376,100,"2:49pm - <b>4.65</b>","Hornbeck Offshore Services Comm"
"HOV",1.71,1.70,"1.69 - 1.73",1300,10700,524848,100,"2:49pm - <b>1.71</b>","Hovnanian Enterprises, Inc. Cla"
"HP",57.47,57.45,"57.35 - 58.20",300,300,937857,100,"2:50pm - <b>57.52</b>","Helmerich & Payne, Inc. Common "
"HPE",22.77,22.76,"22.64 - 22.97",2200,4100,5538421,100,"2:49pm - <b>22.78</b>","Hewlett Packard Enterprise Comp"
"HPF",22.78,22.74,"22.72 - 22.86",200,300,35304,100,"2:48pm - <b>22.72</b>","John Hancock Pfd Income Fund II"
"HPI",22.440,22.410,"22.371 - 22.501",1000,200,53274,1000,"2:47pm - <b>22.403</b>","John Hancock Preferred Income F"
"HPP",33.50,33.48,"33.34 - 33.79",600,500,272590,100,"2:49pm - <b>33.49</b>","Hudson Pacific Properties, Inc."
"HPQ",15.01,15.00,"14.93 - 15.12",28400,13500,4410594,100,"2:50pm - <b>15.01</b>","HP Inc. Common Stock"
"HPS",19.44,19.41,"19.39 - 19.56",200,1300,56607,200,"2:44pm - <b>19.39</b>","John Hancock Preferred Income F"
"HQH",24.28,24.19,"24.19 - 24.65",300,200,96276,100,"2:47pm - <b>24.23</b>","Tekla Healthcare Investors Comm"
"HQL",19.04,19.01,"19.00 - 19.25",300,500,61043,500,"2:48pm - <b>19.02</b>","TeklaLife Sciences Investors Co"
"HR",35.27,35.26,"34.97 - 35.31",500,400,332494,100,"2:49pm - <b>35.26</b>","Healthcare Realty Trust Incorpo"
"HRB",22.78,22.77,"22.70 - 23.07",2500,400,930489,100,"2:49pm - <b>22.77</b>","H&R Block, Inc. Common Stock"
"HRC",60.59,60.57,"60.25 - 60.93",300,100,183687,100,"2:49pm - <b>60.57</b>","Hill-Rom Holdings Inc Common St"
"HRG",15.48,15.47,"15.33 - 15.52",700,500,177025,100,"2:48pm - <b>15.47</b>","HRG Group, Inc. Common Stock"
"HRI",32.860,32.840,"32.660 - 33.170",200,100,218794,100,"2:49pm - <b>32.835</b>","Herc Holdings Inc. Common Stock"
"HRL",37.380,37.370,"37.290 - 37.775",1500,400,964520,100,"2:49pm - <b>37.375</b>","Hormel Foods Corporation Common"
"HRS",90.45,90.42,"90.00 - 91.00",200,200,197182,100,"2:50pm - <b>90.45</b>","Harris Corporation Common Stock"
"HRTG",14.21,14.18,"14.08 - 14.38",200,200,88145,100,"2:45pm - <b>14.19</b>","Heritage Insurance Holdings, In"
"HSBC",36.88,36.87,"36.79 - 37.06",2000,2100,2016159,100,"2:49pm - <b>36.87</b>","HSBC Holdings, plc. Common Stoc"
"HSBC-A",N/A,N/A,N/A,N/A,N/A,N/A,N/A,N/A,N/A
"HSC",9.05,9.04,"8.88 - 9.20",1000,300,444903,100,"2:49pm - <b>9.05</b>","Harsco Corporation Common Stock"
"HSEA",27.7400,27.7200,"27.7000 - 27.7400",300,1500,98460,377,"2:45pm - <b>27.7102</b>","HSBC Holdings, plc. Perpetual S"
"HSEB",26.370,26.360,"26.360 - 26.470",200,700,151165,1000,"2:48pm - <b>26.365</b>","HSBC Holdings plc PERP SUB CAP "
"HST",16.08,16.07,"16.02 - 16.25",9700,5200,4977117,100,"2:49pm - <b>16.08</b>","Host Hotels & Resorts, Inc. Com"
