Symbol,Ask,Bid,Range,AskSize,BidSize,Volume,LastTradeSize,LastTradeWithTime,Name
"ESRT",21.54,21.53,"21.53 - 21.78",1000,700,401824,100,"3:25pm - <b>21.53</b>","Empire State Realty Trust, Inc."
"ESS",231.15,230.95,"230.01 - 232.54",200,100,231296,100,"3:24pm - <b>231.15</b>","Essex Property Trust, Inc. Comm"
"ESV",7.300,7.290,"7.080 - 7.480",6900,9700,14779717,200,"3:25pm - <b>7.295</b>","Ensco plc Class A Ordinary Shar"
"ETB",16.3500,16.3100,"16.2890 - 16.3800",300,200,30482,1000,"3:20pm - <b>16.3101</b>","Eaton Vance Tax-Managed Buy-Wri"
"ETE",16.8300,16.8200,"16.7800 - 17.4000",1900,1100,3525186,600,"3:24pm - <b>16.7957</b>","Energy Transfer Equity, L.P. En"
"ETG",15.02,15.00,"14.95 - 15.04",800,500,126296,100,"3:21pm - <b>15.00</b>","Eaton Vance Tax-Advantaged Glob"
"ETH",33.33,33.29,"33.28 - 33.87",200,100,53338,100,"3:24pm - <b>33.29</b>","Ethan Allen Interiors Inc. Comm"
"ETJ",9.49,9.48,"9.45 - 9.51",300,400,117569,1500,"3:24pm - <b>9.48</b>","Eaton Vance Risk-Managed Divers"
"ETM",12.95,12.91,"12.87 - 12.98",200,200,5030,100,"3:20pm - <b>12.94</b>","Entercom Communications Corpora"
"ETN",63.03,63.02,"62.78 - 63.44",400,200,785067,100,"3:24pm - <b>63.00</b>","Eaton Corporation, PLC Ordinary"
"ETO",21.71,21.69,"21.68 - 21.75",200,100,20145,100,"3:16pm - <b>21.68</b>","Eaton Vance Tax-Advantage Globa"
"ETP",37.34,37.32,"37.32 - 38.31",600,800,1636620,466,"3:25pm - <b>37.33</b>","Energy Transfer Partners, L.P. "
"ETR",81.020,81.000,"80.920 - 81.560",500,300,680961,100,"3:25pm - <b>81.005</b>","Entergy Corporation Common Stoc"
"ETV",14.89,14.86,"14.86 - 14.94",300,200,96782,100,"3:23pm - <b>14.86</b>","Eaton Vance Corporation Eaton V"
"ETW",10.88,10.86,"10.86 - 10.94",9800,12600,263298,100,"3:24pm - <b>10.90</b>","Eaton Vance Corporation Eaton V"
"ETX",21.210,21.190,"21.160 - 21.250",100,100,12777,136,"3:09pm - <b>21.219</b>","Eaton Vance Municipal Income 20"
"ETY",10.59,10.58,"10.55 - 10.73",3600,3200,387812,1000,"3:24pm - <b>10.58</b>","Eaton Vance Tax-Managed Diversi"
"EURN",7.870,7.860,"7.850 - 8.270",1100,600,1041921,100,"3:25pm - <b>7.865</b>","Euronav NV Ordinary Shares"
"EV",39.00,38.99,"38.81 - 39.36",500,500,500111,200,"3:24pm - <b>38.99</b>","Eaton Vance Corporation Common "
"EVA",26.83,26.80,"26.13 - 27.13",400,1400,174055,200,"3:24pm - <b>26.80</b>","Enviva Partners, LP Common unit"
"EVC",7.280,7.270,"7.210 - 7.320",700,700,118777,100,"3:24pm - <b>7.275</b>","Entravision Communications Corp"
"EVDY",7.75,7.73,"7.69 - 7.82",200,200,47156,100,"3:21pm - <b>7.74</b>","Everyday Health, Inc. Common St"
"EVER",19.240,19.230,"19.230 - 19.300",5800,39700,1106077,100,"3:25pm - <b>19.235</b>","EverBank Financial Corp. Common"
"EVER-A",N/A,N/A,N/A,N/A,N/A,N/A,N/A,N/A,N/A
"EVF",6.33,6.32,"6.33 - 6.37",800,2500,68529,300,"3:18pm - <b>6.33</b>","Eaton Vance Senior Income Trust"
"EVG",13.60,13.58,"13.57 - 13.67",400,100,37353,100,"3:22pm - <b>13.58</b>","Eaton Vance Short Diversified I"
"EVGN",6.46,6.31,"6.40 - 6.40",200,100,300,100,"9:31am - <b>6.40</b>","Evogene Ltd Ordinary shares (Is"
"EVH",22.71,22.69,"22.31 - 22.79",300,200,221749,600,"3:23pm - <b>22.71</b>","Evolent Health, Inc Class A Com"
"EVHC",21.39,21.38,"20.91 - 21.90",3100,400,2181462,100,"3:24pm - <b>21.38</b>","Envision Healthcare Holdings, I"
"EVN",14.280,14.260,"14.231 - 14.310",300,1300,45552,267,"3:24pm - <b>14.231</b>","Eaton Vance Municipal Income Tr"
"EVR",50.34,50.31,"50.28 - 51.59",100,100,168252,100,"3:24pm - <b>50.34</b>","Evercore Partners Inc Class A C"
"EVRI",2.43,2.41,"2.38 - 2.44",1100,1900,100800,100,"3:25pm - <b>2.41</b>","Everi Holdings Inc. Common Stoc"
"EVT",20.230,20.200,"20.060 - 20.270",200,200,78889,100,"3:24pm - <b>20.265</b>","Eaton Vance Tax Advantaged Divi"
"EVTC",16.76,16.75,"16.60 - 16.87",100,400,133140,100,"3:24pm - <b>16.74</b>","Evertec, Inc. Common Stock"
"EW",119.00,118.94,"118.62 - 119.62",100,100,589516,100,"3:25pm - <b>119.00</b>","Edwards Lifesciences Corporatio"
"EXAR",8.97,8.95,"8.90 - 9.09",400,700,255870,100,"3:24pm - <b>8.96</b>","Exar Corporation Common Stock"
"EXC",34.850,34.840,"34.610 - 34.960",2200,900,2424372,100,"3:25pm - <b>34.845</b>","Exelon Corporation Common Stock"
"EXCU",48.4000,48.1700,"48.0800 - 48.3410",100,100,7569,600,"3:00pm - <b>48.3272</b>","Exelon Corp. Conv Unit"
"EXD",11.93,11.85,"11.84 - 12.17",300,300,85960,120,"3:23pm - <b>11.90</b>","Eaton Vance Tax-Advantaged Bond"
"EXG",8.67,8.66,"8.66 - 8.73",3000,10300,661489,100,"3:24pm - <b>8.67</b>","Eaton Vance Tax-Managed Global "
"EXK",5.03,5.02,"5.02 - 5.38",6200,5800,2299889,200,"3:24pm - <b>5.04</b>","Endeavour Silver Corporation Or"
"EXP",77.25,77.21,"76.24 - 77.77",200,100,326090,449,"3:25pm - <b>77.20</b>","Eagle Materials Inc Common Stoc"
"EXPR",11.77,11.76,"11.69 - 12.06",1800,4300,1690362,100,"3:25pm - <b>11.78</b>","Express, Inc. Common Stock"
"EXR",81.51,81.49,"79.75 - 81.65",300,200,628900,100,"3:25pm - <b>81.55</b>","Extra Space Storage Inc Common "
"EXTN",14.37,14.33,"14.31 - 14.53",300,200,41987,100,"3:24pm - <b>14.31</b>","Exterran Corporation Common Sto"
"EZT",27.98,27.72,"27.71 - 27.89",100,100,3653,100,"2:38pm - <b>27.71</b>","Entergy Texas Inc First Mortgag"
"F",12.03,12.02,"12.00 - 12.12",175700,84200,20232279,100,"3:25pm - <b>12.03</b>","Ford Motor Company Common Stock"
"FAC",1.0400,1.0000,"0.9700 - 1.0300",100,2700,9124,111,"3:05pm - <b>0.9772</b>","First Acceptance Corporation"
"FAF",40.04,40.03,"39.96 - 40.48",500,200,380098,100,"3:25pm - <b>39.99</b>","First American Corporation (New"
"FAM",11.77,11.73,"11.70 - 11.75",400,400,16038,100,"3:07pm - <b>11.75</b>","First Trust/Aberdeen Global Opp"
"FAV",9.02,9.01,"9.01 - 9.02",500,200,9905,100,"3:20pm - <b>9.02</b>","First Trust Dividend and Income"
"FBC",27.290,27.240,"27.260 - 27.580",300,100,80284,100,"3:24pm - <b>27.275</b>","Flagstar Bancorp, Inc. Common S"
"FBHS",58.760,58.750,"58.130 - 59.040",200,400,882135,100,"3:24pm - <b>58.775</b>","Fortune Brands Home & Security,"
"FBK",20.55,20.50,"20.44 - 20.90",100,2200,49557,100,"3:24pm - <b>20.54</b>","FB Financial Corporation Common"
"FBP",4.89,4.88,"4.83 - 4.96",700,1000,268014,100,"3:23pm - <b>4.88</b>","First BanCorp. New Common Stock"
"FBR",6.72,6.71,"6.68 - 6.80",5200,11700,745560,100,"3:24pm - <b>6.72</b>","Fibria Celulose S.A."
"FC",16.50,16.49,"16.38 - 16.62",500,100,25447,100,"3:19pm - <b>16.62</b>","Franklin Covey Company Common S"
"FCAM",62.40,62.33,"62.20 - 62.87",100,1000,19770,100,"2:57pm - <b>62.35</b>","Fiat Chrysler Automobiles N.V. "
"FCAU",6.210,6.200,"6.190 - 6.290",33600,17500,3816419,800,"3:24pm - <b>6.205</b>","Fiat Chrysler Automobiles N.V. "
"FCB",38.190,38.160,"38.120 - 39.340",200,400,651307,100,"3:24pm - <b>38.125</b>","FCB Financial Holdings, Inc. Cl"
"FCE.A",N/A,N/A,N/A,N/A,N/A,N/A,N/A,N/A,N/A
"FCE.B",N/A,N/A,N/A,N/A,N/A,N/A,N/A,N/A,N/A
"FCF",9.97,9.96,"9.96 - 10.17",900,1200,115428,100,"3:24pm - <b>9.97</b>","First Commonwealth Financial Co"
"FCFS",46.35,46.31,"46.15 - 47.20",200,300,125320,100,"3:24pm - <b>46.30</b>","First Cash, Inc. Common Stock"
"FCH",6.550,6.540,"6.530 - 6.850",1700,4100,592035,100,"3:24pm - <b>6.545</b>","FelCor Lodging Trust Incorporat"
"FCH-A",N/A,N/A,N/A,N/A,N/A,N/A,N/A,N/A,N/A
"FCN",43.80,43.76,"43.48 - 43.96",300,100,44240,300,"3:24pm - <b>43.71</b>","FTI Consulting, Inc. Common Sto"
"FCPT",21.53,21.52,"21.36 - 21.69",100,300,446130,217,"3:25pm - <b>21.52</b>","Four Corners Property Trust, In"
"FCT",13.5600,13.5500,"13.5400 - 13.5900",600,200,56755,700,"3:24pm - <b>13.5585</b>","First Trust Senior Floating Rat"
"FCX",10.51,10.50,"10.47 - 10.86",15600,25000,20122455,500,"3:25pm - <b>10.50</b>","Freeport-McMoRan, Inc. Common S"
"FDC",13.04,13.03,"12.96 - 13.11",1300,1100,2826743,100,"3:24pm - <b>13.04</b>","First Data Corporation Class A "
"FDEU",15.8500,15.7800,"15.7220 - 16.0000",100,100,115019,700,"3:19pm - <b>15.8605</b>","First Trust Dynamic Europe Equi"
"FDP",59.66,59.61,"59.17 - 59.81",300,200,101366,200,"3:25pm - <b>59.62</b>","Fresh Del Monte Produce, Inc. C"
"FDS",176.37,176.25,"174.98 - 178.06",300,200,330952,100,"3:25pm - <b>176.01</b>","FactSet Research Systems Inc. C"
"FDX",175.40,175.37,"173.11 - 176.16",200,100,1856852,100,"3:25pm - <b>175.36</b>","FedEx Corporation Common Stock"
"FE",34.65,34.64,"34.34 - 34.82",800,2000,2269330,100,"3:25pm - <b>34.65</b>","FirstEnergy Corporation Common "
"FEI",16.23,16.20,"16.13 - 16.27",600,1500,65595,100,"3:23pm - <b>16.21</b>","First Trust MLP and Energy Inco"
"FELP",3.91,3.90,"3.80 - 4.09",200,700,181974,100,"3:24pm - <b>3.91</b>","Foresight Energy LP Common Unit"
"FENG",3.83,3.82,"3.64 - 3.89",100,400,302519,100,"3:19pm - <b>3.84</b>","Phoenix New Media Limited Ameri"
"FEO",14.9900,14.9800,"14.9200 - 15.0200",300,100,30549,950,"2:40pm - <b>14.9969</b>","First Trust/Aberdeen Emerging O"
"FET",18.40,18.37,"18.20 - 18.60",400,200,215007,1000,"3:24pm - <b>18.37</b>","Forum Energy Technologies, Inc."
"FF",10.99,10.97,"10.94 - 11.33",200,200,59410,100,"3:19pm - <b>10.98</b>","FutureFuel Corp.  Common shares"
"FFA",13.340,13.320,"13.290 - 13.480",500,800,38118,620,"3:03pm - <b>13.326</b>","First Trust Enhanced Equity Inc"
"FFC",20.8700,20.8500,"20.8100 - 21.0900",200,200,37884,1497,"3:14pm - <b>20.8685</b>","Flaherty & Crumrine Preferred S"
"FFG",63.49,63.24,"63.35 - 64.29",200,200,17162,100,"3:20pm - <b>63.35</b>","FBL Financial Group, Inc. Commo"
"FGB",6.9700,6.8900,"6.9000 - 6.9900",800,700,37759,430,"3:01pm - <b>6.9664</b>","First Trust Specialty Finance a"
"FGL",23.11,23.08,"22.98 - 23.28",200,200,40949,100,"3:18pm - <b>23.11</b>","Fidelity & Guaranty Life Common"
"FGP",16.87,16.84,"16.80 - 17.01",200,1900,206517,500,"3:25pm - <b>16.86</b>","Ferrellgas Partners, L.P. Commo"
"FHN",14.880,14.870,"14.860 - 15.140",4200,12000,1322089,100,"3:24pm - <b>14.875</b>","First Horizon National Corporat"
"FHN-A",N/A,N/A,N/A,N/A,N/A,N/A,N/A,N/A,N/A
"FHY",12.16,12.15,"12.05 - 12.17",200,300,18575,150,"3:23pm - <b>12.17</b>","First Trust Strategic High Inco"
"FI",12.26,12.25,"12.23 - 12.63",500,300,523369,440,"3:25pm - <b>12.25</b>","Frank's International N.V. Comm"
"FICO",128.77,128.62,"127.40 - 128.88",200,100,97074,100,"3:22pm - <b>128.54</b>","Fair Isaac Corproation Common S"
"FIF",18.4800,18.4100,"18.3000 - 18.6300",100,400,33505,200,"3:11pm - <b>18.4555</b>","First Trust Energy Infrastructu"
"FIG",4.91,4.90,"4.89 - 5.04",1900,1600,478469,100,"3:24pm - <b>4.90</b>","Fortress Investment Group LLC C"
"FII",29.52,29.51,"29.19 - 31.11",300,800,1547841,100,"3:25pm - <b>29.56</b>","Federated Investors, Inc. Commo"
"FIS",76.97,76.96,"76.75 - 77.27",400,200,632792,200,"3:25pm - <b>76.96</b>","Fidelity National Information S"
"FIT",16.46,16.45,"16.32 - 16.97",800,1900,5750702,100,"3:25pm - <b>16.46</b>","Fitbit, Inc. Class A Common Sto"
"FIX",29.31,29.27,"29.04 - 29.51",100,200,133263,100,"3:24pm - <b>29.26</b>","Comfort Systems USA, Inc. Commo"
"FL",67.620,67.610,"67.050 - 67.970",700,300,1929797,100,"3:25pm - <b>67.615</b>","Foot Locker, Inc."
"FLC",21.20,21.14,"21.14 - 21.48",100,600,41629,100,"3:23pm - <b>21.14</b>","Flaherty & Crumrine Total Retur"
"FLO",15.34,15.33,"15.29 - 15.65",1700,2600,1175968,100,"3:24pm - <b>15.34</b>","Flowers Foods, Inc. Common Stoc"
"FLOW",29.28,29.24,"29.18 - 30.00",200,300,234159,100,"3:23pm - <b>29.18</b>","SPX FLOW, Inc. Common Stock"
"FLR",49.20,49.19,"48.88 - 49.53",300,300,306201,200,"3:25pm - <b>49.21</b>","Fluor Corporation Common Stock"
"FLS",45.560,45.550,"45.410 - 46.170",300,300,779188,100,"3:25pm - <b>45.545</b>","Flowserve Corporation Common St"
"FLT",170.65,170.63,"168.80 - 171.18",100,100,312468,100,"3:25pm - <b>170.68</b>","FleetCor Technologies, Inc. Com"
"FLTX",59.98,59.97,"59.97 - 60.04",1500,2600,301927,100,"3:24pm - <b>59.98</b>","Fleetmatics Group PLC Ordinary "
"FLY",11.57,11.54,"11.49 - 11.66",400,400,64310,100,"3:23pm - <b>11.54</b>","Fly Leasing Limited"
"FMC",48.16,48.15,"48.12 - 48.77",300,200,356625,100,"3:24pm - <b>48.17</b>","FMC Corporation Common Stock"
"FMN",16.24,16.23,"16.23 - 16.32",200,100,4004,300,"2:53pm - <b>16.30</b>","Federated Premier Municipal Inc"
"FMO",15.4900,15.4500,"15.4396 - 15.8920",200,100,60850,550,"3:22pm - <b>15.4396</b>","Fiduciary/Claymore MLP Opportun"
"FMS",44.17,44.16,"44.11 - 44.47",300,200,116487,100,"3:19pm - <b>44.19</b>","Fresenius Medical Care AG Commo"
"FMSA",7.110,7.100,"7.090 - 7.430",1000,300,1015511,100,"3:24pm - <b>7.105</b>","Fairmount Santrol Holdings Inc."
"FMX",90.27,90.17,"89.93 - 92.40",200,200,1900527,100,"3:25pm - <b>90.39</b>","Fomento Economico Mexicano S.A."
"FMY",14.47,14.41,"14.39 - 14.52",200,100,7829,100,"2:42pm - <b>14.39</b>","First Trust Motgage Income Fund"
"FN",43.91,43.87,"43.31 - 44.39",300,200,166892,105,"3:24pm - <b>43.80</b>","Fabrinet Ordinary Shares"
"FNB",12.17,12.16,"12.06 - 12.22",9300,2700,2213019,100,"3:24pm - <b>12.16</b>","F.N.B. Corporation Common Stock"
"FNB-E",N/A,N/A,N/A,N/A,N/A,N/A,N/A,N/A,N/A
"FNF",36.95,36.94,"36.62 - 37.00",300,300,866335,100,"3:25pm - <b>36.88</b>","FNF Group of Fidelity National "
"FNFV",12.600,12.590,"12.515 - 12.780",300,200,102375,100,"3:24pm - <b>12.595</b>","FNFV Group of Fidelity National"
"FNV",71.57,71.53,"71.32 - 72.51",200,200,249045,100,"3:24pm - <b>71.55</b>","Franco-Nevada Corporation"
"FOE",12.79,12.78,"12.61 - 13.00",200,400,201149,100,"3:24pm - <b>12.76</b>","Ferro Corporation Common Stock"
"FOF",11.9700,11.9500,"11.9300 - 12.0800",2600,700,84834,1000,"3:20pm - <b>11.9403</b>","Cohen & Steers Closed-End Oppor"
"FOR",11.72,11.71,"11.69 - 11.77",300,100,79763,100,"3:19pm - <b>11.71</b>","Forestar Group Inc Common Stock"
"FPF",23.19,23.16,"23.15 - 23.26",400,200,128023,100,"3:22pm - <b>23.22</b>","First Trust Intermediate Durati"
"FPI",11.38,11.36,"11.15 - 11.39",100,200,116319,100,"3:24pm - <b>11.36</b>","Farmland Partners Inc. Common S"
"FPL",13.45,13.42,"13.25 - 13.61",600,300,44504,100,"3:24pm - <b>13.42</b>","First Trust New Opportunities M"
"FPO",9.39,9.38,"9.25 - 9.47",100,200,158581,100,"3:24pm - <b>9.39</b>","First Potomac Realty Trust Comm"
"FPT",14.09,14.06,"14.05 - 14.10",200,100,3044,100,"3:16pm - <b>14.10</b>","Federated Premier Intermediate "
"FR",28.7500,28.7400,"28.5400 - 28.8500",1000,200,299228,100,"3:25pm - <b>28.7597</b>","First Industrial Realty Trust, "
"FRA",13.6100,13.6000,"13.5900 - 13.6900",700,200,131970,1500,"3:17pm - <b>13.6001</b>","Blackrock Floating Rate Income "
"FRC",77.12,77.10,"76.62 - 77.48",200,100,569823,123,"3:24pm - <b>77.07</b>","FIRST REPUBLIC BANK Common Stoc"
"FRC-A",N/A,N/A,N/A,N/A,N/A,N/A,N/A,N/A,N/A
"FRC-B",N/A,N/A,N/A,N/A,N/A,N/A,N/A,N/A,N/A
"FRC-C",N/A,N/A,N/A,N/A,N/A,N/A,N/A,N/A,N/A
"FRC-D",N/A,N/A,N/A,N/A,N/A,N/A,N/A,N/A,N/A
"FRC-E",N/A,N/A,N/A,N/A,N/A,N/A,N/A,N/A,N/A
"FRC-F",N/A,N/A,N/A,N/A,N/A,N/A,N/A,N/A,N/A
"FRC-G",N/A,N/A,N/A,N/A,N/A,N/A,N/A,N/A,N/A
"FRO",7.09,7.08,"7.07 - 7.29",2300,900,841585,100,"3:24pm - <b>7.07</b>","Frontline Ltd. Ordinary Shares"
"FRT",159.62,159.53,"158.35 - 160.15",200,200,186140,100,"3:24pm - <b>159.59</b>","Federal Realty Investment Trust"
"FSB",36.92,36.78,"36.49 - 37.05",100,300,16250,100,"2:57pm - <b>36.87</b>","Franklin Financial Network, Inc"
"FSCE",25.9200,25.4800,"25.5000 - 25.6169",900,200,1100,200,"12:26pm - <b>25.6169</b>","Fifth Street Finance Corp. 5.87"
"FSD",15.4200,15.4000,"15.3900 - 15.4599",400,1400,88687,183,"3:22pm - <b>15.4059</b>","First Trust High Income Long Sh"
"FSIC",9.4600,9.4500,"9.4300 - 9.4900",1800,1200,410822,595,"3:25pm - <b>9.4566</b>","FS Investment Corporation Commo"
"FSM",7.250,7.240,"7.220 - 7.590",1200,3000,635191,100,"3:25pm - <b>7.245</b>","Fortuna Silver Mines Inc Ordina"
"FSS",13.20,13.19,"13.00 - 13.23",600,300,165097,100,"3:24pm - <b>13.19</b>","Federal Signal Corporation Comm"
"FT",6.86,6.83,"6.83 - 6.88",1500,2000,18173,100,"3:21pm - <b>6.83</b>","Franklin Universal Trust Common"
"FTAI",12.00,11.99,"11.80 - 12.00",7700,600,57884,100,"3:24pm - <b>11.99</b>","Fortress Transportation and Inf"
"FTI",27.53,27.52,"27.51 - 28.06",2000,900,2300913,494,"3:25pm - <b>27.52</b>","FMC Technologies, Inc. Common S"
"FTK",13.07,13.06,"12.95 - 13.39",300,300,381841,100,"3:24pm - <b>13.07</b>","Flotek Industries, Inc. Common "
"FTV",51.270,51.260,"50.300 - 51.490",200,300,737758,100,"3:24pm - <b>51.255</b>","Fortive Corporation Common Stoc"
"FUL",45.46,45.45,"43.62 - 45.49",200,200,387818,100,"3:25pm - <b>45.48</b>","H. B. Fuller Company Common Sto"
"FUN",59.60,59.54,"59.42 - 60.65",200,100,117636,100,"3:23pm - <b>59.59</b>","Cedar Fair, L.P. Common Stock"
"FXCM",8.93,8.80,"8.58 - 8.97",100,1000,5445,300,"3:20pm - <b>8.80</b>","FXCM Inc. Class A Common Stock"
"G",23.340,23.330,"23.250 - 23.400",1200,1200,1055726,100,"3:25pm - <b>23.338</b>","Genpact Limited Common Stock"
"GAB",5.54,5.53,"5.50 - 5.59",2300,6700,1091874,100,"3:24pm - <b>5.53</b>","Gabelli Equity Trust, Inc. (The"
"GAB-D",N/A,N/A,N/A,N/A,N/A,N/A,N/A,N/A,N/A
"GAB-G",N/A,N/A,N/A,N/A,N/A,N/A,N/A,N/A,N/A
"GAB-H",N/A,N/A,N/A,N/A,N/A,N/A,N/A,N/A,N/A
"GAB-J",N/A,N/A,N/A,N/A,N/A,N/A,N/A,N/A,N/A
"GAM",32.5000,32.4500,"32.4301 - 32.5700",200,200,18000,300,"3:23pm - <b>32.4817</b>","General American Investors, Inc"
"GAM-B",N/A,N/A,N/A,N/A,N/A,N/A,N/A,N/A,N/A
"GATX",42.31,42.27,"42.18 - 42.67",200,200,145548,100,"3:23pm - <b>42.23</b>","GATX Corporation Common Stock"
"GBAB",23.3600,23.2500,"23.2401 - 23.4800",200,200,53209,900,"3:14pm - <b>23.2896</b>","Guggenheim Taxable Municipal Ma"
"GBL",29.08,29.06,"28.99 - 29.35",100,400,21310,100,"3:19pm - <b>29.06</b>","Gamco Investors, Inc. Common St"
"GBX",34.4200,34.3900,"34.2900 - 34.8700",100,100,138401,900,"3:24pm - <b>34.3727</b>","Greenbrier Companies, Inc. (The"
"GCAP",6.21,6.19,"6.18 - 6.27",400,600,44558,100,"3:20pm - <b>6.20</b>","GAIN Capital Holdings, Inc. Com"
"GCH",9.34,9.00,"9.06 - 9.08",100,1500,2127,162,"12:45pm - <b>9.07</b>","Aberdeen Greater China Fund, In"
"GCI",11.58,11.57,"11.55 - 11.65",1500,1100,397689,100,"3:25pm - <b>11.57</b>","Gannett Co., Inc. Common Stock"
"GCO",53.1400,53.1300,"52.4800 - 53.4200",100,300,210785,200,"3:25pm - <b>53.1125</b>","Genesco Inc. Common Stock"
"GCP",27.65,27.63,"27.33 - 28.05",200,200,211547,100,"3:25pm - <b>27.65</b>","GCP Applied Technologies Inc. C"
"GCV",4.7700,4.7500,"4.7310 - 4.9000",1000,300,77993,1705,"2:42pm - <b>4.8001</b>","Gabelli Convertible and Income "
"GCV-B",N/A,N/A,N/A,N/A,N/A,N/A,N/A,N/A,N/A
"GD",154.26,154.23,"153.07 - 154.88",100,1900,806183,200,"3:24pm - <b>154.31</b>","General Dynamics Corporation Co"
"GDDY",33.68,33.65,"33.43 - 34.23",400,200,482895,100,"3:24pm - <b>33.68</b>","GoDaddy Inc. Class A Common Sto"
"GDL",9.8900,9.8800,"9.8700 - 9.9300",300,300,64983,368,"3:05pm - <b>9.8899</b>","GDL Fund, The Common Shares of "
"GDL-B",N/A,N/A,N/A,N/A,N/A,N/A,N/A,N/A,N/A
"GDO",17.7400,17.7000,"17.6700 - 17.7800",800,1100,11884,138,"3:04pm - <b>17.7001</b>","Western Asset Global Corporate "
"GDOT",22.8500,22.8300,"22.7900 - 23.0280",500,300,96587,400,"3:23pm - <b>22.8099</b>","Green Dot Corporation Class A C"
"GDV",19.10,19.08,"18.95 - 19.10",300,2900,214584,800,"3:22pm - <b>19.08</b>","Gabelli Dividend & Income Trust"
"GDV-A",N/A,N/A,N/A,N/A,N/A,N/A,N/A,N/A,N/A
"GDV-D",N/A,N/A,N/A,N/A,N/A,N/A,N/A,N/A,N/A
"GDV-G",N/A,N/A,N/A,N/A,N/A,N/A,N/A,N/A,N/A
"GE",29.59,29.58,"29.56 - 29.81",20100,17800,16491734,100,"3:25pm - <b>29.59</b>","General Electric Company Common"
"GEB",26.210,26.190,"26.160 - 26.280",200,100,14974,135,"2:59pm - <b>26.188</b>","General Electric Company 4.875%"
"GEF",49.02,48.98,"48.24 - 49.25",200,300,228170,100,"3:25pm - <b>49.04</b>","Greif Inc. Class A Common Stock"
"GEF.B",N/A,N/A,N/A,N/A,N/A,N/A,N/A,N/A,N/A
"GEH",26.6300,26.5800,"26.5700 - 26.7300",200,100,18547,158,"3:24pm - <b>26.6185</b>","General Electric Capital Corpor"
"GEK",26.23,26.15,"26.08 - 26.29",300,100,42916,185,"3:14pm - <b>26.15</b>","General Electric Capital Corpor"
"GEL",35.46,35.43,"35.40 - 35.95",200,200,203816,100,"3:23pm - <b>35.43</b>","Genesis Energy, L.P. Common Uni"
"GEN",2.74,2.72,"2.66 - 2.76",200,200,108604,200,"3:25pm - <b>2.73</b>","Genesis Healthcare, Inc. Common"
"GEO",24.64,24.63,"24.61 - 25.28",400,300,772018,500,"3:25pm - <b>24.64</b>","Geo Group Inc (The) REIT"
"GEQ",16.50,16.45,"16.40 - 16.56",600,600,37380,200,"3:23pm - <b>16.45</b>","Guggenheim Equal Weight Enhance"
"GER",7.0500,7.0300,"7.0301 - 7.2000",1400,2600,169051,500,"3:23pm - <b>7.0301</b>","Goldman Sachs MLP Energy Renais"
"GES",14.3200,14.3100,"14.2250 - 14.8800",2000,800,879960,300,"3:24pm - <b>14.3164</b>","Guess?, Inc. Common Stock"
"GF",14.06,14.04,"13.77 - 14.19",300,600,30987,100,"3:22pm - <b>14.06</b>","New Germany Fund, Inc. (The) Co"
"GFA",1.59,1.58,"1.51 - 1.62",2500,1200,177013,650,"3:20pm - <b>1.59</b>","Gafisa SA Gafisa S.A. American "
"GFF",16.77,16.74,"16.65 - 16.94",600,700,86406,100,"3:23pm - <b>16.73</b>","Griffon Corporation Common Stoc"
"GFI",4.940,4.930,"4.921 - 5.130",10000,20100,3115547,100,"3:25pm - <b>4.935</b>","Gold Fields Limited American De"
