Symbol,Ask,Bid,Range,AskSize,BidSize,Volume,LastTradeSize,LastTradeWithTime,Name
"NGVT",47.35,47.29,"47.24 - 48.30",400,500,161714,100,"3:37pm - <b>47.29</b>","Ingevity Corporation Common Sto"
"NHA",10.1400,10.1300,"10.1300 - 10.1700",3600,300,11850,250,"3:02pm - <b>10.1428</b>","Nuveen Municipal 2021 Target Te"
"NHF",22.08,22.04,"22.00 - 22.25",500,300,75895,100,"3:32pm - <b>22.04</b>","NexPoint Credit Strategies Fund"
"NHI",80.58,80.52,"80.50 - 81.11",200,300,144221,100,"3:36pm - <b>80.56</b>","National Health Investors, Inc."
"NI",25.10,25.09,"25.01 - 25.26",6900,700,1687097,100,"3:37pm - <b>25.09</b>","NiSource Inc Common Stock"
"NID",13.97,13.95,"13.87 - 13.97",1500,500,88973,100,"3:37pm - <b>13.97</b>","Nuveen Intermediate Duration Mu"
"NIE",18.69,18.66,"18.64 - 18.85",700,200,90351,300,"3:33pm - <b>18.64</b>","AllianzGI Equity & Convertible "
"NIM",10.6700,10.6600,"10.6600 - 10.7000",9000,100,10060,100,"12:50pm - <b>10.6605</b>","Nuveen Select Maturities Munici"
"NIQ",13.6600,13.6400,"13.6400 - 13.6700",200,300,12242,100,"2:06pm - <b>13.6401</b>","Nuveenn Intermediate Duration Q"
"NJR",34.58,34.57,"34.50 - 34.83",500,400,238383,100,"3:37pm - <b>34.57</b>","NewJersey Resources Corporation"
"NKE",54.44,54.43,"54.08 - 55.00",3100,1400,8892362,100,"3:37pm - <b>54.43</b>","Nike, Inc. Common Stock"
"NKG",14.01,14.00,"14.00 - 14.12",200,200,27345,100,"3:33pm - <b>14.00</b>","Nuveen Georgia Dividend Advanta"
"NKX",16.92,16.87,"16.86 - 16.92",100,200,24019,400,"2:44pm - <b>16.87</b>","Nuveen California AMT-Free Muni"
"NL",4.00,3.97,"3.87 - 4.03",200,1700,20984,100,"3:26pm - <b>3.98</b>","NL Industries, Inc. Common Stoc"
"NLS",23.180,23.170,"23.025 - 23.950",400,500,415328,100,"3:37pm - <b>23.165</b>","Nautilus, Inc. Common Stock"
"NLSN",53.1600,53.1500,"52.8450 - 53.2500",1200,400,1270425,200,"3:37pm - <b>53.1575</b>","Nielsen N.V. Ordinary Shares"
"NLY",10.890,10.880,"10.785 - 10.920",38500,25500,6802781,1000,"3:37pm - <b>10.885</b>","Annaly Capital Management Inc C"
"NLY-A",N/A,N/A,N/A,N/A,N/A,N/A,N/A,N/A,N/A
"NLY-C",N/A,N/A,N/A,N/A,N/A,N/A,N/A,N/A,N/A
"NLY-D",N/A,N/A,N/A,N/A,N/A,N/A,N/A,N/A,N/A
"NLY-E",N/A,N/A,N/A,N/A,N/A,N/A,N/A,N/A,N/A
"NM",1.21,1.20,"1.20 - 1.25",6400,1800,335964,100,"3:36pm - <b>1.20</b>","Navios Maritime Holdings Inc. C"
"NM-G",N/A,N/A,N/A,N/A,N/A,N/A,N/A,N/A,N/A
"NM-H",N/A,N/A,N/A,N/A,N/A,N/A,N/A,N/A,N/A
"NMBL",7.750,7.740,"7.670 - 7.870",3800,2900,430233,100,"3:36pm - <b>7.745</b>","Nimble Storage, Inc. Common Sto"
"NMFC",13.83,13.81,"13.74 - 13.87",600,800,159241,100,"3:36pm - <b>13.82</b>","New Mountain Finance Corporatio"
"NMI",12.5600,12.5400,"12.5200 - 12.5600",300,100,3767,297,"2:44pm - <b>12.5539</b>","Nuveen Municipal Income Fund, I"
"NMK-B",N/A,N/A,N/A,N/A,N/A,N/A,N/A,N/A,N/A
"NMK-C",N/A,N/A,N/A,N/A,N/A,N/A,N/A,N/A,N/A
"NMM",1.41,1.40,"1.40 - 1.47",1600,23200,134951,100,"3:35pm - <b>1.41</b>","Navios Maritime Partners LP Com"
"NMR",4.51,4.50,"4.47 - 4.52",500,400,154081,200,"3:37pm - <b>4.52</b>","Nomura Holdings Inc ADR America"
"NMS",16.80,16.66,"16.66 - 16.89",1200,500,8875,100,"3:11pm - <b>16.75</b>","Nuveen Minnesota Municipal Inco"
"NMT",15.22,15.20,"15.15 - 15.22",800,100,9036,100,"2:41pm - <b>15.19</b>","Nuveen Massachusetts Premium In"
"NMY",14.0200,13.9800,"13.9700 - 14.0700",100,200,17742,700,"2:45pm - <b>13.9814</b>","Nuveen Maryland Premium Income "
"NMZ",14.5900,14.5800,"14.5248 - 14.6200",700,500,125857,1000,"3:33pm - <b>14.5801</b>","Nuveen Municipal High Income Op"
"NNA",1.31,1.30,"1.30 - 1.38",7500,25300,420942,100,"3:36pm - <b>1.30</b>","Navios Maritime Acquisition Cor"
"NNC",14.33,14.29,"14.24 - 14.38",200,1500,25411,100,"3:35pm - <b>14.25</b>","Nuveen North Carolina Premium I"
"NNI",38.81,38.69,"38.68 - 39.12",200,100,38239,100,"3:37pm - <b>38.84</b>","Nelnet, Inc. Common Stock"
"NNN",52.04,52.03,"51.17 - 52.05",300,300,391919,100,"3:37pm - <b>51.95</b>","National Retail Properties Comm"
"NNN-D",N/A,N/A,N/A,N/A,N/A,N/A,N/A,N/A,N/A
"NNN-E",N/A,N/A,N/A,N/A,N/A,N/A,N/A,N/A,N/A
"NNY",10.60,10.48,"10.48 - 10.59",300,700,41883,173,"3:18pm - <b>10.50</b>","Nuveen New York Municipal Value"
"NOA",2.50,2.48,"2.49 - 2.62",400,200,25629,100,"3:25pm - <b>2.50</b>","North American Energy Partners,"
"NOAH",26.97,26.89,"26.81 - 27.17",100,200,160472,100,"3:37pm - <b>26.96</b>","Noah Holdings Limited"
"NOC",217.21,217.16,"216.03 - 217.62",100,200,366718,100,"3:37pm - <b>217.08</b>","Northrop Grumman Corporation Co"
"NOK",5.630,5.620,"5.610 - 5.650",120900,139000,5396229,100,"3:37pm - <b>5.625</b>","Nokia Corporation Sponsored Ame"
"NOM",N/A,16.7400,"16.7401 - 16.8500",N/A,100,1155,300,"3:33pm - <b>16.7401</b>","Nuveen Missouri Premium Income "
"NOMD",11.80,11.79,"11.70 - 11.88",300,400,439174,100,"3:37pm - <b>11.80</b>","Nomad Foods Limited Ordinary Sh"
"NORD",21.96,21.95,"21.78 - 22.00",200,200,35757,100,"3:36pm - <b>21.95</b>","Nord Anglia Education, Inc. Ord"
"NOV",33.91,33.90,"33.73 - 34.31",900,700,3468166,100,"3:37pm - <b>33.90</b>","National Oilwell Varco, Inc. Co"
"NOW",76.76,76.73,"76.41 - 77.23",200,200,675809,100,"3:37pm - <b>76.78</b>","ServiceNow, Inc. Common Stock"
"NP",79.74,79.57,"79.52 - 80.31",100,200,41010,100,"3:36pm - <b>79.55</b>","Neenah Paper, Inc. Common Stock"
"NPK",88.8900,88.5600,"88.1600 - 90.1000",100,200,5940,510,"3:14pm - <b>89.1381</b>","National Presto Industries, Inc"
"NPO",55.93,55.84,"55.68 - 56.45",100,200,69108,100,"3:36pm - <b>55.84</b>","EnPro Industries Inc"
"NPTN",16.29,16.28,"16.05 - 16.61",700,600,502802,100,"3:37pm - <b>16.28</b>","NeoPhotonics Corporation Common"
"NPV",14.38,14.36,"14.37 - 14.52",2900,300,22824,100,"3:10pm - <b>14.37</b>","Nuveen Virginia Premium Income "
"NQ",3.97,3.96,"3.79 - 3.97",1400,9000,377335,100,"3:37pm - <b>3.96</b>","NQ Mobile Inc. American Deposit"
"NQP",14.9200,14.9000,"14.8800 - 14.9200",400,400,25079,400,"3:33pm - <b>14.9001</b>","Nuveen Pennsylvania Investment "
"NR",6.660,6.650,"6.650 - 6.900",1300,1100,221995,100,"3:36pm - <b>6.655</b>","Newpark Resources, Inc. Common "
"NRE",11.04,11.03,"10.99 - 11.30",1700,1100,248340,100,"3:37pm - <b>11.03</b>","NorthStar Realty Europe Corp. C"
"NRF",12.870,12.860,"12.760 - 12.970",5500,1900,747119,100,"3:37pm - <b>12.865</b>","NorthStar Realty Finance Corp. "
"NRF-A",N/A,N/A,N/A,N/A,N/A,N/A,N/A,N/A,N/A
"NRF-B",N/A,N/A,N/A,N/A,N/A,N/A,N/A,N/A,N/A
"NRF-C",N/A,N/A,N/A,N/A,N/A,N/A,N/A,N/A,N/A
"NRF-D",N/A,N/A,N/A,N/A,N/A,N/A,N/A,N/A,N/A
"NRF-E",N/A,N/A,N/A,N/A,N/A,N/A,N/A,N/A,N/A
"NRG",11.32,11.31,"11.30 - 11.53",9500,700,3106220,100,"3:37pm - <b>11.30</b>","NRG Energy, Inc. Common Stock"
"NRK",14.22,14.20,"14.19 - 14.29",300,1600,66745,100,"3:19pm - <b>14.22</b>","Nuveen New York AMT-Free Munici"
"NRP",27.41,27.40,"25.84 - 28.25",100,200,117103,600,"3:36pm - <b>27.40</b>","Natural Resource Partners LP Li"
"NRT",7.23,7.12,"7.11 - 7.30",200,100,20505,100,"2:50pm - <b>7.14</b>","North European Oil Royality Tru"
"NRZ",14.32,14.31,"14.26 - 14.50",9100,3500,3242923,100,"3:37pm - <b>14.32</b>","New Residential Investment Corp"
"NS",47.60,47.53,"46.72 - 47.95",300,100,318602,800,"3:37pm - <b>47.60</b>","Nustar Energy L.P.  Common Unit"
"NSA",21.44,21.43,"21.12 - 21.55",1000,200,201062,100,"3:37pm - <b>21.44</b>","National Storage Affiliates Tru"
"NSAM",12.55,12.54,"12.29 - 12.60",2900,2200,1294902,300,"3:37pm - <b>12.55</b>","NorthStar Asset Management Grou"
"NSC",93.36,93.34,"92.83 - 94.05",300,300,816889,100,"3:37pm - <b>93.26</b>","Norfolk Southern Corporation Co"
"NSH",25.060,24.910,"24.470 - 25.220",100,100,25206,1800,"3:30pm - <b>24.961</b>","Nustar GP Holdings, LLC Units"
"NSL",6.45,6.44,"6.42 - 6.45",5600,500,75881,100,"3:37pm - <b>6.44</b>","Nuveen Senior Income Fund Commo"
"NSM",14.55,14.54,"14.46 - 15.05",200,1100,416632,100,"3:37pm - <b>14.54</b>","Nationstar Mortgage Holdings In"
"NSP",73.69,73.44,"72.44 - 73.73",200,100,145346,325,"3:36pm - <b>73.46</b>","Insperity, Inc. Common Stock"
"NSR",26.94,26.93,"26.91 - 27.40",300,600,244897,100,"3:37pm - <b>26.93</b>","Neustar, Inc. Neustar, Inc. Cla"
"NSS",26.50,26.47,"26.42 - 26.52",100,300,6585,372,"3:02pm - <b>26.47</b>","NuStar Logistics, L.P. 7.625% F"
"NTB",24.13,24.10,"24.00 - 24.23",100,200,147433,100,"3:35pm - <b>24.11</b>","Bank of N.T. Butterfield & Son "
"NTC",13.75,13.69,"13.67 - 13.76",800,700,17844,100,"3:18pm - <b>13.74</b>","Nuveen Connecticut Premium Inco"
"NTG",19.560,19.520,"19.500 - 19.780",1300,200,55197,565,"3:33pm - <b>19.555</b>","Tortoise MLP Fund, Inc. Common "
"NTL",24.20,24.15,"23.75 - 24.20",2400,500,17327,100,"3:37pm - <b>24.20</b>","Nortel Inversora SA, ADR Common"
"NTP",8.10,8.07,"7.90 - 8.20",2200,5000,83885,100,"3:35pm - <b>8.07</b>","Nam Tai Property Inc. Common St"
"NTT",46.79,46.78,"46.54 - 46.86",600,100,156805,100,"3:37pm - <b>46.76</b>","Nippon Telegraph and Telephone "
"NTX",15.28,15.27,"15.26 - 15.31",100,100,6126,200,"3:34pm - <b>15.31</b>","Nuveen Texas Quality Income Mun"
"NTZ",1.73,1.71,"1.60 - 1.75",400,100,55016,196,"3:12pm - <b>1.71</b>","Natuzzi, S.p.A."
"NUE",49.03,49.02,"48.43 - 49.19",400,200,3054614,100,"3:37pm - <b>48.99</b>","Nucor Corporation Common Stock"
"NUM",14.84,14.79,"14.75 - 14.90",100,400,32989,300,"2:43pm - <b>14.85</b>","Nuveen Michigan Quality Income "
"NUO",16.63,16.61,"16.60 - 16.69",2900,100,15108,600,"3:24pm - <b>16.60</b>","Nuveen Ohio Quality Income Muni"
"NUS",63.31,63.26,"62.58 - 63.47",300,500,361726,127,"3:36pm - <b>63.17</b>","Nu Skin Enterprises, Inc. Commo"
"NUV",10.55,10.54,"10.50 - 10.55",6200,1800,163022,100,"3:36pm - <b>10.55</b>","Nuveen Municipal Value Fund, In"
"NUW",18.73,18.67,"18.67 - 19.07",100,200,33839,100,"3:34pm - <b>18.67</b>","Nuveen AMT-Free Municipal Value"
"NVG",16.04,16.03,"16.02 - 16.10",5800,700,272869,100,"3:35pm - <b>16.03</b>","Nuveen Enhanced AMT-Free Munici"
"NVGS",7.22,7.21,"7.17 - 7.62",200,300,251929,100,"3:36pm - <b>7.22</b>","Navigator Holdings Ltd. Ordinar"
"NVO",44.500,44.490,"44.290 - 44.840",1100,1000,1656824,100,"3:37pm - <b>44.495</b>","Novo Nordisk A/S Common Stock"
"NVR",1648.0900,1644.3000,"1641.0100 - 1649.4550",200,500,12461,16,"3:37pm - <b>1647.3975</b>","NVR, Inc. Common Stock"
"NVRO",102.88,102.73,"100.63 - 104.23",400,200,414630,100,"3:37pm - <b>102.77</b>","Nevro Corp. Common Stock"
"NVS",80.73,80.72,"80.58 - 81.13",300,800,1090386,100,"3:37pm - <b>80.73</b>","Novartis AG Common Stock"
"NVTA",8.56,8.52,"8.30 - 8.73",300,200,40197,200,"3:36pm - <b>8.54</b>","Invitae Corporation Common Stoc"
"NW-C",N/A,N/A,N/A,N/A,N/A,N/A,N/A,N/A,N/A
"NWE",59.940,59.890,"59.540 - 60.230",200,300,164767,100,"3:37pm - <b>59.865</b>","NorthWestern Corporation Common"
"NWHM",10.22,10.20,"10.04 - 10.34",100,800,12089,100,"3:36pm - <b>10.20</b>","New Home Company Inc. (The) Com"
"NWL",51.4200,51.4100,"51.3600 - 51.7200",800,1000,2046487,500,"3:37pm - <b>51.4101</b>","Newell Brands Inc. Common Stock"
"NWN",62.56,62.42,"62.07 - 62.84",200,100,58257,100,"3:36pm - <b>62.35</b>","Northwest Natural Gas Company C"
"NWY",2.2900,2.2600,"2.2400 - 2.3500",800,100,46512,200,"3:30pm - <b>2.2634</b>","New York & Company, Inc. New Yo"
"NX",17.57,17.55,"17.35 - 17.70",500,400,105077,100,"3:37pm - <b>17.54</b>","Quanex Building Products Corpor"
"NXC",17.60,17.45,"17.30 - 17.65",100,200,1792,100,"3:00pm - <b>17.32</b>","Nuveen California Select Tax-Fr"
"NXJ",14.93,14.90,"14.87 - 14.95",500,100,62969,100,"3:31pm - <b>14.91</b>","Nuveen New Jersey Dividend Adva"
"NXN",14.48,14.43,"14.47 - 14.54",400,600,1404,100,"2:34pm - <b>14.47</b>","Nuveen New York Select Tax-Free"
"NXP",15.33,15.30,"15.29 - 15.40",100,100,28127,100,"3:35pm - <b>15.30</b>","Nuveen Select Tax Free Income P"
"NXQ",14.70,14.65,"14.65 - 14.79",200,200,13346,100,"1:57pm - <b>14.69</b>","Nuveen Select Tax Free Income P"
"NXR",15.56,15.53,"15.52 - 15.59",400,200,11330,100,"3:25pm - <b>15.53</b>","Nuveen Select Tax Free Income P"
"NXRT",20.96,20.92,"20.83 - 21.15",200,200,95225,100,"3:35pm - <b>20.91</b>","NexPoint Residential Trust, Inc"
"NYCB",14.470,14.460,"14.380 - 14.660",11700,1600,3074320,100,"3:37pm - <b>14.465</b>","New York Community Bancorp, Inc"
"NYCB-U",N/A,N/A,N/A,N/A,N/A,N/A,N/A,N/A,N/A
"NYLD",17.14,17.13,"17.11 - 17.43",1700,300,267481,100,"3:37pm - <b>17.11</b>","NRG Yield, Inc. Class C Common "
"NYLD.A",N/A,N/A,N/A,N/A,N/A,N/A,N/A,N/A,N/A
"NYRT",9.27,9.26,"9.25 - 9.34",8500,1500,556666,100,"3:37pm - <b>9.26</b>","New York REIT, Inc. Common Stoc"
"NYT",12.380,12.370,"12.290 - 12.420",1700,2400,280243,100,"3:37pm - <b>12.375</b>","New York Times Company (The) Co"
"NYV",16.21,15.74,"15.89 - 15.89",1100,800,1008,182,"2:24pm - <b>15.89</b>","Nuveen New York Municipal Value"
"NZF",15.74,15.73,"15.71 - 15.76",5400,3400,193789,100,"3:35pm - <b>15.74</b>","Nuveen Enhanced Municipal Credi"
"O",68.74,68.73,"67.56 - 68.99",500,400,1154276,100,"3:37pm - <b>68.86</b>","Realty Income Corporation Commo"
"O-F",N/A,N/A,N/A,N/A,N/A,N/A,N/A,N/A,N/A
"OA",76.21,76.17,"73.78 - 76.37",300,100,1128812,100,"3:36pm - <b>76.17</b>","Orbital ATK, Inc. Common Stock"
"OAK",41.8700,41.8500,"41.7600 - 43.0322",200,400,288512,197,"3:36pm - <b>41.8101</b>","Oaktree Capital Group, LLC Clas"
"OAKS",5.69,5.67,"5.61 - 5.72",200,100,29702,100,"3:32pm - <b>5.66</b>","Five Oaks Investment Corp. Comm"
"OAKS-A",N/A,N/A,N/A,N/A,N/A,N/A,N/A,N/A,N/A
"OAS",9.48,9.47,"9.18 - 9.61",4900,3700,12567650,200,"3:37pm - <b>9.46</b>","Oasis Petroleum Inc. Common Sto"
"OB",14.62,14.59,"14.56 - 14.85",200,100,56942,100,"3:36pm - <b>14.58</b>","OneBeacon Insurance Group, Ltd."
"OC",53.61,53.60,"52.86 - 53.99",700,1200,940790,200,"3:37pm - <b>53.60</b>","Owens Corning Inc Common Stock "
"OCIP",5.9200,5.9000,"5.9000 - 6.0300",100,100,7692,200,"3:33pm - <b>5.9032</b>","OCI Partners LP Common Units re"
"OCN",3.40,3.39,"3.38 - 3.49",2100,8900,756757,100,"3:37pm - <b>3.40</b>","Ocwen Financial Corporation NEW"
"ODC",38.92,38.66,"38.38 - 38.98",100,100,3687,100,"3:08pm - <b>38.83</b>","Oil-Dri Corporation Of America "
"OEC",18.75,18.73,"18.53 - 18.93",100,200,67550,100,"3:37pm - <b>18.65</b>","Orion Engineered Carbons S.A Co"
"OFC",29.29,29.28,"28.84 - 29.30",1300,300,446871,100,"3:37pm - <b>29.28</b>","Corporate Office Properties Tru"
"OFC-L",N/A,N/A,N/A,N/A,N/A,N/A,N/A,N/A,N/A
"OFG",9.90,9.89,"9.87 - 10.16",900,300,181617,100,"3:36pm - <b>9.90</b>","OFG Bancorp Common Stock"
"OFG-A",N/A,N/A,N/A,N/A,N/A,N/A,N/A,N/A,N/A
"OFG-B",N/A,N/A,N/A,N/A,N/A,N/A,N/A,N/A,N/A
"OFG-D",N/A,N/A,N/A,N/A,N/A,N/A,N/A,N/A,N/A
"OGE",32.89,32.88,"32.55 - 33.04",1300,600,449673,100,"3:36pm - <b>32.88</b>","OGE Energy Corporation Common S"
"OGS",64.33,64.27,"63.67 - 64.50",100,200,67382,100,"3:36pm - <b>64.24</b>","ONE Gas, Inc. Common Stock"
"OHI",36.5700,36.5600,"35.8900 - 36.6000",1100,100,971682,500,"3:37pm - <b>36.5328</b>","Omega Healthcare Investors, Inc"
"OI",17.73,17.72,"17.70 - 18.18",2800,600,1019971,100,"3:37pm - <b>17.70</b>","Owens-Illinois, Inc. Common Sto"
"OIA",8.27,8.26,"8.21 - 8.27",300,200,75147,200,"3:35pm - <b>8.26</b>","Invesco Municipal Income Opport"
"OIBR.C",N/A,N/A,N/A,N/A,N/A,N/A,N/A,N/A,N/A
"OII",25.19,25.18,"25.09 - 25.73",1200,500,587126,100,"3:37pm - <b>25.16</b>","Oceaneering International, Inc."
"OIS",28.10,28.08,"27.70 - 28.27",100,300,248317,100,"3:36pm - <b>28.10</b>","Oil States International, Inc. "
"OKE",48.85,48.84,"48.45 - 49.43",600,300,1207110,100,"3:37pm - <b>48.84</b>","ONEOK, Inc. Common Stock"
"OKS",38.65,38.62,"38.45 - 38.96",400,100,406984,100,"3:36pm - <b>38.65</b>","ONEOK Partners, L.P. Common Sto"
"OLN",18.83,18.82,"18.68 - 18.98",2100,600,669930,100,"3:37pm - <b>18.82</b>","Olin Corporation Common Stock"
"OLP",24.77,24.73,"24.72 - 25.10",100,200,25459,100,"3:36pm - <b>24.76</b>","One Liberty Properties, Inc. Co"
"OMAA",25.18,25.01,"25.01 - 25.23",100,200,42711,100,"3:36pm - <b>25.18</b>","OM Asset Management plc 5.125% "
"OMAM",13.21,13.20,"13.14 - 13.42",200,300,213158,100,"3:37pm - <b>13.20</b>","OM Asset Management plc Ordinar"
"OMC",83.94,83.92,"83.36 - 83.98",400,300,655372,200,"3:37pm - <b>83.90</b>","Omnicom Group Inc. Common Stock"
"OME",23.73,23.69,"23.65 - 24.09",500,500,149316,100,"3:35pm - <b>23.73</b>","Omega Protein Corporation Commo"
"OMF",30.49,30.46,"30.19 - 31.11",200,200,293687,100,"3:37pm - <b>30.47</b>","OneMain Holdings, Inc. Common S"
"OMI",34.59,34.58,"34.20 - 34.78",600,500,623471,100,"3:37pm - <b>34.58</b>","Owens & Minor, Inc. Common Stoc"
"OMN",7.94,7.93,"7.89 - 8.13",700,500,462150,100,"3:37pm - <b>7.94</b>","OMNOVA Solutions Inc. Common St"
"ONDK",5.82,5.81,"5.75 - 5.89",1300,1300,163606,100,"3:35pm - <b>5.82</b>","On Deck Capital, Inc. Common St"
"OOMA",9.03,9.02,"8.94 - 9.14",200,200,66542,100,"3:30pm - <b>9.00</b>","Ooma, Inc. Common Stock"
"OPY",14.31,14.26,"14.12 - 14.73",200,100,16900,100,"3:37pm - <b>14.17</b>","Oppenheimer Holdings, Inc. Clas"
"OR",11.22,11.21,"11.18 - 11.49",200,100,39890,100,"3:36pm - <b>11.18</b>","Osisko Gold Royalties Ltd Commo"
"ORA",49.21,49.19,"49.16 - 49.93",200,100,107176,111,"3:36pm - <b>49.19</b>","Ormat Technologies, Inc. Common"
"ORAN",15.21,15.20,"15.12 - 15.25",2300,2000,258771,100,"3:37pm - <b>15.21</b>","Orange"
"ORC",10.6000,10.5900,"10.5100 - 10.6200",1900,1300,236533,200,"3:37pm - <b>10.5815</b>","Orchid Island Capital, Inc. Com"
"ORCL",39.080,39.070,"38.760 - 39.105",10900,3500,6731954,100,"3:37pm - <b>39.078</b>","Oracle Corporation Common Stock"
"ORI",17.74,17.73,"17.73 - 17.97",4100,3200,1827932,100,"3:37pm - <b>17.73</b>","Old Republic International Corp"
"ORN",6.58,6.57,"6.47 - 6.62",200,100,39958,100,"3:35pm - <b>6.57</b>","Orion Group Holdings, Inc. Comm"
"OSB",24.21,24.16,"23.91 - 24.35",200,100,8726,100,"3:22pm - <b>24.18</b>","Norbord Inc. Common Stock"
"OSG",11.15,11.14,"11.13 - 11.26",500,1100,181550,100,"3:37pm - <b>11.15</b>","Overseas Shipholding Group, Inc"
"OSK",52.41,52.40,"51.50 - 52.89",800,1000,1568638,100,"3:37pm - <b>52.42</b>","Oshkosh Corporation (Holding Co"
"OUT",23.37,23.36,"23.07 - 23.50",700,500,515768,100,"3:37pm - <b>23.35</b>","OUTFRONT Media Inc. Common Stoc"
"OXM",67.37,67.34,"67.28 - 69.89",200,200,164861,100,"3:37pm - <b>67.35</b>","Oxford Industries, Inc. Common "
"OXY",69.42,69.41,"69.22 - 70.20",200,600,3300158,100,"3:37pm - <b>69.35</b>","Occidental Petroleum Corporatio"
"OZM",4.0100,4.0000,"3.9075 - 4.0053",1300,200,565856,1900,"3:37pm - <b>4.0023</b>","Och-Ziff Capital Management Gro"
"P",14.000,13.990,"13.880 - 14.120",4300,2500,1937640,100,"3:37pm - <b>13.995</b>","Pandora Media, Inc. Common Stoc"
"PAA",30.09,30.08,"29.65 - 30.23",600,600,1256839,200,"3:37pm - <b>30.04</b>","Plains All American Pipeline, L"
"PAC",89.48,89.37,"89.15 - 90.42",300,200,55624,100,"3:34pm - <b>89.32</b>","Grupo Aeroportuario Del Pacific"
"PACD",3.56,3.55,"3.56 - 3.77",700,2200,172710,100,"3:37pm - <b>3.56</b>","Pacific Drilling S.A. Common Sh"
"PAG",48.360,48.350,"47.950 - 48.890",300,400,536489,100,"3:37pm - <b>48.355</b>","Penske Automotive Group, Inc. C"
"PAGP",12.580,12.570,"12.260 - 12.725",900,2100,2853687,100,"3:37pm - <b>12.565</b>","Plains Group Holdings, L.P. Cla"
"PAH",8.360,8.350,"8.340 - 8.550",8100,2800,2279310,100,"3:37pm - <b>8.355</b>","Platform Specialty Products Cor"
"PAI",15.280,15.260,"15.240 - 15.360",800,100,36278,581,"3:34pm - <b>15.285</b>","Western Asset Income Fund Commo"
"PAM",31.33,31.24,"31.18 - 31.95",200,200,86700,100,"3:37pm - <b>31.26</b>","Pampa Energia S.A. Pampa Energi"
"PANW",150.150,150.120,"148.860 - 150.709",300,100,865168,100,"3:37pm - <b>150.105</b>","Palo Alto Networks, Inc. Common"
"PAR",5.27,5.25,"5.07 - 5.29",900,200,7156,100,"3:23pm - <b>5.25</b>","PAR Technology Corporation Comm"
"PAY",16.14,16.13,"16.07 - 16.27",5600,800,1194035,100,"3:37pm - <b>16.12</b>","Verifone Systems, Inc. Common S"
"PAYC",50.59,50.57,"49.75 - 50.68",400,300,248426,100,"3:37pm - <b>50.51</b>","Paycom Software, Inc. Common St"
"PB",53.05,53.01,"53.00 - 53.79",200,300,157829,100,"3:36pm - <b>53.05</b>","Prosperity Bancshares, Inc. Com"
"PBA",30.02,30.00,"29.92 - 30.32",600,1000,66337,100,"3:36pm - <b>30.03</b>","Pembina Pipeline Corp. Ordinary"
"PBB",25.7200,25.6700,"25.5692 - 25.7300",300,200,21431,550,"3:34pm - <b>25.6827</b>","Prospect Capital Corporation 6."
"PBF",22.21,22.20,"22.17 - 23.05",1400,2900,1390592,100,"3:37pm - <b>22.17</b>","PBF Energy Inc. Class A Common "
"PBFX",19.77,19.75,"19.72 - 20.04",200,200,37194,100,"3:29pm - <b>19.77</b>","PBF Logistics LP Common Units r"
"PBH",48.39,48.38,"48.18 - 48.68",300,100,237948,100,"3:37pm - <b>48.25</b>","Prestige Brand Holdings, Inc. C"
"PBI",17.61,17.60,"17.55 - 17.75",2200,1800,676400,100,"3:37pm - <b>17.61</b>","Pitney Bowes Inc. Common Stock"
"PBI-B",N/A,N/A,N/A,N/A,N/A,N/A,N/A,N/A,N/A
