Symbol,Ask,Bid,Range,AskSize,BidSize,Volume,LastTradeSize,LastTradeWithTime,Name
"PBR",9.050,9.040,"9.040 - 9.200",3200,55400,17201348,100,"2:56pm - <b>9.045</b>","Petroleo Brasileiro S.A.- Petro"
"PBR.A",N/A,N/A,N/A,N/A,N/A,N/A,N/A,N/A,N/A
"PBT",7.07,7.02,"6.97 - 7.08",400,300,38296,100,"2:50pm - <b>7.00</b>","Permian Basin Royalty Trust Com"
"PBYI",69.43,69.39,"67.29 - 69.65",300,100,639632,100,"2:56pm - <b>69.33</b>","Puma Biotechnology Inc Common S"
"PCF",8.02,8.01,"8.01 - 8.06",100,200,38751,100,"2:37pm - <b>8.01</b>","Putnam High Income Securities F"
"PCG",64.03,64.02,"63.77 - 64.28",500,300,1231380,100,"2:55pm - <b>64.03</b>","Pacific Gas & Electric Co. Comm"
"PCI",20.2500,20.2400,"20.2100 - 20.3000",300,900,373993,1800,"2:55pm - <b>20.2401</b>","PIMCO Dynamic Credit and Mortga"
"PCK",10.69,10.65,"10.61 - 10.75",100,200,19475,100,"2:53pm - <b>10.65</b>","Pimco California Municipal Inco"
"PCM",9.98,9.95,"9.94 - 10.05",600,2100,49496,100,"2:46pm - <b>9.98</b>","PCM Fund, Inc. Common Stock"
"PCN",15.35,15.32,"15.23 - 15.39",400,200,76051,115,"2:55pm - <b>15.27</b>","Pimco Corporate & Income Strate"
"PCQ",17.0200,16.9200,"16.9200 - 17.0800",500,100,29244,280,"2:25pm - <b>16.9545</b>","PIMCO California Municipal Inco"
"PDI",28.3900,28.3600,"28.3200 - 28.4300",300,300,62091,100,"2:45pm - <b>28.3999</b>","PIMCO Dynamic Income Fund Commo"
"PDM",22.02,22.01,"21.65 - 22.02",200,1600,432614,100,"2:56pm - <b>22.02</b>","Piedmont Office Realty Trust, I"
"PDS",3.72,3.71,"3.68 - 3.79",6700,24400,853715,200,"2:53pm - <b>3.71</b>","Precision Drilling Corporation "
"PDT",16.79,16.74,"16.68 - 16.96",400,200,97047,100,"2:49pm - <b>16.70</b>","John Hancock Premium Dividend F"
"PE",31.820,31.810,"31.060 - 32.010",700,400,1920521,100,"2:55pm - <b>31.815</b>","Parsley Energy, Inc. Class A Co"
"PEB",26.21,26.20,"26.08 - 26.45",300,700,774296,400,"2:55pm - <b>26.21</b>","Pebblebrook Hotel Trust Common "
"PEB-C",N/A,N/A,N/A,N/A,N/A,N/A,N/A,N/A,N/A
"PEB-D",N/A,N/A,N/A,N/A,N/A,N/A,N/A,N/A,N/A
"PEG",43.610,43.600,"43.415 - 43.845",800,700,1319325,100,"2:56pm - <b>43.605</b>","Public Service Enterprise Group"
"PEI",24.08,24.07,"23.85 - 24.08",300,300,250077,100,"2:55pm - <b>24.07</b>","Pennsylvania Real Estate Invest"
"PEI-A",N/A,N/A,N/A,N/A,N/A,N/A,N/A,N/A,N/A
"PEI-B",N/A,N/A,N/A,N/A,N/A,N/A,N/A,N/A,N/A
"PEN",77.15,77.10,"76.81 - 77.38",100,400,94192,100,"2:55pm - <b>77.13</b>","Penumbra, Inc. Common Stock"
"PEO",19.32,19.28,"19.22 - 19.43",300,300,36868,100,"2:54pm - <b>19.28</b>","Adams Natural Resources Fund, I"
"PEP",107.01,107.00,"106.87 - 107.38",300,700,2692790,100,"2:55pm - <b>107.05</b>","Pepsico, Inc. Common Stock"
"PER",2.60,2.59,"2.59 - 2.62",500,600,66206,243,"2:35pm - <b>2.60</b>","SandRidge Permian Trust Common "
"PES",3.46,3.45,"3.45 - 3.55",600,1200,439605,100,"2:55pm - <b>3.45</b>","Pioneer Energy Services Corp. C"
"PF",49.82,49.80,"49.27 - 49.93",400,500,605778,100,"2:55pm - <b>49.82</b>","Pinnacle Foods, Inc. Common Sto"
"PFD",14.99,14.86,"14.84 - 15.25",100,400,20853,100,"2:49pm - <b>14.87</b>","Flaherty & Crumrine Preferred I"
"PFE",33.54,33.53,"33.42 - 34.01",14000,4900,19810980,100,"2:56pm - <b>33.53</b>","Pfizer, Inc. Common Stock"
"PFG",49.45,49.44,"49.04 - 49.88",700,400,1107808,100,"2:56pm - <b>49.44</b>","Principal Financial Group Inc C"
"PFGC",24.44,24.43,"24.36 - 24.90",500,300,338376,100,"2:54pm - <b>24.43</b>","Performance Food Group Company "
"PFH",19.52,19.45,"19.43 - 19.64",100,1000,4363,100,"2:48pm - <b>19.51</b>","Cabco Tr Jcp 7.625 Common Stock"
"PFK",25.8800,25.8500,"25.8350 - 25.9400",100,100,1733,225,"2:08pm - <b>25.8699</b>","Prudential Financial Inflation-"
"PFL",10.57,10.54,"10.53 - 10.60",200,500,66069,105,"2:55pm - <b>10.55</b>","PIMCO Income Strategy Fund Shar"
"PFN",9.46,9.45,"9.42 - 9.50",1500,200,192231,100,"2:51pm - <b>9.45</b>","PIMCO Income Strategy Fund II"
"PFO",11.60,11.52,"11.51 - 11.72",300,100,19592,200,"2:46pm - <b>11.55</b>","Flaherty & Crumrine Preferred I"
"PFS",20.91,20.90,"20.90 - 21.12",400,400,61349,100,"2:55pm - <b>20.90</b>","Provident Financial Services, I"
"PFSI",17.56,17.53,"17.40 - 18.08",200,100,98138,100,"2:55pm - <b>17.40</b>","PennyMac Financial Services, In"
"PG",88.120,88.110,"86.610 - 88.430",2500,5300,40905434,100,"2:56pm - <b>88.115</b>","Procter & Gamble Company (The) "
"PGEM",13.62,13.59,"13.37 - 13.66",200,200,50664,100,"2:55pm - <b>13.60</b>","Ply Gem Holdings, Inc. Common S"
"PGH",1.45,1.44,"1.44 - 1.49",7300,45300,672650,200,"2:53pm - <b>1.44</b>","Pengrowth Energy Corporation"
"PGND",40.39,40.38,"40.33 - 40.40",100,100,686916,2900,"2:55pm - <b>40.35</b>","Press Ganey Holdings, Inc. Comm"
"PGP",20.5500,20.5400,"20.3000 - 20.6800",100,900,36473,195,"2:56pm - <b>20.5437</b>","Pimco Global Stocksplus & Incom"
"PGR",31.26,31.25,"30.97 - 31.27",3500,1500,1743158,100,"2:56pm - <b>31.25</b>","Progressive Corporation (The) C"
"PGRE",17.14,17.13,"17.13 - 17.32",1500,1100,253012,100,"2:55pm - <b>17.13</b>","Paramount Group, Inc. Common St"
"PGZ",17.520,17.490,"17.460 - 17.600",1100,100,17764,1200,"2:38pm - <b>17.493</b>","Principal Real Estate Income Fu"
"PH",121.42,121.41,"120.57 - 122.10",200,100,540426,100,"2:55pm - <b>121.30</b>","Parker-Hannifin Corporation Com"
"PHD",11.6200,11.6100,"11.5100 - 11.6300",400,400,79155,521,"2:54pm - <b>11.6172</b>","Pioneer Floating Rate Trust Pio"
"PHG",29.49,29.48,"29.42 - 29.64",2800,1000,627655,103,"2:54pm - <b>29.48</b>","Koninklijke Philips N.V. NY Reg"
"PHH",14.14,14.12,"14.09 - 14.31",600,300,75805,100,"2:53pm - <b>14.13</b>","PHH Corp Common Stock"
"PHI",35.7200,35.6600,"35.6500 - 36.1400",100,200,65543,254,"2:49pm - <b>35.6575</b>","PLDT Inc. Sponsored ADR"
"PHK",9.8700,9.8500,"9.7000 - 9.9000",3400,900,762607,600,"2:55pm - <b>9.8692</b>","Pimco High Income Fund Pimco Hi"
"PHM",19.710,19.700,"19.630 - 19.860",1200,5000,1834767,100,"2:56pm - <b>19.705</b>","PulteGroup, Inc. Common Stock"
"PHT",10.47,10.42,"10.38 - 10.49",100,200,39295,200,"2:54pm - <b>10.41</b>","Pioneer High Income Trust Commo"
"PHX",16.66,16.61,"16.42 - 16.74",100,100,7066,200,"2:47pm - <b>16.60</b>","Panhandle Oil and Gas Inc Commo"
"PII",74.290,74.250,"74.030 - 74.770",300,500,613179,100,"2:55pm - <b>74.265</b>","Polaris Industries Inc. Common "
"PIM",4.42,4.41,"4.41 - 4.44",5000,2900,54143,100,"2:46pm - <b>4.42</b>","Putnam Master Intermediate Inco"
"PIR",4.13,4.12,"4.11 - 4.39",7700,5500,1165971,100,"2:56pm - <b>4.12</b>","Pier 1 Imports, Inc. Common Sto"
"PIY",28.0600,27.8000,"27.8891 - 28.0999",200,300,2001,200,"1:50pm - <b>28.0277</b>","Preferred Plus Trust (Ser CZN) "
"PJC",46.89,46.79,"46.79 - 48.20",100,200,39835,100,"2:54pm - <b>46.89</b>","Piper Jaffray Companies Common "
"PJH",26.50,26.40,"26.39 - 26.55",100,100,14489,380,"2:34pm - <b>26.50</b>","Prudential Financial, Inc. 5.75"
"PJT",25.79,25.73,"25.61 - 26.67",100,100,82576,100,"2:55pm - <b>25.79</b>","PJT Partners Inc. Class A Commo"
"PKD",2.05,2.04,"2.03 - 2.11",3000,1500,193481,100,"2:55pm - <b>2.04</b>","Parker Drilling Company Common "
"PKE",17.08,17.03,"17.01 - 17.15",100,100,9794,100,"2:38pm - <b>17.05</b>","Park Electrochemical Corporatio"
"PKG",81.99,81.98,"81.62 - 82.40",200,100,428720,100,"2:55pm - <b>82.03</b>","Packaging Corporation of Americ"
"PKI",55.3800,55.3700,"54.9200 - 55.7500",300,100,429654,443,"2:55pm - <b>55.3744</b>","PerkinElmer, Inc. Common Stock"
"PKO",23.23,23.20,"23.16 - 23.31",300,800,29638,200,"2:55pm - <b>23.24</b>","Pimco Income Opportunity Fund C"
"PKX",50.16,50.15,"50.07 - 50.52",400,200,153851,100,"2:54pm - <b>50.18</b>","POSCO Common Stock"
"PKY",17.52,17.49,"17.43 - 17.64",400,300,273637,100,"2:55pm - <b>17.52</b>","Parkway Properties, Inc. Common"
"PL-C",N/A,N/A,N/A,N/A,N/A,N/A,N/A,N/A,N/A
"PL-E",N/A,N/A,N/A,N/A,N/A,N/A,N/A,N/A,N/A
"PLD",54.45,54.44,"54.06 - 54.66",600,700,1237171,100,"2:55pm - <b>54.45</b>","ProLogis, Inc. Common Stock"
"PLNT",20.58,20.55,"20.22 - 20.98",600,300,615663,100,"2:56pm - <b>20.55</b>","Planet Fitness, Inc. Common Sto"
"PLOW",31.26,31.22,"31.00 - 31.29",300,100,57106,100,"2:53pm - <b>31.26</b>","Douglas Dynamics, Inc. Common S"
"PLT",51.27,51.20,"50.79 - 51.33",300,100,52335,100,"2:54pm - <b>51.25</b>","Plantronics, Inc. Common Stock"
"PM",99.23,99.21,"99.16 - 100.43",200,700,2092757,100,"2:55pm - <b>99.27</b>","Philip Morris International Inc"
"PMC",27.18,27.17,"26.97 - 27.48",200,300,154490,100,"2:54pm - <b>27.17</b>","Pharmerica Corporation Common S"
"PMF",16.6800,16.6600,"16.6001 - 16.6800",800,500,51329,1125,"2:47pm - <b>16.6776</b>","PIMCO Municipal Income Fund Com"
"PML",13.61,13.59,"13.58 - 13.61",1700,300,43887,100,"2:42pm - <b>13.61</b>","Pimco Municipal Income Fund II "
"PMM",8.01,8.00,"7.97 - 8.02",900,3500,50131,200,"2:52pm - <b>8.00</b>","Putnam Managed Municipal Income"
"PMO",13.39,13.38,"13.36 - 13.42",400,300,31093,100,"2:52pm - <b>13.39</b>","Putnam Municipal Opportunities "
"PMT",15.38,15.36,"15.29 - 15.51",400,700,311786,100,"2:55pm - <b>15.36</b>","PennyMac Mortgage Investment Tr"
"PMX",12.6900,12.6800,"12.6601 - 12.7000",200,500,33051,100,"2:21pm - <b>12.6893</b>","PIMCO Municipal Income Fund III"
"PN",8.92,8.90,"8.82 - 9.09",1000,3100,63673,100,"2:50pm - <b>8.93</b>","Patriot National, Inc. Common S"
"PNC",87.88,87.87,"87.53 - 89.03",300,500,1944478,412,"2:55pm - <b>87.90</b>","PNC Financial Services Group, I"
"PNC-P",N/A,N/A,N/A,N/A,N/A,N/A,N/A,N/A,N/A
"PNC-Q",N/A,N/A,N/A,N/A,N/A,N/A,N/A,N/A,N/A
"PNC",87.88,87.87,"87.53 - 89.03",300,500,1944478,412,"2:55pm - <b>87.90</b>","PNC Financial Services Group, I"
"PNF",13.21,13.20,"13.19 - 13.33",100,100,31623,100,"1:36pm - <b>13.21</b>","PIMCO New York Municipal Income"
"PNI",13.280,13.230,"13.211 - 13.270",200,300,3833,300,"1:45pm - <b>13.261</b>","Pimco New York Municipal Income"
"PNM",34.64,34.63,"34.33 - 34.83",100,500,152890,200,"2:55pm - <b>34.66</b>","PNM Resources, Inc. (Holding Co"
"PNR",61.00,60.98,"60.44 - 61.19",300,400,483749,180,"2:55pm - <b>60.97</b>","Pentair plc. Ordinary Share"
"PNTA",25.35,25.30,"25.23 - 25.35",200,4200,10466,100,"2:55pm - <b>25.30</b>","PennantPark Investment Corporat"
"PNW",79.35,79.34,"78.98 - 79.71",300,300,381973,100,"2:55pm - <b>79.39</b>","Pinnacle West Capital Corporati"
"PNY",59.97,59.96,"59.95 - 60.00",800,4000,82100,200,"2:54pm - <b>59.96</b>","Piedmont Natural Gas Company, I"
"POL",32.44,32.43,"31.80 - 32.65",400,300,170916,100,"2:55pm - <b>32.48</b>","PolyOne Corporation Common Stoc"
"POR",43.87,43.85,"43.70 - 44.12",300,1100,291868,100,"2:55pm - <b>43.85</b>","Portland General Electric Co Co"
"POST",77.32,77.28,"77.19 - 78.18",200,400,421863,100,"2:55pm - <b>77.31</b>","Post Holdings, Inc. Common Stoc"
"POT",15.94,15.93,"15.84 - 16.11",7800,13400,5578191,100,"2:56pm - <b>15.94</b>","Potash Corporation of Saskatche"
"PPG",102.38,102.37,"102.26 - 103.29",200,200,533714,100,"2:55pm - <b>102.45</b>","PPG Industries, Inc. Common Sto"
"PPL",35.76,35.75,"35.48 - 35.81",1000,3100,2851417,100,"2:55pm - <b>35.76</b>","PPL Corporation Common Stock"
"PPP",1.56,1.55,"1.55 - 1.65",21700,19700,577054,100,"2:55pm - <b>1.56</b>","Primero Mining Corp.  New Commo"
"PPR",5.22,5.21,"5.20 - 5.23",5100,1200,199303,100,"2:52pm - <b>5.21</b>","Voya Prime Rate Trust Shares of"
"PPS",68.97,68.89,"67.76 - 69.03",100,200,352329,100,"2:52pm - <b>68.98</b>","Post Properties, Inc. Common St"
"PPS-A",N/A,N/A,N/A,N/A,N/A,N/A,N/A,N/A,N/A
"PPT",4.860,4.850,"4.790 - 4.860",6700,2900,515018,570,"2:40pm - <b>4.857</b>","Putnam Premier Income Trust Com"
"PPX",26.84,26.63,"26.61 - 26.84",600,100,7873,200,"2:47pm - <b>26.71</b>","PPL Capital Funding, Inc. 2013 "
"PQ",3.1600,3.1300,"3.0900 - 3.3200",200,400,82531,2000,"2:52pm - <b>3.1562</b>","Petroquest Energy Inc Common St"
"PRA",51.87,51.84,"51.75 - 52.34",200,200,61621,149,"2:56pm - <b>51.86</b>","ProAssurance Corporation Common"
"PRE-D",N/A,N/A,N/A,N/A,N/A,N/A,N/A,N/A,N/A
"PRE-E",N/A,N/A,N/A,N/A,N/A,N/A,N/A,N/A,N/A
"PRE-F",N/A,N/A,N/A,N/A,N/A,N/A,N/A,N/A,N/A
"PRE-G",N/A,N/A,N/A,N/A,N/A,N/A,N/A,N/A,N/A
"PRE-H",N/A,N/A,N/A,N/A,N/A,N/A,N/A,N/A,N/A
"PRE-I",N/A,N/A,N/A,N/A,N/A,N/A,N/A,N/A,N/A
"PRGO",95.59,95.53,"95.21 - 96.76",100,200,574245,100,"2:55pm - <b>95.54</b>","Perrigo Company plc Ordinary Sh"
"PRH",26.40,26.39,"26.32 - 26.44",300,200,17153,100,"2:27pm - <b>26.38</b>","Prudential Financial, Inc. 5.70"
"PRI",53.94,53.91,"53.84 - 54.98",200,300,222435,100,"2:55pm - <b>53.94</b>","Primerica, Inc. Common Stock"
"PRLB",57.19,57.14,"56.41 - 57.46",300,200,112655,100,"2:53pm - <b>57.18</b>","Proto Labs, Inc. Common stock"
"PRO",21.94,21.90,"21.74 - 22.00",200,200,66141,100,"2:49pm - <b>21.90</b>","PROS Holdings, Inc. Common Stoc"
"PRTY",16.79,16.78,"16.61 - 16.85",200,600,126674,100,"2:55pm - <b>16.79</b>","Party City Holdco Inc. Common S"
"PRU",79.25,79.24,"79.02 - 79.80",200,300,2078657,100,"2:56pm - <b>79.28</b>","Prudential Financial, Inc. Comm"
"PSA",224.17,224.08,"221.57 - 224.79",100,100,396271,100,"2:55pm - <b>224.17</b>","Public Storage Common Stock"
"PSA-A",N/A,N/A,N/A,N/A,N/A,N/A,N/A,N/A,N/A
"PSA-B",N/A,N/A,N/A,N/A,N/A,N/A,N/A,N/A,N/A
"PSA-C",N/A,N/A,N/A,N/A,N/A,N/A,N/A,N/A,N/A
"PSA-D",N/A,N/A,N/A,N/A,N/A,N/A,N/A,N/A,N/A
"PSA-S",N/A,N/A,N/A,N/A,N/A,N/A,N/A,N/A,N/A
"PSA-T",N/A,N/A,N/A,N/A,N/A,N/A,N/A,N/A,N/A
"PSA-U",N/A,N/A,N/A,N/A,N/A,N/A,N/A,N/A,N/A
"PSA-V",N/A,N/A,N/A,N/A,N/A,N/A,N/A,N/A,N/A
"PSA-W",N/A,N/A,N/A,N/A,N/A,N/A,N/A,N/A,N/A
"PSA-X",N/A,N/A,N/A,N/A,N/A,N/A,N/A,N/A,N/A
"PSA-Y",N/A,N/A,N/A,N/A,N/A,N/A,N/A,N/A,N/A
"PSA-Z",N/A,N/A,N/A,N/A,N/A,N/A,N/A,N/A,N/A
"PSB",114.26,113.94,"112.09 - 114.44",100,200,53902,100,"2:49pm - <b>113.99</b>","PS Business Parks, Inc. Common "
"PSB-S",N/A,N/A,N/A,N/A,N/A,N/A,N/A,N/A,N/A
"PSB-T",N/A,N/A,N/A,N/A,N/A,N/A,N/A,N/A,N/A
"PSB-U",N/A,N/A,N/A,N/A,N/A,N/A,N/A,N/A,N/A
"PSB-V",N/A,N/A,N/A,N/A,N/A,N/A,N/A,N/A,N/A
"PSF",26.83,26.80,"26.76 - 26.99",300,2000,58841,100,"2:55pm - <b>26.76</b>","Cohen & Steers Select Preferred"
"PSG",3.98,3.97,"3.92 - 4.07",900,3000,2648164,100,"2:55pm - <b>3.98</b>","Performance Sports Group Ltd. O"
"PSO",9.47,9.46,"9.39 - 9.51",2600,1400,681211,100,"2:55pm - <b>9.46</b>","Pearson, Plc Common Stock"
"PSTG",13.410,13.400,"13.360 - 13.810",1300,800,871306,100,"2:55pm - <b>13.405</b>","Pure Storage, Inc. Class A Comm"
"PSX",79.89,79.88,"79.45 - 80.27",400,300,1450073,100,"2:55pm - <b>79.87</b>","Phillips 66 Common Stock"
"PSXP",48.17,48.11,"47.32 - 48.18",100,300,234365,100,"2:55pm - <b>48.14</b>","Phillips 66 Partners LP Common "
"PTHN",29.51,29.48,"29.40 - 30.63",100,200,136223,100,"2:54pm - <b>29.63</b>","Patheon N.V. Ordinary shares, p"
"PTR",64.04,63.98,"63.85 - 64.44",200,200,55432,100,"2:54pm - <b>63.97</b>","PetroChina Company Limited Comm"
"PTY",14.6100,14.5700,"14.4900 - 14.6800",200,200,136145,100,"2:53pm - <b>14.6092</b>","Pimco Corporate & Income Opport"
"PUK",35.6800,35.6700,"35.4800 - 35.9000",1400,900,534425,393,"2:55pm - <b>35.6801</b>","Prudential Public Limited Compa"
"PUK-",N/A,N/A,N/A,N/A,N/A,N/A,N/A,N/A,N/A
"PUK-A",N/A,N/A,N/A,N/A,N/A,N/A,N/A,N/A,N/A
"PVG",10.63,10.62,"10.52 - 11.08",900,1600,866446,100,"2:55pm - <b>10.63</b>","Pretium Resources, Inc. Ordinar"
"PVH",106.08,106.04,"105.92 - 108.32",100,200,366855,100,"2:56pm - <b>105.95</b>","PVH Corp. Common Stock"
"PVTD",26.6500,26.4200,"26.3700 - 26.6360",100,400,7085,114,"2:23pm - <b>26.5868</b>","PrivateBancorp, Inc. 7.125% Sub"
"PWE",1.75,1.74,"1.74 - 1.81",64300,15800,1637448,100,"2:55pm - <b>1.75</b>","Penn West Petroleum Ltd"
"PWR",26.530,26.520,"26.030 - 26.695",1100,1400,1199036,100,"2:56pm - <b>26.525</b>","Quanta Services, Inc. Common St"
"PX",116.56,116.54,"116.48 - 117.40",300,300,782996,100,"2:55pm - <b>116.56</b>","Praxair, Inc. Common Stock"
"PXD",174.74,174.69,"174.68 - 177.25",100,700,780000,100,"2:55pm - <b>174.95</b>","Pioneer Natural Resources Compa"
"PYN",11.06,11.00,"10.98 - 11.07",600,300,8370,200,"12:24pm - <b>11.07</b>","PIMCO New York Municipal Income"
"PYS",25.3000,25.1800,"25.1800 - 25.4671",100,200,2748,1000,"1:50pm - <b>25.2229</b>","Merrill Lynch Depositor Inc PPl"
"PYT",21.0000,20.7000,"20.7106 - 20.7106",100,400,400,400,"10:47am - <b>20.7106</b>","PPlus Tr GSC-2 Tr Ctf Fltg Rate"
"PZC",12.80,12.79,"12.78 - 12.89",100,100,36446,200,"2:53pm - <b>12.78</b>","PIMCO California Municipal Inco"
"PZE",6.52,6.51,"6.46 - 6.56",200,500,208706,100,"2:41pm - <b>6.52</b>","Petrobras Argentina S.A. ADS"
"PZN",8.01,7.95,"7.38 - 8.09",100,100,12599,100,"2:46pm - <b>7.94</b>","Pzena Investment Management Inc"
"Q",79.16,79.13,"78.42 - 79.35",100,200,427872,100,"2:56pm - <b>79.15</b>","Quintiles Transnational Holding"
"QEP",18.24,18.23,"18.16 - 18.62",1100,1600,2752019,100,"2:55pm - <b>18.25</b>","QEP Resources, Inc. Common Stoc"
"QHC",6.05,6.03,"6.03 - 6.30",300,1400,203942,200,"2:55pm - <b>6.04</b>","Quorum Health Corporation Commo"
"QSR",44.72,44.71,"44.50 - 45.38",400,300,886880,300,"2:56pm - <b>44.71</b>","Restaurant Brands International"
"QTM",0.7568,0.7542,"0.7500 - 0.7700",2400,200,452973,100,"2:55pm - <b>0.7565</b>","Quantum Corporation Common Stoc"
"QTS",54.34,54.32,"54.05 - 54.45",200,200,92432,100,"2:56pm - <b>54.36</b>","QTS Realty Trust, Inc. Class A "
"QTWO",28.32,28.28,"27.91 - 28.33",200,200,178617,100,"2:51pm - <b>28.25</b>","Q2 Holdings, Inc. Common Stock"
"QUAD",25.95,25.92,"25.77 - 26.34",100,200,71427,100,"2:55pm - <b>25.95</b>","Quad Graphics, Inc Class A Comm"
"QUOT",13.06,13.05,"13.03 - 13.57",100,200,249811,100,"2:54pm - <b>13.06</b>","Quotient Technology Inc. Common"
"R",63.77,63.71,"62.70 - 64.06",300,200,225645,100,"2:56pm - <b>63.76</b>","Ryder System, Inc. Common Stock"
"RACE",50.35,50.31,"50.06 - 50.39",300,200,193151,100,"2:56pm - <b>50.34</b>","Ferrari N.V. Common Shares"
"RAD",8.06,8.05,"8.01 - 8.09",39000,38000,9231927,100,"2:56pm - <b>8.05</b>","Rite Aid Corporation Common Sto"
"RAI",47.860,47.850,"47.480 - 48.470",500,1000,2251231,100,"2:55pm - <b>47.855</b>","Reynolds American Inc Common St"
"RAS",3.37,3.36,"3.35 - 3.40",3600,11800,344161,100,"2:56pm - <b>3.36</b>","RAIT Financial Trust New Common"
"RAS-A",N/A,N/A,N/A,N/A,N/A,N/A,N/A,N/A,N/A
"RAS-B",N/A,N/A,N/A,N/A,N/A,N/A,N/A,N/A,N/A
"RAS-C",N/A,N/A,N/A,N/A,N/A,N/A,N/A,N/A,N/A
"RATE",8.08,8.07,"8.02 - 8.27",500,1800,323166,100,"2:55pm - <b>8.08</b>","Bankrate, Inc. Common Stock"
"RAX",31.57,31.56,"31.56 - 31.62",14900,12900,831548,100,"2:55pm - <b>31.56</b>","Rackspace Hosting, Inc Common S"
"RBA",34.55,34.52,"34.43 - 35.02",400,200,188215,100,"2:55pm - <b>34.52</b>","Ritchie Bros. Auctioneers Incor"
"RBC",58.28,58.24,"58.13 - 59.17",100,100,65299,100,"2:56pm - <b>58.28</b>","Regal Beloit Corporation Common"
"RBS",4.63,4.62,"4.60 - 4.66",24400,31000,1494003,100,"2:55pm - <b>4.63</b>","Royal Bank of Scotland Group Pl"
"RBS-F",N/A,N/A,N/A,N/A,N/A,N/A,N/A,N/A,N/A
"RBS-H",N/A,N/A,N/A,N/A,N/A,N/A,N/A,N/A,N/A
"RBS-L",N/A,N/A,N/A,N/A,N/A,N/A,N/A,N/A,N/A
"RBS-S",N/A,N/A,N/A,N/A,N/A,N/A,N/A,N/A,N/A
"RCI",42.23,42.21,"42.10 - 42.37",200,800,89129,300,"2:54pm - <b>42.22</b>","Rogers Communication, Inc. Comm"
"RCL",71.44,71.40,"70.74 - 73.38",300,200,2207910,100,"2:55pm - <b>71.45</b>","Royal Caribbean Cruises Ltd. Co"
"RCS",10.090,10.070,"10.050 - 10.130",400,2000,86861,1500,"2:55pm - <b>10.076</b>","PIMCO Strategic Income Fund, In"
"RDC",13.54,13.53,"13.17 - 13.85",800,1200,2755158,100,"2:55pm - <b>13.54</b>","Rowan Companies plc Class A Ord"
"RDN",13.55,13.54,"13.42 - 13.62",2800,2500,1047473,100,"2:56pm - <b>13.56</b>","Radian Group Inc. Common Stock"
"RDS.A",N/A,N/A,N/A,N/A,N/A,N/A,N/A,N/A,N/A
"RDS.B",N/A,N/A,N/A,N/A,N/A,N/A,N/A,N/A,N/A
